ts	experiment_id	metric_before	metric_after	delta	status	change_type	hypothesis	files_changed
2026-03-19T18:00:23.179717+00:00	exp_202603191800_bbe1	0.854850	0.854850	+0.000000	keep	skill	Adding a web search summarization skill can improve output quality and reduce redundant work across tasks	skills/web_search_summary.md
2026-03-19T18:01:27.563658+00:00	exp_202603191801_681a	0.854850	0.859850	+0.005000	keep	skill	Adding a web search summarization skill will improve output quality by reducing redundant information and presenting mor	skills/web_search_summarization.md
2026-03-19T18:01:42.308594+00:00	exp_202603191801_dc4c	0.859850	0.859850	+0.000000	keep	skill	Adding a skill for multi-step reasoning patterns will enhance the team's ability to handle complex tasks by breaking the	skills/multi_step_reasoning.md
2026-03-19T18:02:03.200155+00:00	exp_202603191802_4d2f	0.859850	0.859850	+0.000000	keep	skill	Adding a multi-step reasoning skill will improve complex task handling by breaking down problems into sequential steps	skills/multi_step_reasoning.md
2026-03-19T18:02:41.827233+00:00	exp_202603191802_dd98	0.859850	0.864850	+0.005000	keep	skill	Adding a multi-step reasoning skill will improve complex task handling and output quality by enabling logical decomposit	skills/multi_step_reasoning.md
2026-03-20T00:01:22.824015+00:00	exp_202603200001_ad57	0.864850	0.732500	-0.132350	discard	skill	Adding a prompt optimization skill will improve output quality by generating shorter, more accurate responses	skills/prompt_optimization.md
2026-03-20T00:02:04.233592+00:00	exp_202603200002_b4c8	0.727500	0.727500	+0.000000	keep	skill	Adding a skill for code execution error recovery and retry strategies will improve reliability in complex tasks by imple	skills/code_error_recovery.md
2026-03-20T00:03:01.866791+00:00	exp_202603200003_2014	0.727500	0.732500	+0.005000	keep	skill	Adding concise prompting skill will improve Signal message quality	skills/concise_prompting.md
2026-03-20T00:03:42.455675+00:00	exp_202603200003_3175	0.732500	0.737500	+0.005000	keep	skill	Adding a skill for better synthesis of multiple web search results will improve output quality by creating more comprehe	skills/search_synthesis.md
2026-03-20T00:04:42.360245+00:00	exp_202603200004_cf3d	0.737500	0.742500	+0.005000	keep	skill	Enhancing multi-step reasoning patterns will improve complex task handling with decomposition, verification, and error r	skills/enhanced_reasoning.md
2026-03-20T06:00:43.132942+00:00	exp_202603200600_d481	0.742500	0.752500	+0.010000	keep	skill	Adding a multi-perspective synthesis skill will improve output quality by better integrating diverse viewpoints from web	skills/multi_perspective_synthesis.md
2026-03-20T06:01:43.277695+00:00	exp_202603200601_8b1f	0.752500	0.757500	+0.005000	keep	skill	Adding memory retrieval optimization will improve output quality by reducing redundant queries while maintaining informa	skills/memory_retrieval_optimization.md
2026-03-20T06:02:23.076147+00:00	exp_202603200602_8f3f	0.757500	0.762500	+0.005000	keep	skill	Adding structured web search synthesis will improve output quality by better organizing and attributing information from	skills/web_search_synthesis.md
2026-03-20T06:03:03.176888+00:00	exp_202603200603_1cd2	0.762500	0.767500	+0.005000	keep	skill	Adding structured web reasoning will improve output quality by combining multi-step reasoning with synthesis of web sear	skills/structured_web_reasoning.md
2026-03-20T06:03:42.519164+00:00	exp_202603200603_e2e8	0.767500	0.772500	+0.005000	keep	skill	Adding optimized search timing will reduce unnecessary API calls while maintaining search relevance	skills/optimized_search_timing.md
2026-03-20T12:00:42.341299+00:00	exp_202603201200_d874	0.772500	0.777500	+0.005000	keep	skill	Adding contextual search filtering will improve output quality by focusing synthesis on the most relevant results, poten	skills/contextual_search_filtering.md
2026-03-20T12:01:23.058546+00:00	exp_202603201201_e140	0.777500	0.782500	+0.005000	keep	skill	Adding Signal-specific formatting will improve message quality on the Signal platform by optimizing for its display char	skills/signal_formatting.md
2026-03-20T12:02:23.068665+00:00	exp_202603201202_d7c3	0.782500	0.787500	+0.005000	keep	skill	Adding error recovery and retry strategies will improve system robustness when handling complex tasks	skills/error_recovery.md
2026-03-20T12:04:42.742687+00:00	exp_202603201204_c296	0.787500	0.797500	+0.010000	keep	skill	Adding information distillation skill will improve output quality by enabling agents to better synthesize complex inform	skills/information_distillation.md
2026-03-20T18:00:03.280739+00:00	exp_202603201800_9081	0.757877	0.757877	+0.000000	keep	skill	Adding a skill to handle empty LLM responses more gracefully will reduce the ValueError errors and improve system reliab	skills/empty_response_handling.md
2026-03-20T18:00:47.996631+00:00	exp_202603201800_93c8	0.757877	0.757877	+0.000000	keep	skill	Enhancing the existing fix_llm_empty_response with best practices like special character removal, query splitting, and p	skills/fix_llm_empty_response.md
2026-03-20T18:01:29.164870+00:00	exp_202603201801_e6cf	0.757877	0.757877	+0.000000	keep	skill	Enhancing the fix_llm_empty_response skill with more robust handling and clearer instructions will reduce recurring Valu	skills/fix_llm_empty_response.md
2026-03-20T18:02:07.439136+00:00	exp_202603201802_9eb2	0.757877	0.762877	+0.005000	keep	skill	Enhanced empty LLM response handling will reduce error rates and improve reliability	skills/llm_empty_response_recovery.md
2026-03-20T18:02:25.765306+00:00	exp_202603201802_55db	0.762877	0.762877	+0.000000	keep	skill	Adding a skill to better handle invalid LLM responses will reduce the remaining ValueError occurrences and improve syste	skills/llm_response_validation.md
2026-03-21T00:00:43.226154+00:00	exp_202603210000_b81e	0.762877	0.729835	-0.033042	discard	skill	Enhanced LLM response validation will significantly reduce error rates by catching invalid responses earlier and handlin	skills/llm_response_validation.md
2026-03-21T00:01:07.376143+00:00	exp_202603210001_581d	0.724835	0.724835	+0.000000	keep	skill	Adding a skill to validate LLM responses before processing will reduce ValueError and BadRequestError occurrences by cat	skills/llm_response_validation.md
2026-03-21T00:01:43.826554+00:00	exp_202603210001_cec3	0.724835	0.724835	+0.000000	keep	skill	Adding a skill to handle Google Gemini API errors specifically will reduce error rates for BadRequestError cases, as the	skills/gemini_error_handling.md
2026-03-21T00:02:43.811277+00:00	exp_202603210002_b555	0.724835	0.729835	+0.005000	keep	skill	Adding specific error handling for Google Gemini API errors will reduce BadRequestError occurrences	skills/gemini_api_error_handling.md
2026-03-21T00:49:43.920850+00:00	exp_202603210049_0aff	0.750192	0.750192	+0.000000	keep	skill	Adding a skill to better handle and recover from ValueError exceptions during LLM calls will reduce error rates and impr	skills/llm_valueerror_recovery.md
2026-03-21T00:50:03.786748+00:00	exp_202603210050_1a60	0.750192	0.750192	+0.000000	keep	skill	Adding a skill to better handle and recover from ValueError and BadRequestError specifically for Google Gemini API error	skills/gemini_error_recovery.md
2026-03-21T00:50:56.163258+00:00	exp_202603210050_54d8	0.750192	0.750192	+0.000000	keep	skill	Adding a skill to handle Google Gemini API errors more effectively will reduce recurring BadRequestError instances and i	skills/gemini_api_error_recovery.md
2026-03-21T00:51:34.241677+00:00	exp_202603210051_4579	0.750192	0.750192	+0.000000	keep	skill	Enhanced Gemini API error handling will reduce BadRequestError and ValueError rates by adding context-awareness and smar	skills/gemini_api_error_handling.md
2026-03-21T00:52:15.700137+00:00	exp_202603210052_abac	0.750192	0.750192	+0.000000	keep	skill	Enhancing LLM response validation will reduce ValueError occurrences due to invalid or empty responses, improving system	skills/enhanced_llm_response_validation.md
2026-03-21T00:53:00.936702+00:00	exp_202603210053_34c3	0.750192	0.750192	+0.000000	keep	skill	Enhanced error recovery with retry logic and detailed error handling will reduce recurring ValueError and BadRequestErro	skills/robust_error_recovery.md
2026-03-21T00:53:17.356220+00:00	exp_202603210053_f40f	0.750192	0.750192	+0.000000	keep	skill	Enhanced LLM response validation with stricter emptiness checks will prevent None/empty errors by catching them earlier 	skills/improved_llm_response_validation.md
2026-03-21T00:54:19.687827+00:00	exp_202603210054_a384	0.750192	0.750192	+0.000000	keep	skill	Adding a skill to handle empty or invalid LLM responses more effectively will reduce the occurrences of ValueError and B	skills/error_recovery_llm_response.md
2026-03-21T00:54:47.285274+00:00	exp_202603210054_3793	0.750192	0.750192	+0.000000	keep	skill	Adding a skill to better handle and recover from ValueError and BadRequestError in LLM calls will reduce error rates and	skills/llm_error_recovery.md
2026-03-21T00:54:53.374732+00:00	exp_202603210054_f0e1	0.750192	0.750192	+0.000000	keep	skill	Adding a skill to better handle and recover from empty or invalid LLM responses will reduce the recurring ValueError err	skills/llm_response_validation.md
2026-03-21T00:55:52.838564+00:00	exp_202603210055_067e	0.750192	0.750192	+0.000000	keep	skill	Adding a skill to better handle and recover from ValueError and BadRequestError in research and task handling will reduc	skills/error_handling_research_task.md
2026-03-21T01:03:35.585973+00:00	exp_202603210103_cd2c	0.750192	0.750192	+0.000000	keep	skill	Adding a skill to better handle and recover from BadRequestError from Gemini API calls will reduce error rates and impro	skills/gemini_badrequest_recovery.md
2026-03-21T01:04:22.026961+00:00	exp_202603210104_7fb8	0.750192	0.000000	+0.000000	pending	code	Simplifying the enhanced_error_recovery skill by removing redundant retry logic and improving error message parsing will	
2026-03-21T01:05:27.883893+00:00	exp_202603210105_59fa	0.750192	0.750192	+0.000000	keep	skill	Adding a skill to better handle and recover from Gemini API specific errors will reduce the BadRequestError occurrences,	skills/gemini_api_error_recovery.md
2026-03-21T01:06:57.025107+00:00	exp_202603210106_7dc0	0.750192	0.750192	+0.000000	keep	skill	Consolidating and enhancing LLM error handling will reduce recurring ValueError and BadRequestError instances by providi	skills/llm_error_handling.md
2026-03-21T01:07:47.628322+00:00	exp_202603210107_661e	0.750192	0.750192	+0.000000	keep	skill	Creating a consolidated LLM response validation skill that combines empty response checks with structured validation to 	skills/consolidated_llm_validation.md
2026-03-21T01:09:07.365105+00:00	exp_202603210109_d6b0	0.750192	0.750192	+0.000000	keep	skill	Consolidating Gemini API error handling will reduce recurring ValueError and BadRequestError cases while simplifying the	skills/gemini_error_consolidation.md
2026-03-21T01:09:51.763294+00:00	exp_202603210109_c5cc	0.750192	0.750192	+0.000000	keep	skill	Consolidating LLM response validation and Gemini API error handling into a single comprehensive skill will reduce recurr	skills/llm_gemini_response_validation.md
2026-03-21T01:17:36.839531+00:00	exp_202603210117_91d8	0.750192	0.750192	+0.000000	keep	skill	Improving multi-step reasoning patterns for complex tasks will enhance the team's ability to handle intricate user reque	skills/enhanced_multi_step_reasoning.md
2026-03-21T01:17:59.243812+00:00	exp_202603210117_48bc	0.750192	0.750192	+0.000000	keep	skill	Creating a consolidated error handling skill for both ValueError and BadRequestError cases will reduce recurring errors 	skills/consolidated_api_error_handling.md
2026-03-21T01:18:19.404569+00:00	exp_202603210118_326a	0.750192	0.750192	+0.000000	keep	skill	Creating a consolidated error handling skill for both ValueError and BadRequestError from LLM calls will reduce recurrin	skills/llm_error_recovery.md
2026-03-21T01:18:38.936848+00:00	exp_202603210118_ca66	0.750192	0.750192	+0.000000	keep	skill	Creating a consolidated skill to handle both ValueError and BadRequestError from LLM calls will reduce recurring errors 	skills/llm_error_consolidation.md
2026-03-21T01:19:01.735478+00:00	exp_202603210119_3611	0.750192	0.750192	+0.000000	keep	skill	Consolidating existing error handling skills into a single comprehensive skill will reduce complexity while maintaining 	skills/comprehensive_error_handling.md
2026-03-21T01:19:59.142787+00:00	exp_202603210119_f53a	0.750192	0.750192	+0.000000	keep	skill	Creating a consolidated error handling skill for both ValueError and BadRequestError from LLM calls will reduce recurrin	skills/consolidated_llm_error_handling.md
2026-03-21T01:20:37.863697+00:00	exp_202603210120_28a0	0.750192	0.750192	+0.000000	keep	skill	Adding LLM response prevalidation will prevent downstream errors by validating responses earlier in the process	skills/llm_response_prevalidation.md
2026-03-21T01:20:58.949057+00:00	exp_202603210120_3779	0.750192	0.750192	+0.000000	keep	skill	Creating a consolidated error handling skill for both ValueError and BadRequestError from LLM calls will reduce recurrin	skills/llm_error_consolidation.md
2026-03-21T01:21:20.952177+00:00	exp_202603210121_bce1	0.750192	0.750192	+0.000000	keep	skill	Creating a consolidated error handling skill for both ValueError and BadRequestError from Gemini API will reduce recurri	skills/gemini_error_consolidation.md
2026-03-21T01:22:19.792988+00:00	exp_202603210122_ecda	0.750192	0.750192	+0.000000	keep	skill	Consolidating LLM response validation will reduce empty/invalid response errors by 25%	skills/llm_response_consolidation.md
2026-03-21T01:29:39.396906+00:00	exp_202603210129_c1de	0.750192	0.750192	+0.000000	keep	skill	Improving web search result synthesis and summarization will enhance information extraction quality without adding compl	skills/web_search_synthesis.md
2026-03-21T01:30:00.989396+00:00	exp_202603210130_78ab	0.750192	0.750192	+0.000000	keep	skill	Creating a consolidated error handling skill for both ValueError and BadRequestError from LLM calls will reduce error ra	skills/llm_error_consolidation.md
2026-03-21T01:30:40.706307+00:00	exp_202603210130_6633	0.750192	0.750192	+0.000000	keep	skill	Creating a more robust empty LLM response handling skill will reduce the recurring ValueError/BadRequestError patterns	skills/llm_empty_response_recovery_v2.md
2026-03-21T01:31:19.782592+00:00	exp_202603210131_2047	0.750192	0.750192	+0.000000	keep	skill	Creating a skill to handle Gemini API errors more effectively will reduce BadRequestError occurrences and improve task s	skills/gemini_api_error_recovery.md
2026-03-21T01:32:40.572747+00:00	exp_202603210132_6653	0.750192	0.750192	+0.000000	keep	skill	Consolidating and improving LLM error handling will reduce recurring ValueError and BadRequestError rates	skills/better_llm_error_handling.md
2026-03-21T01:33:40.558422+00:00	exp_202603210133_15ad	0.750192	0.750192	+0.000000	keep	skill	Creating a more comprehensive LLM response validation skill will reduce recurring ValueError and BadRequestError cases b	skills/llm_response_validation_v2.md
2026-03-21T01:34:20.267726+00:00	exp_202603210134_b01c	0.750192	0.750192	+0.000000	keep	skill	Consolidating all LLM response handling into a single comprehensive skill will reduce error rate by eliminating fragment	skills/comprehensive_llm_response_handling.md
2026-03-21T01:34:41.282437+00:00	exp_202603210134_23e1	0.750192	0.750192	+0.000000	keep	skill	Creating a consolidated skill for handling both ValueError and BadRequestError from LLM calls will reduce error rates by	skills/llm_error_consolidation.md
2026-03-21T01:39:21.635124+00:00	exp_202603210139_5232	0.750192	0.750192	+0.000000	keep	skill	Creating a skill to handle Gemini API rate limits and quota errors will reduce BadRequestError occurrences, which curren	skills/gemini_rate_limit_handling.md
2026-03-21T01:40:28.861111+00:00	exp_202603210140_e7f5	0.750192	0.750192	+0.000000	keep	skill	Creating a consolidated skill for handling all LLM response errors will reduce recurring errors and improve system relia	skills/consolidated_llm_error_handling.md
2026-03-21T01:41:20.960903+00:00	exp_202603210141_6bbb	0.750192	0.750192	+0.000000	keep	skill	Adding comprehensive LLM response validation before processing will prevent ValueError and BadRequestError by catching i	skills/llm_response_validation_v3.md
2026-03-21T01:41:41.730422+00:00	exp_202603210141_667c	0.750192	0.750192	+0.000000	keep	skill	Creating a skill to handle both ValueError and BadRequestError from LLM calls in a unified way will reduce error rate by	skills/unified_llm_error_handling.md
2026-03-21T01:43:21.834700+00:00	exp_202603210143_e91c	0.750192	0.750192	+0.000000	keep	skill	Consolidated all LLM response validation into a single comprehensive skill to eliminate recurring ValueError and BadRequ	skills/ultimate_llm_response_validation.md
2026-03-21T01:43:49.912378+00:00	exp_202603210143_7db4	0.750192	0.750192	+0.000000	keep	skill	Creating a comprehensive LLM response validation skill that explicitly handles both ValueError and BadRequestError cases	skills/comprehensive_llm_response_validation.md
2026-03-21T01:44:01.101653+00:00	exp_202603210144_9910	0.750192	0.750192	+0.000000	keep	skill	Creating a consolidated skill for handling both ValueError and BadRequestError from LLM calls will reduce error rates by	skills/llm_error_consolidation.md
2026-03-21T01:44:40.865955+00:00	exp_202603210144_802b	0.750192	0.750192	+0.000000	keep	skill	Combining all LLM response validation checks into a single comprehensive skill with better error recovery will reduce th	skills/ultimate_llm_response_validation.md
2026-03-21T01:45:20.409975+00:00	exp_202603210145_a1fa	0.750192	0.750192	+0.000000	keep	skill	Creating a comprehensive LLM empty response validation skill to handle None or empty responses, which are causing ValueE	skills/llm_empty_response_validation.md
2026-03-21T01:51:24.608850+00:00	exp_202603210151_8f6f	0.750192	0.750192	+0.000000	keep	skill	Creating a consolidated skill for handling both ValueError and BadRequestError from LLM calls with empty responses will 	skills/llm_empty_response_consolidated.md
2026-03-21T01:51:58.786854+00:00	exp_202603210151_33b6	0.750192	0.750192	+0.000000	keep	skill	Improving LLM response handling by consolidating best practices for empty or invalid responses will reduce errors.	skills/comprehensive_llm_response_handling_v2.md
2026-03-21T01:52:56.860081+00:00	exp_202603210152_35b1	0.750192	0.750192	+0.000000	keep	skill	Consolidating LLM empty response and Gemini API error handling into a single comprehensive skill will simplify the syste	skills/comprehensive_llm_error_handling_v2.md
2026-03-21T01:53:22.551849+00:00	exp_202603210153_b4f5	0.750192	0.750192	+0.000000	keep	skill	Consolidating LLM error handling into a single comprehensive skill with retry logic and fallback mechanisms will reduce 	skills/comprehensive_llm_error_handler_v3.md
2026-03-21T01:53:37.062076+00:00	exp_202603210153_6fb6	0.750192	0.750192	+0.000000	keep	skill	Adding a skill to handle Gemini API-specific errors will reduce recurring BadRequestError occurrences and improve error 	skills/gemini_api_error_recovery.md
2026-03-21T01:54:38.423739+00:00	exp_202603210154_0397	0.750192	0.750192	+0.000000	keep	skill	Creating a consolidated error handling skill for both ValueError and BadRequestError cases will reduce error rates by pr	skills/unified_llm_error_handling.md
2026-03-21T01:55:17.198245+00:00	exp_202603210155_17ad	0.750192	0.750192	+0.000000	keep	skill	Creating a dedicated Gemini API error recovery skill will reduce BadRequestError impact and improve task success rate	skills/geminierrorrecovery.md
2026-03-21T01:55:58.941138+00:00	exp_202603210155_314e	0.750192	0.750192	+0.000000	keep	skill	Improving error handling by optimizing when the comprehensive_llm_error_handling_v2 skill is invoked will reduce both Va	skills/optimized_error_handling_usage.md
2026-03-21T01:56:37.543141+00:00	exp_202603210156_3be0	0.750192	0.750192	+0.000000	keep	skill	Consolidating all LLM error handling into a single comprehensive skill will eliminate persistent errors while reducing c	skills/comprehensive_llm_error_handling_v3.md
2026-03-21T01:56:58.373632+00:00	exp_202603210156_c6b2	0.750192	0.750192	+0.000000	keep	skill	Creating a dedicated skill for handling Gemini API-specific errors will reduce the recurrence of BadRequestError instanc	skills/gemini_api_error_handling_v2.md
2026-03-21T02:06:03.633906+00:00	exp_202603210206_bcbe	0.750192	0.750192	+0.000000	keep	skill	Creating a dedicated skill for handling empty LLM responses and Gemini API errors will reduce the recurring ValueError a	skills/llm_empty_gemini_error_handling.md
2026-03-21T02:07:23.369949+00:00	exp_202603210207_c0d0	0.750192	0.750192	+0.000000	keep	skill	Implementing a more robust skill for handling empty LLM responses will reduce errors and improve reliability.	skills/robust_empty_response_handling.md
2026-03-21T02:08:04.811988+00:00	exp_202603210208_cbf3	0.750192	0.750192	+0.000000	keep	skill	Consolidating and improving all LLM response validation into a single comprehensive skill will reduce recurrent errors '	skills/consolidated_llm_response_validation_v2.md
2026-03-21T02:08:42.773901+00:00	exp_202603210208_317a	0.750192	0.750192	+0.000000	keep	skill	Creating a dedicated skill for handling Gemini API rate limit errors will reduce the recurring BadRequestError occurrenc	skills/gemini_rate_limit_handling.md
