ts	experiment_id	metric_before	metric_after	delta	status	change_type	hypothesis	files_changed
2026-03-21T02:10:43.180990+00:00	exp_202603210210_ad1c	0.750192	0.750192	+0.000000	keep	skill	Improving the handling of empty LLM responses by creating a dedicated skill that specifically addresses and recovers fro	skills/enhanced_empty_response_handling.md
2026-03-21T02:11:24.331133+00:00	exp_202603210211_4729	0.750192	0.750192	+0.000000	keep	skill	Adding root-cause level error handling for Gemini API specific errors will prevent downstream error propagation and impr	skills/gemini_error_root_cause.md
2026-03-21T02:12:02.900335+00:00	exp_202603210212_2dae	0.750192	0.750192	+0.000000	keep	skill	The existing comprehensive error handling skill may not be properly invoked due to unclear triggers. Adding explicit inv	skills/explicit_error_handler.md
2026-03-21T02:12:29.855205+00:00	exp_202603210212_5f54	0.750192	0.750192	+0.000000	keep	skill	Creating a dedicated skill for handling Gemini API empty responses will reduce the recurring ValueError errors by provid	skills/gemini_empty_response_handler.md
2026-03-21T02:21:53.457426+00:00	exp_202603210221_6d86	0.750192	0.750192	+0.000000	keep	skill	Improve LLM response validation to handle empty or invalid responses more robustly, reducing recurring ValueError and Ba	skills/enhanced_llm_response_validation_v2.md
2026-03-21T02:22:30.458696+00:00	exp_202603210222_95fe	0.750192	0.750192	+0.000000	keep	skill	Despite comprehensive error handling, empty LLM responses still occur due to validation logic gaps. Adding a pre-emptive	skills/preemptive_llm_response_check.md
2026-03-21T02:23:09.471167+00:00	exp_202603210223_30da	0.750192	0.750192	+0.000000	keep	skill	Adding pre-call validation will reduce empty/null LLM responses by catching invalid requests before they're made	skills/pre_call_llm_validation.md
2026-03-21T02:25:50.560505+00:00	exp_202603210225_c99f	0.750192	0.750192	+0.000000	keep	skill	Creating a dedicated skill for Gemini API error recovery and retry strategies will reduce the occurrence of unhandled er	skills/gemini_api_error_recovery.md
2026-03-21T02:26:30.222688+00:00	exp_202603210226_6a24	0.750192	0.750192	+0.000000	keep	skill	Existing error handling skills aren't catching all empty response cases because they don't properly validate tool output	skills/tool_output_validation.md
2026-03-21T02:26:49.645910+00:00	exp_202603210226_6799	0.750192	0.750192	+0.000000	keep	skill	Create a dedicated skill for handling Gemini API rate limit errors specifically, as they appear to be a recurring issue 	skills/gemini_rate_limit_handling.md
2026-03-21T02:27:29.638314+00:00	exp_202603210227_d1ee	0.750192	0.750192	+0.000000	keep	skill	Enhanced LLM response validation and recovery to reduce recurring errors related to empty or invalid responses	skills/enhanced_llm_response_validation_v3.md
2026-03-21T02:27:50.343077+00:00	exp_202603210227_4f8f	0.750192	0.750192	+0.000000	keep	skill	Create a dedicated skill for handling Gemini API empty responses and invalid formats, as these are recurring error patte	skills/gemini_empty_invalid_response_handler.md
2026-03-21T02:36:16.331739+00:00	exp_202603210236_acc0	0.750192	0.750192	+0.000000	keep	skill	Handle empty/null responses from Gemini API with automatic retry logic and fallback strategies to reduce undiagnosed err	skills/gemini_empty_response_recovery.md
2026-03-21T02:36:58.002801+00:00	exp_202603210236_003c	0.750192	0.750192	+0.000000	keep	skill	Consolidating multiple Gemini error handling skills into one comprehensive solution will reduce code duplication and imp	skills/consolidated_gemini_error_handling.md
2026-03-21T02:38:58.413902+00:00	exp_202603210238_f497	0.750192	0.750192	+0.000000	keep	skill	Enhancing LLM response handling to better manage empty or invalid responses from Gemini API will reduce recurring errors	skills/enhanced_llm_response_validation_v4.md
2026-03-21T02:40:17.067406+00:00	exp_202603210240_02fa	0.750192	0.750192	+0.000000	keep	skill	LLM response validation will reduce ValueErrors and BadRequestErrors by catching invalid responses early	skills/llm_response_validation_v4.md
2026-03-21T02:40:57.632157+00:00	exp_202603210240_c3e9	0.750192	0.750192	+0.000000	keep	skill	Enhance LLM response validation to handle edge cases and reduce recurring ValueErrors/BadRequestErrors	skills/llm_response_validation_v4.md
2026-03-21T02:41:18.188916+00:00	exp_202603210241_5c37	0.750192	0.750192	+0.000000	keep	skill	Create a dedicated skill for handling LLM response validation with specific focus on Gemini API error patterns, since re	skills/gemini_response_validation.md
2026-03-21T02:42:17.402873+00:00	exp_202603210242_aec5	0.750192	0.750192	+0.000000	keep	skill	Consolidated Gemini API error handling with enhanced empty response detection and exponential backoff retry strategy wil	skills/gemini_api_error_recovery_v2.md
2026-03-21T02:42:38.851406+00:00	exp_202603210242_b0d9	0.750192	0.750192	+0.000000	keep	skill	Consolidating multiple LLM response validation skills into one will simplify the codebase while maintaining error handli	skills/unified_llm_response_validation.md
2026-03-21T02:49:59.057534+00:00	exp_202603210249_2289	0.750192	0.750192	+0.000000	keep	skill	Consolidating multiple LLM response validation approaches into a single comprehensive skill will reduce ValueError and B	skills/universal_llm_response_validation.md
2026-03-21T02:51:19.865042+00:00	exp_202603210251_f335	0.750192	0.750192	+0.000000	keep	skill	Combining validation, retry logic and fallback behavior in a single comprehensive handler will reduce LLM-related ValueE	skills/robust_llm_response_handler.md
2026-03-21T02:51:39.473877+00:00	exp_202603210251_7b8b	0.750192	0.750192	+0.000000	keep	skill	Create a dedicated skill for handling LLM API timeout errors, which are currently causing BadRequestErrors and ValueErro	skills/llm_timeout_error_handling.md
2026-03-21T02:52:41.494227+00:00	exp_202603210252_79a6	0.750192	0.750192	+0.000000	keep	skill	Implementing a comprehensive retry strategy with exponential backoff and validation steps before retrying will reduce LL	skills/llm_retry_strategy.md
2026-03-21T02:53:30.074190+00:00	exp_202603210253_4b04	0.750192	0.750192	+0.000000	keep	skill	Create a dedicated skill for handling Gemini API empty responses and BadRequest errors, consolidating the existing error	skills/gemini_api_error_recovery.md
2026-03-21T02:53:57.876976+00:00	exp_202603210253_24b1	0.750192	0.750192	+0.000000	keep	skill	Creating a dedicated skill for handling Gemini API empty responses and invalid formats will reduce the recurring ValueEr	skills/gemini_response_validation.md
2026-03-21T02:55:09.386255+00:00	exp_202603210255_2527	0.750192	0.750192	+0.000000	keep	skill	Consolidating Gemini API error handling into a single, comprehensive skill will reduce recurring errors and improve reli	skills/consolidated_gemini_empty_response_handling.md
2026-03-21T02:55:49.267514+00:00	exp_202603210255_0ed8	0.750192	0.750192	+0.000000	keep	skill	Creating a comprehensive Gemini API error recovery skill to address empty and invalid response errors, implementing expo	skills/gemini_api_error_recovery.md
2026-03-21T03:01:37.577893+00:00	exp_202603210301_8932	0.750192	0.750192	+0.000000	keep	skill	Consolidating null/empty LLM response handling into a single comprehensive skill will improve reliability and reduce Val	skills/comprehensive_null_response_handling.md
2026-03-21T03:02:11.716105+00:00	exp_202603210302_c6dc	0.750192	0.750192	+0.000000	keep	skill	Consolidating and enhancing empty response handling into a single comprehensive skill will reduce errors from None/empty	skills/consolidated_empty_response_handling_v2.md
2026-03-21T03:02:32.326088+00:00	exp_202603210302_e6c4	0.750192	0.750192	+0.000000	keep	skill	Create a dedicated skill for handling LLM API timeout errors with exponential backoff, as recent errors show recurring t	skills/llm_timeout_handling_with_backoff.md
2026-03-21T03:03:50.615445+00:00	exp_202603210303_c9f6	0.750192	0.750192	+0.000000	keep	skill	Creating a comprehensive Gemini API error handling skill will reduce recurring ValueError and BadRequestError incidents	skills/comprehensive_gemini_error_handling_v2.md
2026-03-21T03:05:51.528610+00:00	exp_202603210305_1974	0.750192	0.750192	+0.000000	keep	skill	Consolidating Gemini API error handling into a comprehensive v3 skill will reduce duplicate code and improve reliability	skills/comprehensive_gemini_error_handling_v3.md
2026-03-21T03:06:15.442811+00:00	exp_202603210306_d5fd	0.750192	0.750192	+0.000000	keep	skill	Consolidating LLM response validation, empty response handling, and error recovery into a single comprehensive skill wil	skills/comprehensive_llm_response_handling_v4.md
2026-03-21T03:07:09.660820+00:00	exp_202603210307_d033	0.750192	0.750192	+0.000000	keep	skill	Consolidating and optimizing Gemini error handling into a single skill will reduce complexity and improve recovery effic	skills/optimized_gemini_error_handling_v4.md
2026-03-21T03:15:43.623517+00:00	exp_202603210315_53a8	0.750192	0.750192	+0.000000	keep	skill	Creating a dedicated skill for handling LLM API BadRequestError responses will improve error recovery and reduce the fre	skills/llm_badrequest_error_handling.md
2026-03-21T03:16:24.300835+00:00	exp_202603210316_f7b7	0.750192	0.750192	+0.000000	keep	skill	Creating a comprehensive LLM response handling skill that combines and enhances existing capabilities to specifically ad	skills/comprehensive_llm_response_handling_v4.md
2026-03-21T03:17:43.286681+00:00	exp_202603210317_9091	0.750192	0.750192	+0.000000	keep	skill	Implementing intelligent error recovery strategies will reduce LLM-related errors and improve system stability	skills/intelligent_llm_error_recovery.md
2026-03-21T03:18:43.659373+00:00	exp_202603210318_7f24	0.750192	0.750192	+0.000000	keep	skill	Implementing intelligent response recovery patterns will reduce error rates by handling empty responses and BadRequestEr	skills/intelligent_response_recovery.md
2026-03-21T03:20:33.263107+00:00	exp_202603210320_e126	0.750192	0.750192	+0.000000	keep	skill	Implementing intelligent retry strategies with exponential backoff will reduce API call failures and improve reliability	skills/intelligent_llm_api_retries.md
2026-03-21T03:20:53.236172+00:00	exp_202603210320_e2bc	0.750192	0.750192	+0.000000	keep	skill	Creating a dedicated skill for handling empty/None LLM responses will reduce the recurring ValueError errors and improve	skills/dedicated_empty_response_handler.md
2026-03-21T03:21:35.823193+00:00	exp_202603210321_4a69	0.750192	0.750192	+0.000000	keep	skill	Adding pre-response content validation will catch empty/None LLM responses earlier, reducing ValueError occurrence	skills/pre_response_validation.md
2026-03-21T03:21:58.887001+00:00	exp_202603210321_59a2	0.750192	0.750192	+0.000000	keep	skill	Implementing intelligent LLM response recovery strategies will reduce error rates and improve task success by better han	skills/llm_response_recovery.md
2026-03-21T03:28:34.344412+00:00	exp_202603210328_f7e1	0.750192	0.750192	+0.000000	keep	skill	Creating a more comprehensive LLM error recovery skill will reduce recurring errors by combining validation, analysis, r	skills/comprehensive_llm_error_recovery_v2.md
2026-03-21T03:29:00.385298+00:00	exp_202603210329_ddd9	0.750192	0.750192	+0.000000	keep	skill	Creating a dedicated skill for handling Gemini API-specific error patterns will reduce the recurring BadRequestError ins	skills/gemini_api_error_handler.md
2026-03-21T03:29:14.179024+00:00	exp_202603210329_acb8	0.750192	0.750192	+0.000000	keep	skill	Creating a dedicated skill for handling Gemini API-specific empty responses will reduce the recurring ValueError errors 	skills/gemini_empty_response_handler.md
2026-03-21T03:29:53.601769+00:00	exp_202603210329_5978	0.750192	0.750192	+0.000000	keep	skill	Adding a skill to validate LLM responses before processing will prevent 'Invalid response from LLM call - None or empty'	skills/llm_response_validation_v3.md
2026-03-21T03:31:15.100744+00:00	exp_202603210331_55a5	0.750192	0.750192	+0.000000	keep	skill	Creating a dedicated skill for handling Gemini API-specific empty responses will reduce the recurring 'Invalid response 	skills/gemini_empty_response_handler.md
2026-03-21T03:31:54.043731+00:00	exp_202603210331_8f7c	0.750192	0.750192	+0.000000	keep	skill	Adding early response validation will prevent downstream errors from invalid LLM responses by catching issues before pro	skills/early_llm_response_validation.md
2026-03-21T03:32:34.909061+00:00	exp_202603210332_d087	0.750192	0.750192	+0.000000	keep	skill	Adding pre-call validation and immediate post-call checks will prevent LLM response errors from propagating	skills/immediate_llm_error_prevention.md
2026-03-21T03:33:13.082061+00:00	exp_202603210333_a66c	0.750192	0.750192	+0.000000	keep	skill	Adding comprehensive schema validation and improved error recovery will reduce LLM-related ValueErrors and BadRequestErr	skills/comprehensive_llm_response_validation_v5.md
2026-03-21T03:34:14.623121+00:00	exp_202603210334_6b8d	0.750192	0.750192	+0.000000	keep	skill	Creating an enhanced Gemini error handling skill will reduce recurring ValueErrors and BadRequestErrors by improving res	skills/gemini_error_handling_v4.md
2026-03-21T03:42:32.218214+00:00	exp_202603210342_bb0c	0.750192	0.750192	+0.000000	keep	skill	Adding dedicated retry logic for empty/none LLM responses will prevent downstream errors	skills/auto_retry_empty_llm_response.md
2026-03-21T03:43:07.948194+00:00	exp_202603210343_459a	0.750192	0.750192	+0.000000	keep	skill	Creating a dedicated skill for improving Gemini API error handling will reduce the recurring BadRequestError instances r	skills/improved_gemini_error_handling_v4.md
2026-03-21T03:44:06.935227+00:00	exp_202603210344_9f3c	0.750192	0.750192	+0.000000	keep	skill	Consolidating multiple LLM error handling skills into a single unified implementation will reduce code complexity while 	skills/unified_llm_error_handling.md
2026-03-21T03:45:47.871366+00:00	exp_202603210345_48e4	0.750192	0.750192	+0.000000	keep	skill	Creating a robust error handling skill for Gemini API calls will reduce ValueError and BadRequestError occurrences and i	skills/gemini_api_robust_error_handling.md
2026-03-21T03:46:47.789655+00:00	exp_202603210346_f659	0.750192	0.750192	+0.000000	keep	skill	Consolidating empty response handling into a dedicated Gemini-specific skill will reduce error rate by providing structu	skills/gemini_empty_response_recovery.md
2026-03-21T03:47:27.322711+00:00	exp_202603210347_aa19	0.750192	0.750192	+0.000000	keep	skill	Adding early response validation will prevent downstream errors from invalid LLM responses, particularly for Gemini API	skills/llm_response_preprocessing.md
2026-03-21T03:48:09.414225+00:00	exp_202603210348_086d	0.750192	0.750192	+0.000000	keep	skill	Creating a dedicated skill for handling empty LLM responses will reduce the recurring ValueError occurrences by 30%	skills/llm_empty_response_handler_v3.md
2026-03-21T03:58:12.724214+00:00	exp_202603210358_6a25	0.750192	0.750192	+0.000000	keep	skill	Creating a dedicated skill for handling ValueError and BadRequestError exceptions will reduce recurring errors and impro	skills/comprehensive_error_handling_v6.md
2026-03-21T03:59:16.539872+00:00	exp_202603210359_a368	0.750192	0.750192	+0.000000	keep	skill	Removing redundant older error handling skills since comprehensive_llm_error_handling_v3 covers all cases will reduce co	skills/comprehensive_llm_error_handling_v3.md
2026-03-21T03:59:54.066659+00:00	exp_202603210359_c2aa	0.750192	0.750192	+0.000000	keep	skill	Creating a dedicated skill for handling ValueError and BadRequestError specifically for Gemini API calls will reduce the	skills/gemini_api_error_handling_v4.md
2026-03-21T04:01:33.501092+00:00	exp_202603210401_763a	0.750192	0.750192	+0.000000	keep	skill	Creating a dedicated skill for handling Gemini API empty responses and BadRequest errors will consolidate error handling	skills/consolidated_gemini_error_handling_v4.md
2026-03-21T04:02:33.523571+00:00	exp_202603210402_a61b	0.750192	0.750192	+0.000000	keep	skill	Creating targeted Gemini API empty response handling skill will reduce ValueErrors and BadRequestErrors by catching thes	skills/gemini_empty_response_recovery.md
2026-03-21T04:02:57.645879+00:00	exp_202603210402_824b	0.750192	0.750192	+0.000000	keep	skill	Creating a dedicated skill for handling Gemini API errors will reduce ValueError and BadRequestError rates	skills/targeted_gemini_error_handling.md
2026-03-21T04:03:37.164808+00:00	exp_202603210403_a648	0.750192	0.750192	+0.000000	keep	skill	Consolidating Gemini API error handling into a single comprehensive skill will reduce error rate by handling both empty 	skills/consolidated_gemini_error_handling_v4.md
2026-03-21T04:03:53.970280+00:00	exp_202603210403_5fc3	0.750192	0.750192	+0.000000	keep	skill	Creating a dedicated skill for handling both ValueError and BadRequestError in a single comprehensive handler will reduc	skills/consolidated_llm_error_recovery_v3.md
2026-03-21T04:14:40.075035+00:00	exp_202603210414_d355	0.750192	0.750192	+0.000000	keep	skill	Adding early response validation before Gemini API calls will prevent downstream errors	skills/early_gemini_response_validation.md
2026-03-21T04:15:39.019779+00:00	exp_202603210415_ae75	0.750192	0.750192	+0.000000	keep	skill	Creating a more comprehensive Gemini API response validation skill will reduce ValueError and BadRequestError rates by i	skills/gemini_api_response_validation.md
2026-03-21T04:15:59.613868+00:00	exp_202603210415_6b67	0.750192	0.750192	+0.000000	keep	skill	Creating a dedicated skill for handling both ValueError and BadRequestError from LLM calls in a single comprehensive han	skills/comprehensive_llm_error_handling_v4.md
2026-03-21T04:16:39.225637+00:00	exp_202603210416_1e59	0.750192	0.750192	+0.000000	keep	skill	Enhanced Gemini API response validation with additional checks will reduce ValueError and BadRequestError incidents	skills/gemini_response_validation_v6.md
2026-03-21T04:17:19.012433+00:00	exp_202603210417_75a9	0.750192	0.750192	+0.000000	keep	skill	Adding targeted pre-call validation and post-call empty response handling for Gemini API calls will reduce 'Invalid resp	skills/targeted_gemini_response_handling.md
2026-03-21T04:18:58.746963+00:00	exp_202603210418_bff4	0.750192	0.750192	+0.000000	keep	skill	Consolidating all LLM response handling into a single comprehensive skill will reduce error rate and simplify maintenanc	skills/universal_llm_response_handler.md
2026-03-21T04:19:21.075072+00:00	exp_202603210419_c4ee	0.750192	0.750192	+0.000000	keep	skill	Implement a dedicated skill for handling Gemini API empty responses specifically, reducing ValueError occurrences by imp	skills/gemini_empty_response_handling_v4.md
2026-03-21T04:19:58.593093+00:00	exp_202603210419_c600	0.750192	0.750192	+0.000000	keep	skill	Implement advanced recovery strategies for persistent Gemini API errors that current error handlers aren't catching	skills/advanced_gemini_error_recovery_v2.md
2026-03-21T04:20:18.433236+00:00	exp_202603210420_6d45	0.750192	0.750192	+0.000000	keep	skill	Creating a dedicated skill for handling both ValueError and BadRequestError in LLM calls will improve error recovery and	skills/llm_error_specific_handling_v4.md
2026-03-21T04:27:37.803080+00:00	exp_202603210427_767b	0.750192	0.750192	+0.000000	keep	skill	Adding pre-call validation for Gemini API will prevent common error patterns by validating input parameters before makin	skills/gemini_precall_validation.md
2026-03-21T04:29:18.325458+00:00	exp_202603210429_84fd	0.750192	0.750192	+0.000000	keep	skill	Adding targeted retry patterns for persistent Gemini API errors will reduce error rate without adding complexity	skills/gemini_api_persistent_error_recovery.md
2026-03-21T04:29:57.433917+00:00	exp_202603210429_2183	0.750192	0.750192	+0.000000	keep	skill	Enhanced recovery strategy specifically for empty/invalid LLM responses to reduce ValueError occurrences	skills/llm_empty_response_recovery_v4.md
2026-03-21T04:30:38.050004+00:00	exp_202603210430_a8a6	0.750192	0.750192	+0.000000	keep	skill	Adding focused skill for validating and recovering from empty/None LLM responses will reduce ValueError and BadRequestEr	skills/llm_empty_response_handler.md
2026-03-21T04:30:57.867357+00:00	exp_202603210430_60c8	0.750192	0.750192	+0.000000	keep	skill	Implementing targeted validation and recovery for persistent Gemini API errors will improve error handling without addin	skills/targeted_gemini_error_recovery_v4.md
2026-03-21T04:32:58.377187+00:00	exp_202603210432_2c12	0.750192	0.750192	+0.000000	keep	skill	Combining multiple LLM error handling strategies into a single unified skill will reduce complexity while maintaining or	skills/unified_llm_error_handling.md
2026-03-21T04:33:38.553168+00:00	exp_202603210433_386c	0.750192	0.750192	+0.000000	keep	skill	Creating a targeted error handling skill specifically for the recurring Gemini empty response errors we're seeing, which	skills/targeted_gemini_empty_response_recovery.md
2026-03-21T04:44:35.666995+00:00	exp_202603210444_7ea3	0.750192	0.750192	+0.000000	keep	skill	Adding a comprehensive error handling skill specifically for handling None or empty responses from LLM calls will reduce	skills/comprehensive_empty_response_handling.md
2026-03-21T04:44:55.016165+00:00	exp_202603210444_27d6	0.750192	0.750192	+0.000000	keep	skill	Adding targeted error handling for empty/invalid LLM responses will reduce the recurring ValueError errors and improve t	skills/targeted_empty_response_handling.md
2026-03-21T04:45:17.249653+00:00	exp_202603210445_1a08	0.750192	0.750192	+0.000000	keep	skill	Creating a targeted error handling skill for empty/invalid LLM responses will reduce the recurring ValueError errors by 	skills/targeted_empty_response_handling.md
