ts	experiment_id	metric_before	metric_after	delta	status	change_type	hypothesis	files_changed
2026-03-22T07:27:59.723607+00:00	exp_202603220727_785c	0.782692	0.782692	+0.000000	keep	skill	Consolidating llm error validation into a single comprehensive skill that includes stricter pre-validation and better em	skills/comprehensive_llm_call_validation_v11.md
2026-03-22T07:29:01.127634+00:00	exp_202603220729_5602	0.782692	0.782692	+0.000000	keep	skill	Implementing strict pre-validation for Gemini API responses will prevent handling of invalid/empty responses, reducing V	skills/advanced_gemini_pre_validation_v10.md
2026-03-22T07:29:19.722795+00:00	exp_202603220729_a394	0.782692	0.782692	+0.000000	keep	skill	Consolidate multiple Gemini error handling skills into a single comprehensive skill to reduce redundancy and improve err	skills/advanced_gemini_error_handling_comprehensive.md
2026-03-22T07:29:41.439375+00:00	exp_202603220729_e808	0.782692	0.782692	+0.000000	keep	skill	Consolidating all LLM response validation into a single comprehensive skill will reduce errors by handling both Gemini-s	skills/advanced_llm_response_validation_v2.md
2026-03-22T07:30:19.697077+00:00	exp_202603220730_20e7	0.782692	0.782692	+0.000000	keep	skill	Combining pre-validation, error recovery, and fallback strategies into a single skill will reduce Gemini API response er	skills/advanced_gemini_api_response_handling_v11.md
2026-03-22T07:40:17.574468+00:00	exp_202603220740_d950	0.782692	0.782692	+0.000000	keep	skill	Creating a consolidated LLM response validation and error recovery skill that combines all the fragmented error handling	skills/universal_llm_response_validation_and_recovery.md
2026-03-22T07:40:25.080482+00:00	exp_202603220740_3dde	0.782692	0.782692	+0.000000	keep	skill	The system has multiple redundant error handling skills for Gemini API responses. Consolidating these into a single comp	skills/consolidated_gemini_error_handling.md
2026-03-22T07:41:08.537425+00:00	exp_202603220741_5a07	0.782692	0.000000	+0.000000	pending	code	Removing redundant Gemini error handling skills while maintaining functionality in v5 will reduce complexity without imp	
2026-03-22T07:41:45.888684+00:00	exp_202603220741_f8a9	0.782692	0.782692	+0.000000	keep	skill	Consolidating multiple Gemini error handling skills into a single comprehensive version will reduce error rates while si	skills/advanced_gemini_api_response_handling_v12.md
2026-03-22T07:42:23.843035+00:00	exp_202603220742_aa78	0.782692	0.782692	+0.000000	keep	skill	Consolidating all LLM response validation and error recovery into a single skill will reduce recurring errors and improv	skills/advanced_llm_response_validation_and_recovery_v8.md
2026-03-22T07:44:05.037963+00:00	exp_202603220744_4e40	0.782692	0.782692	+0.000000	keep	skill	Consolidating redundant Gemini error handling skills into v8 while maintaining full functionality reduces complexity wit	skills/advanced_gemini_api_error_recovery_v8.md
2026-03-22T07:44:44.271848+00:00	exp_202603220744_b9fd	0.782692	0.782692	+0.000000	keep	skill	Consolidating all Gemini error handling into a single comprehensive skill with improved validation and recovery strategi	skills/advanced_gemini_error_handling_v12.md
2026-03-22T07:46:04.815608+00:00	exp_202603220746_e9e2	0.782692	0.782692	+0.000000	keep	skill	Consolidate all Gemini error handling into a single comprehensive skill by merging best practices from existing versions	skills/advanced_gemini_error_handling_v12.md
2026-03-22T07:53:12.088166+00:00	exp_202603220753_4d08	0.782692	0.782692	+0.000000	keep	skill	Creating a comprehensive pre-validation and error recovery skill will reduce recurring ValueError and BadRequestError is	skills/consolidated_llm_call_validation_and_recovery_v12.md
2026-03-22T07:53:52.906191+00:00	exp_202603220753_9f12	0.782692	0.782692	+0.000000	keep	skill	Consolidating multiple Gemini error handling skills into a single comprehensive version (v12) will maintain error recove	skills/advanced_gemini_api_error_recovery_v12.md
2026-03-22T07:54:52.029541+00:00	exp_202603220754_aac6	0.782692	0.782692	+0.000000	keep	skill	Consolidating Gemini error handling into a single comprehensive skill will simplify the system while maintaining robustn	skills/advanced_gemini_comprehensive_error_handling_v13.md
2026-03-22T07:55:15.922248+00:00	exp_202603220755_a873	0.782692	0.782692	+0.000000	keep	skill	Removing redundant Gemini error handling skills while maintaining comprehensive error recovery capability will simplify 	skills/optimized_gemini_error_recovery_v13.md
2026-03-22T07:56:31.477743+00:00	exp_202603220756_370e	0.782692	0.782692	+0.000000	keep	skill	Creating a comprehensive empty response handling skill will consolidate fragmented error handling approaches and reduce 	skills/comprehensive_empty_response_handling_v1.md
2026-03-22T07:57:11.892922+00:00	exp_202603220757_218b	0.782692	0.782692	+0.000000	keep	skill	Consolidating multiple Gemini API error handling skills into a single comprehensive skill to handle both ValueError and 	skills/gemini_api_comprehensive_error_handling.md
2026-03-22T07:58:11.636218+00:00	exp_202603220758_9487	0.782692	0.782692	+0.000000	keep	skill	Consolidating all Gemini error handling into a single comprehensive skill will fix recurring API errors while simplifyin	skills/comprehensive_gemini_error_handling_v13.md
2026-03-22T07:58:54.517648+00:00	exp_202603220758_63a0	0.782692	0.782692	+0.000000	keep	skill	Consolidating all Gemini error handling into a single comprehensive skill will reduce complexity while maintaining error	skills/advanced_gemini_error_handling_consolidated_v13.md
2026-03-22T07:59:13.774805+00:00	exp_202603220759_4d6a	0.782692	0.782692	+0.000000	keep	skill	Consolidating all Gemini error handling skills into a single comprehensive skill will reduce complexity while maintainin	skills/universal_gemini_error_handling.md
2026-03-22T08:03:31.658578+00:00	exp_202603220803_0beb	0.782692	0.782692	+0.000000	keep	skill	A more comprehensive Gemini API response validation and error recovery skill will reduce ValueError and BadRequestError 	skills/advanced_gemini_response_validation_v13.md
2026-03-22T08:04:12.508792+00:00	exp_202603220804_143d	0.782692	0.782692	+0.000000	keep	skill	Adding advanced empty response handling will reduce errors from invalid LLM responses	skills/advanced_empty_response_handling_v5.md
2026-03-22T08:04:33.302900+00:00	exp_202603220804_4498	0.782692	0.782692	+0.000000	keep	skill	Consolidating all Gemini error handling skills into a single comprehensive version will reduce complexity while maintain	skills/universal_gemini_error_handler.md
2026-03-22T08:05:32.519233+00:00	exp_202603220805_3c88	0.782692	0.782692	+0.000000	keep	skill	Creating a focused skill for handling null/empty LLM responses will reduce recurring ValueError and BadRequestError patt	skills/llm_null_response_handling.md
2026-03-22T08:05:51.422218+00:00	exp_202603220805_4b0a	0.782692	0.782692	+0.000000	keep	skill	Creating a focused skill for handling null/empty LLM responses will reduce errors and improve task success rate by addre	skills/advanced_empty_response_handling_v6.md
2026-03-22T08:06:53.566398+00:00	exp_202603220806_9cac	0.782692	0.782692	+0.000000	keep	skill	Consolidating all Gemini error handling skills into a single comprehensive skill will reduce redundancy and improve erro	skills/universal_gemini_error_handling_v1.md
2026-03-22T08:07:32.439055+00:00	exp_202603220807_95ab	0.782692	0.782692	+0.000000	keep	skill	Consolidating all Gemini error handling skills into a single module simplifies the system and reduces redundancy while m	skills/unified_gemini_error_handling_v14.md
2026-03-22T08:08:32.512948+00:00	exp_202603220808_f4de	0.782692	0.782692	+0.000000	keep	skill	Consolidating multiple empty response handling skills into one universal handler will reduce code complexity while maint	skills/universal_empty_response_handling.md
2026-03-22T08:08:52.344417+00:00	exp_202603220808_14bc	0.782692	0.782692	+0.000000	keep	skill	Adding a unified error recovery skill for LLM API calls could reduce error rates and improve reliability, especially for	skills/unified_llm_api_error_recovery.md
2026-03-22T08:15:01.643107+00:00	exp_202603220815_4350	0.782692	0.782692	+0.000000	keep	skill	Consolidating and improving empty response handling will reduce recurring errors and simplify the system by replacing mu	skills/consolidated_empty_response_handling_v1.md
2026-03-22T08:16:42.844303+00:00	exp_202603220816_cf47	0.782692	0.782692	+0.000000	keep	skill	Consolidating all Gemini error handling skills into a single comprehensive version will reduce complexity while maintain	skills/comprehensive_gemini_error_handling_v14.md
2026-03-22T08:17:22.770820+00:00	exp_202603220817_770c	0.782692	0.782692	+0.000000	keep	skill	Consolidating multiple Gemini error handling skills into one unified version will reduce error rate and simplify mainten	skills/unified_gemini_error_handling_v1.md
2026-03-22T08:18:02.017950+00:00	exp_202603220818_e94e	0.782692	0.782692	+0.000000	keep	skill	Consolidating and improving the error recovery process for LLM API responses will reduce recurring `ValueError` and `Bad	skills/advanced_llm_api_error_recovery_v7.md
2026-03-22T08:19:01.308133+00:00	exp_202603220819_f9fe	0.782692	0.782692	+0.000000	keep	skill	Adding pre-validation checks before LLM API calls will reduce ValueError errors by catching issues earlier	skills/advanced_llm_pre_validation_v14.md
2026-03-22T08:21:03.077382+00:00	exp_202603220821_5b9c	0.782692	0.782692	+0.000000	keep	skill	Consolidating multiple Gemini error handling skills into one unified version will reduce complexity while maintaining co	skills/unified_gemini_error_handling_v2.md
2026-03-22T08:21:41.176659+00:00	exp_202603220821_8388	0.782692	0.782692	+0.000000	keep	skill	Adding a unified error recovery skill for LLM API calls could reduce error rates by providing a more robust and consiste	skills/unified_api_error_recovery_v1.md
2026-03-22T08:22:22.645664+00:00	exp_202603220822_6f66	0.782692	0.782692	+0.000000	keep	skill	Creating a unified Gemini error handling skill that combines pre-validation, recovery, and fallback mechanisms will redu	skills/unified_gemini_error_handling_v1.md
2026-03-22T08:28:06.497029+00:00	exp_202603220828_dfa8	0.782692	0.782692	+0.000000	keep	skill	Enhancing pre-validation checks before Gemini API calls will reduce empty responses by consolidating and simplifying val	skills/advanced_gemini_pre_validation_v14.md
2026-03-22T08:28:22.828528+00:00	exp_202603220828_42ed	0.782692	0.782692	+0.000000	keep	skill	Creating a unified error handling skill for LLM API calls that combines pre-validation, response validation, and recover	skills/unified_llm_error_handling_v1.md
2026-03-22T08:29:01.477586+00:00	exp_202603220829_6368	0.782692	0.782692	+0.000000	keep	skill	Consolidating multiple Gemini error handling skills into a single unified version will reduce complexity while improving	skills/advanced_gemini_error_handling_unified_v2.md
2026-03-22T08:29:42.589438+00:00	exp_202603220829_bec6	0.782692	0.782692	+0.000000	keep	skill	Consolidating all Gemini error handling into a single robust skill will reduce error rates and simplify maintenance	skills/advanced_gemini_error_handling_unified_v3.md
2026-03-22T08:32:02.708844+00:00	exp_202603220832_bdc0	0.782692	0.782692	+0.000000	keep	skill	Combining pre-validation checks, empty response handling, and error recovery for Gemini API calls into a single unified 	skills/advanced_gemini_api_error_recovery_unified_v5.md
2026-03-22T08:32:40.958947+00:00	exp_202603220832_cc0a	0.782692	0.782692	+0.000000	keep	skill	Combining all Gemini API error handling and empty response recovery into a single unified skill should simplify error ma	skills/unified_gemini_api_error_recovery_v7.md
2026-03-22T08:33:07.470368+00:00	exp_202603220833_c44b	0.782692	0.000000	+0.000000	pending	code	Removing older Gemini error handling skills while keeping only the most robust unified version will simplify the system 	
2026-03-22T08:33:23.227166+00:00	exp_202603220833_afaf	0.782692	0.782692	+0.000000	keep	skill	Create a unified error handling skill that combines pre-validation, empty response handling, and API error recovery for 	skills/unified_llm_error_handling_v1.md
2026-03-22T08:36:24.263651+00:00	exp_202603220836_d7fa	0.782692	0.782692	+0.000000	keep	skill	Removing older redundant Gemini error handling skills while keeping the most robust unified version (v5) will simplify t	skills/advanced_gemini_api_error_recovery_unified_v5.md
2026-03-22T08:37:02.835926+00:00	exp_202603220837_9277	0.782692	0.782692	+0.000000	keep	skill	Creating a unified Gemini error handling skill that combines all previous versions (v1-v12) into a single robust impleme	skills/advanced_gemini_error_handling_unified_v6.md
2026-03-22T08:37:22.678967+00:00	exp_202603220837_3cf2	0.782692	0.782692	+0.000000	keep	skill	Consolidate all Gemini error handling skills into a single most robust version (v6) and remove all redundant versions to	skills/advanced_gemini_error_handling_unified_v6.md
2026-03-22T08:37:43.952002+00:00	exp_202603220837_f5b8	0.782692	0.782692	+0.000000	keep	skill	Create a unified error handling skill that specifically addresses the recurring 'Invalid response from LLM call - None o	skills/unified_gemini_error_handling_v7.md
2026-03-22T08:38:03.419331+00:00	exp_202603220838_f2d8	0.782692	0.782692	+0.000000	keep	skill	Create a unified Gemini error handling skill that combines all error recovery patterns into a single robust version, rep	skills/advanced_gemini_error_handling_unified_v7.md
2026-03-22T08:39:22.477143+00:00	exp_202603220839_c66f	0.782692	0.782692	+0.000000	keep	skill	Created unified error handling skill combining best practices from existing versions to address recurring ValueError and	skills/gemini_error_handling_unified_v7.md
2026-03-22T08:40:01.505173+00:00	exp_202603220840_abac	0.782692	0.782692	+0.000000	keep	skill	Optimizing prompt templates will improve response conciseness and accuracy while reducing errors	skills/concise_prompt_templates.md
2026-03-22T08:40:23.224651+00:00	exp_202603220840_a6bf	0.782692	0.782692	+0.000000	keep	skill	Creating a unified error handling skill for Gemini API that combines all existing best practices and removes redundancy 	skills/unified_gemini_error_handling_v7.md
2026-03-22T08:40:43.699786+00:00	exp_202603220840_cf88	0.782692	0.782692	+0.000000	keep	skill	Creating a specialized skill to handle empty LLM responses will reduce the occurrence of ValueError errors	skills/advanced_empty_response_handling_v6.md
2026-03-22T08:41:43.223999+00:00	exp_202603220841_8785	0.782692	0.782692	+0.000000	keep	skill	Creating a unified error handling skill combining empty response recovery and Gemini API error handling will improve err	skills/advanced_unified_error_handling_v7.md
2026-03-22T08:47:22.047916+00:00	exp_202603220847_a874	0.782692	0.782692	+0.000000	keep	skill	Adding a new skill to handle empty or invalid LLM responses more effectively, combining best practices and introducing n	skills/advanced_empty_invalid_response_recovery_v6.md
2026-03-22T08:48:21.825479+00:00	exp_202603220848_0a01	0.782692	0.782692	+0.000000	keep	skill	Create a unified error recovery skill that handles both empty/invalid LLM responses and BadRequestErrors through a consi	skills/advanced_unified_error_recovery_v7.md
2026-03-22T08:50:21.890249+00:00	exp_202603220850_7231	0.782692	0.782692	+0.000000	keep	skill	Consolidating multiple error handling skills into one comprehensive version will reduce complexity while maintaining rob	skills/unified_error_handling_v8.md
2026-03-22T08:52:02.049662+00:00	exp_202603220852_6d33	0.782692	0.782692	+0.000000	keep	skill	Creating a simpler unified Gemini error recovery skill will improve task success rate and reduce code complexity	skills/advanced_gemini_error_recovery_unified_v7.md
2026-03-22T08:52:23.510825+00:00	exp_202603220852_1475	0.782692	0.782692	+0.000000	keep	skill	Consolidating multiple Gemini error handling skills into a single optimized version will reduce complexity while maintai	skills/optimized_gemini_error_handling_unified_v7.md
2026-03-22T08:52:41.808898+00:00	exp_202603220852_ffb0	0.782692	0.782692	+0.000000	keep	skill	Consolidating multiple Gemini error handling skills into a simpler unified version will reduce complexity and improve er	skills/unified_gemini_error_handling_v8.md
2026-03-22T08:53:21.431390+00:00	exp_202603220853_6a19	0.782692	0.782692	+0.000000	keep	skill	Consolidating multiple Gemini error handling skills into one universal version will simplify maintenance and improve err	skills/universal_gemini_error_recovery.md
2026-03-22T09:03:35.716769+00:00	exp_202603220903_eb88	0.782692	0.782692	+0.000000	keep	skill	Create a unified error handling skill that combines all Gemini API error recovery versions into a single, optimized vers	skills/unified_gemini_error_handling_v8.md
2026-03-22T09:04:34.641254+00:00	exp_202603220904_4553	0.782692	0.782692	+0.000000	keep	skill	Consolidating 10+ Gemini error handling skills into one unified version improves maintainability and reduces complexity 	skills/unified_gemini_error_handling.md
2026-03-22T09:05:14.069859+00:00	exp_202603220905_a54d	0.782692	0.782692	+0.000000	keep	skill	Creating a simpler, unified skill for handling None or empty LLM responses will improve error recovery efficiency and po	skills/unified_none_empty_response_handling_v1.md
2026-03-22T09:05:34.818606+00:00	exp_202603220905_056d	0.782692	0.782692	+0.000000	keep	skill	Create a skill to improve error recovery for Gemini API errors by providing specific retry strategies and parsing error 	skills/advanced_gemini_api_error_recovery_unified_v8.md
2026-03-22T09:06:54.281785+00:00	exp_202603220906_cea8	0.782692	0.782692	+0.000000	keep	skill	Creating a unified skill for handling Gemini API errors reduces complexity and improves reliability	skills/advanced_gemini_error_handling_unified_v7.md
2026-03-22T09:07:15.041076+00:00	exp_202603220907_5b01	0.782692	0.782692	+0.000000	keep	skill	Create a unified error handling skill for Gemini API that combines recovery for both ValueError and BadRequestError case	skills/advanced_gemini_error_handling_unified_v8.md
2026-03-22T09:07:34.827648+00:00	exp_202603220907_12ba	0.782692	0.782692	+0.000000	keep	skill	Creating a skill to handle empty or invalid LLM responses more effectively will reduce recurring ValueError errors.	skills/advanced_empty_invalid_response_recovery_v8.md
2026-03-22T09:07:56.461997+00:00	exp_202603220907_d119	0.782692	0.782692	+0.000000	keep	skill	Enhancing response validation before processing to prevent ValueError instances caused by invalid LLM responses	skills/advanced_response_validation_v1.md
2026-03-22T09:08:15.640189+00:00	exp_202603220908_2647	0.782692	0.782692	+0.000000	keep	skill	Create a unified skill for handling both ValueError and BadRequestError from Gemini API calls to reduce error rate and s	skills/gemini_api_error_handling_unified_v8.md
2026-03-22T09:14:19.337029+00:00	exp_202603220914_f3ee	0.782692	0.782692	+0.000000	keep	skill	Further consolidate Gemini error handling skills into a single unified skill that handles both ValueErrors and BadReques	skills/unified_gemini_error_handling_v8.md
2026-03-22T09:14:23.295257+00:00	exp_202603220914_78b3	0.782692	0.782692	+0.000000	keep	skill	Creating a unified skill for handling both ValueError and BadRequestError from Gemini API calls will reduce error rate a	skills/advanced_gemini_error_handling_unified_v8.md
2026-03-22T09:14:43.332687+00:00	exp_202603220914_ba78	0.782692	0.782692	+0.000000	keep	skill	Creating a unified skill that combines all Gemini error handling versions into a single robust version will reduce code 	skills/advanced_gemini_error_handling_unified_v8.md
2026-03-22T09:15:42.665309+00:00	exp_202603220915_1e97	0.782692	0.782692	+0.000000	keep	skill	Consolidating all Gemini API error handling into a single unified skill will reduce fragmentation and improve error reco	skills/advanced_gemini_error_handling_unified_v8.md
2026-03-22T09:16:44.516933+00:00	exp_202603220916_f504	0.782692	0.782692	+0.000000	keep	skill	Create a unified skill for handling both empty/invalid LLM responses and Gemini API errors, since the error patterns sho	skills/advanced_gemini_error_handling_unified_v9.md
2026-03-22T09:17:23.749665+00:00	exp_202603220917_8866	0.782692	0.782692	+0.000000	keep	skill	Implementing best practices for web search result summarization will improve output quality and user satisfaction	skills/web_search_summarization_best_practices.md
2026-03-22T09:18:21.596947+00:00	exp_202603220918_1ccf	0.782692	0.782692	+0.000000	keep	skill	Creating a unified proactive validation skill will reduce ValueErrors and BadRequestErrors by validating inputs before A	skills/proactive_response_validation_v1.md
2026-03-22T09:18:43.210671+00:00	exp_202603220918_6332	0.782692	0.782692	+0.000000	keep	skill	Creating a unified skill for handling both empty/invalid LLM responses and Gemini API errors will reduce code duplicatio	skills/advanced_gemini_error_handling_unified_v9.md
2026-03-22T09:28:32.764004+00:00	exp_202603220928_82ed	0.782692	0.782692	+0.000000	keep	skill	Consolidating all remaining Gemini error handling skills into a single unified skill will reduce complexity while mainta	skills/advanced_gemini_error_handling_unified_v9.md
2026-03-22T09:29:36.803936+00:00	exp_202603220929_20f6	0.782692	0.782692	+0.000000	keep	skill	Consolidating all Gemini error handling into a single unified skill will reduce code duplication, make maintenance easie	skills/advanced_gemini_api_error_recovery_unified_v13.md
2026-03-22T09:30:11.596369+00:00	exp_202603220930_c5bc	0.782692	0.782692	+0.000000	keep	skill	Creating a unified skill for handling both ValueError and BadRequestError from Gemini API calls will reduce error rates 	skills/advanced_gemini_error_handling_unified_v8.md
