ts	experiment_id	metric_before	metric_after	delta	status	change_type	hypothesis	files_changed
2026-04-15T10:05:16.143405+00:00	exp_202604151005_5eef	0.880122	0.880122	+0.000000	keep	skill	Adding a skill for advanced multi-step reasoning patterns will improve the team's ability to handle complex tasks by bre	skills/advanced_multi_step_reasoning_patterns.md	
2026-04-15T10:17:07.829448+00:00	exp_202604151017_ed8b	0.880122	0.880122	+0.000000	keep	skill	Adding a skill for advanced multi-modal reasoning patterns will improve the team's ability to synthesize information fro	skills/advanced_multi_modal_reasoning.md	
2026-04-15T10:17:38.432966+00:00	exp_202604151017_0b28	0.880122	0.880122	+0.000000	keep	skill	Adding a skill for advanced ecological policy impact assessment will improve the team's ability to handle complex ecolog	skills/advanced_ecological_policy_impact_assessment.md	
2026-04-15T10:38:07.692674+00:00	exp_202604151038_23cb	0.880122	0.880122	+0.000000	keep	skill	Adding a skill for advanced multi-step reasoning patterns will improve the team's ability to handle complex tasks by bre	skills/advanced_multi_step_reasoning_patterns.md	
2026-04-15T10:38:16.322673+00:00	exp_202604151038_5338	0.880122	0.880122	+0.000000	keep	skill	Adding a skill for multi-step reasoning patterns in ecological research will improve the team's ability to handle comple	skills/advanced_multi_step_reasoning_ecology.md	
2026-04-15T11:25:57.165136+00:00	exp_202604151125_d116	0.880122	0.880122	+0.000000	keep	skill	Adding a skill for advanced multi-modal reasoning patterns in ecological research will improve the team's ability to syn	skills/advanced_multi_modal_reasoning_ecology.md	
2026-04-15T11:27:02.417106+00:00	exp_202604151127_3d79	0.880122	0.880122	+0.000000	keep	skill	Adding a skill for advanced multi-step reasoning patterns in ecological policy analysis will improve the team's ability 	skills/advanced_multi_step_reasoning_ecological_policy.md	
2026-04-15T12:19:17.924236+00:00	exp_202604151219_1025	0.880122	0.880122	+0.000000	keep	skill	Adding a skill for multi-step reasoning patterns in ecological policy impact assessments will improve the team's ability	skills/ecological_policy_multi_step_reasoning.md	
2026-04-15T12:20:17.577227+00:00	exp_202604151220_3424	0.880122	0.880122	+0.000000	keep	skill	Adding a skill for multi-step reasoning patterns in ecological policy impact assessment will improve the team's ability 	skills/ecological_policy_multi_step_reasoning.md	
2026-04-15T12:24:23.862916+00:00	exp_202604151224_d77c	0.880122	0.880122	+0.000000	keep	skill	Adding a skill for multi-step reasoning patterns in ecological policy impact assessment will improve the team's ability 	skills/multi_step_reasoning_ecological_policy_impact_assessment.md	
2026-04-15T12:25:01.582649+00:00	exp_202604151225_2cf3	0.880122	0.880122	+0.000000	keep	skill	Adding a skill for multi-step reasoning patterns in ecological policy impact assessment will improve the team's ability 	skills/multi_step_reasoning_ecological_policy.md	
2026-04-15T13:05:56.595813+00:00	exp_202604151305_a32d	0.880122	0.880122	+0.000000	keep	skill	Adding a skill for advanced multi-step reasoning patterns in ecological policy impact assessment will improve the team's	skills/advanced_multi_step_reasoning_ecological_policy.md	
2026-04-15T13:06:20.974232+00:00	exp_202604151306_d721	0.880122	0.880122	+0.000000	keep	skill	Adding a skill for advanced multi-step reasoning patterns in ecological policy impact assessment will improve the team's	skills/advanced_multi_step_reasoning_ecological_policy_impact_assessment.md	
2026-04-16T12:01:39.161680+00:00	exp_202604161201_66b6	0.873094	0.873094	+0.000000	keep	skill	Adding a skill for advanced multi-modal reasoning patterns in ecological research will enhance the team's ability to syn	skills/advanced_multi_modal_reasoning_in_ecological_research.md	
2026-04-16T12:10:41.461238+00:00	exp_202604161210_9e1e	0.873094	0.873094	+0.000000	keep	skill	Adding a skill for advanced multi-step reasoning patterns in ecological policy impact assessment will improve the team's	skills/advanced_multi_step_reasoning_ecological_policy.md	
2026-04-16T12:15:31.578935+00:00	exp_202604161215_8052	0.873094	0.873094	+0.000000	keep	skill	Adding a skill for advanced web search summarization techniques will improve the quality and relevance of search result 	skills/advanced_web_search_summarization_techniques.md	
2026-04-16T12:20:42.700318+00:00	exp_202604161220_1a82	0.873094	0.873094	+0.000000	keep	skill	Adding a skill for advanced multi-modal reasoning patterns will expand the team's capability to handle complex tasks tha	skills/advanced_multi_modal_reasoning.md	
2026-04-16T12:22:06.992712+00:00	exp_202604161222_3d85	0.873094	0.873094	+0.000000	keep	skill	Adding a skill for advanced web search summarization techniques will improve the quality and efficiency of information r	skills/advanced_web_search_summarization.md	
2026-04-16T13:55:03.727521+00:00	exp_202604161355_9dad	0.844504	0.844504	+0.000000	keep	skill	Adding a skill for multi-step ecological scenario modeling will enhance the team's ability to handle complex ecological 	skills/multi_step_ecological_scenario_modeling.md	
2026-04-16T14:00:59.228525+00:00	exp_202604161400_e822	0.844504	0.844504	+0.000000	keep	skill	Adding a skill for advanced ecological crisis scenario modeling will expand the team's capability to handle complex ecol	skills/advanced_ecological_crisis_scenario_modeling.md	
2026-04-16T14:01:53.521502+00:00	exp_202604161401_60b5	0.844504	0.844504	+0.000000	keep	skill	Adding a skill for advanced multi-step reasoning patterns in ecological policy impact assessment will improve the team's	skills/advanced_multi_step_reasoning_ecological_policy.md	
2026-04-16T14:34:40.479548+00:00	exp_202604161434_c159	0.844504	0.844504	+0.000000	keep	skill	Adding a skill for advanced multi-step reasoning patterns in ecological policy analysis will improve the team's ability 	skills/advanced_multi_step_reasoning_ecological_policy_analysis.md	
2026-04-16T14:35:09.556676+00:00	exp_202604161435_57e4	0.844504	0.844504	+0.000000	keep	skill	Adding a skill for multi-step ecological scenario modeling will improve the team's ability to handle complex ecological 	skills/multi_step_ecological_scenario_modeling.md	
2026-04-16T15:07:57.327491+00:00	exp_202604161507_e603	0.844504	0.844504	+0.000000	keep	skill	Adding a skill for advanced ecological data visualization techniques will improve the team's ability to present complex 	skills/advanced_ecological_data_visualization.md	
2026-04-16T15:08:06.173200+00:00	exp_202604161508_f1be	0.844504	0.844504	+0.000000	keep	skill	Adding a skill for advanced multi-step reasoning patterns in ecological policy impact assessment will enhance the team's	skills/advanced_multi_step_reasoning_ecological_policy.md	
2026-04-16T15:54:46.217331+00:00	exp_202604161554_2cca	0.844504	0.844504	+0.000000	keep	skill	Adding a skill for advanced ecological data visualization techniques will improve the team's ability to present complex 	skills/advanced_ecological_data_visualization_techniques.md	
2026-04-16T15:55:23.492942+00:00	exp_202604161555_55ca	0.844504	0.844504	+0.000000	keep	skill	Adding a skill for advanced web search summarization techniques will improve the team's ability to synthesize and conden	skills/advanced_web_search_summarization_techniques.md	
2026-04-16T16:27:30.955895+00:00	exp_202604161627_ef53	0.844504	0.844504	+0.000000	keep	skill	Adding a skill for advanced multi-step reasoning patterns in ecological scenario modeling will improve the team's abilit	skills/advanced_multi_step_ecological_scenario_modeling.md	
2026-04-16T16:29:11.009002+00:00	exp_202604161629_74ae	0.844504	0.844504	+0.000000	keep	skill	Adding a skill for advanced ecological data synthesis techniques will improve the team's ability to process and integrat	skills/advanced_ecological_data_synthesis.md	
2026-04-16T18:00:24.337743+00:00	exp_202604161800_e818	0.828214	0.828214	+0.000000	keep	skill	Adding a skill for advanced web search summarization techniques will improve the quality of synthesized information from	skills/advanced_web_search_summarization_techniques.md	
2026-04-16T18:01:05.543886+00:00	exp_202604161801_1f64	0.828214	0.828214	+0.000000	keep	skill	Adding a skill for advanced web search summarization techniques will improve the team's ability to synthesize and conden	skills/advanced_web_search_summarization_techniques.md	
2026-04-16T18:01:28.466790+00:00	exp_202604161801_a54b	0.828214	0.828214	+0.000000	keep	skill	Adding a skill for advanced multi-step reasoning patterns in ecological scenario modeling will improve the team's abilit	skills/advanced_multi_step_ecological_scenario_modeling.md	
2026-04-16T18:01:37.439363+00:00	exp_202604161801_544f	0.828214	0.828214	+0.000000	keep	skill	Adding a skill for multi-step ecological scenario modeling will enhance the team's ability to handle complex ecological 	skills/multi_step_ecological_scenario_modeling.md	
2026-04-16T18:01:45.314321+00:00	exp_202604161801_79c8	0.828214	0.828214	+0.000000	keep	skill	Adding a skill for advanced ecological data synthesis techniques will improve the team's ability to handle complex ecolo	skills/advanced_ecological_data_synthesis.md	
2026-04-17T00:00:50.872905+00:00	exp_202604170000_7ca1	0.835672	0.835672	+0.000000	keep	skill	Adding a skill for advanced multi-step reasoning patterns in ecological scenario modeling will improve the team's abilit	skills/advanced_multi_step_reasoning_ecological_scenario_modeling.md	
2026-04-17T00:01:00.561024+00:00	exp_202604170001_d549	0.835672	0.835672	+0.000000	keep	skill	Adding a skill for advanced ecological data visualization techniques will improve the team's ability to present complex 	skills/advanced_ecological_data_visualization_techniques.md	
2026-04-17T00:01:11.779386+00:00	exp_202604170001_fb4a	0.835672	0.835672	+0.000000	keep	skill	Adding a skill for advanced ecological data visualization techniques will improve the team's ability to present complex 	skills/advanced_ecological_data_visualization_techniques.md	
2026-04-17T00:02:57.855140+00:00	exp_202604170002_9117	0.835672	0.835672	+0.000000	keep	skill	Adding a skill for advanced web search summarization techniques will improve the team's ability to synthesize and presen	skills/advanced_web_search_summarization_techniques.md	
2026-04-17T00:04:29.193275+00:00	exp_202604170004_f75c	0.835672	0.835672	+0.000000	keep	skill	Adding a skill for advanced web search summarization techniques will improve the team's ability to synthesize and conden	skills/advanced_web_search_summarization_techniques.md	
2026-04-17T06:00:15.749422+00:00	exp_202604170600_a54b	0.835672	0.835672	+0.000000	keep	skill	Adding a skill for advanced multi-step reasoning patterns in ecological scenario modeling will improve the team's abilit	skills/advanced_multi_step_ecological_scenario_modeling.md	
2026-04-17T06:01:02.250077+00:00	exp_202604170601_2633	0.835672	0.835672	+0.000000	keep	skill	Adding a skill for multi-step reasoning patterns in ecological scenario modeling will improve the team's ability to hand	skills/advanced_multi_step_ecological_scenario_modeling.md	
2026-04-17T06:01:11.926680+00:00	exp_202604170601_c80b	0.835672	0.835672	+0.000000	keep	skill	Adding a skill for advanced multi-step reasoning patterns in ecological policy analysis will expand the team's capabilit	skills/advanced_multi_step_reasoning_in_ecological_policy_analysis.md	
2026-04-17T06:01:25.578255+00:00	exp_202604170601_57c6	0.835672	0.835672	+0.000000	keep	skill	Adding a skill for advanced ecological data synthesis techniques will improve the team's ability to handle complex ecolo	skills/advanced_ecological_data_synthesis.md	
2026-04-17T06:02:13.561050+00:00	exp_202604170602_c80b	0.835672	0.835672	+0.000000	keep	skill	Adding a skill for advanced multi-step reasoning patterns in ecological policy analysis will expand the team's capabilit	skills/advanced_multi_step_reasoning_ecological_policy_analysis.md	
2026-04-17T06:02:22.510819+00:00	exp_202604170602_a083	0.835672	0.835672	+0.000000	discard	code	Optimizing the web search tool to reduce redundant API calls and improve response accuracy will enhance performance and 	app/tools/web_search.py	No improvement (delta=+0.0000), reverted
2026-04-17T06:03:51.893221+00:00	exp_202604170603_f54e	0.835672	0.835672	+0.000000	keep	skill	Adding a skill for advanced multi-step reasoning patterns in ecological scenario modeling will enhance the team's abilit	skills/advanced_multi_step_reasoning_ecological_scenario_modeling.md	
2026-04-17T06:21:36.078609+00:00	exp_202604170621_e777	0.835672	0.835672	+0.000000	keep	skill	Adding a skill for advanced multi-step reasoning patterns in ecological scenario modeling will improve the team's abilit	skills/advanced_multi_step_ecological_scenario_modeling.md	
2026-04-17T06:22:49.789039+00:00	exp_202604170622_a54b	0.835672	0.835672	+0.000000	keep	skill	Adding a skill for advanced multi-step reasoning patterns in ecological scenario modeling will improve the team's abilit	skills/advanced_multi_step_reasoning_ecological_scenario_modeling.md	
2026-04-17T06:30:18.739261+00:00	exp_202604170630_79c8	0.835672	0.835672	+0.000000	keep	skill	Adding a skill for advanced ecological data synthesis techniques will improve the team's ability to handle complex ecolo	skills/advanced_ecological_data_synthesis.md	
2026-04-17T06:31:35.510200+00:00	exp_202604170631_5682	0.835672	0.835672	+0.000000	keep	skill	Adding a skill for advanced ecological data synthesis techniques will expand the team's capability to handle complex eco	skills/advanced_ecological_data_synthesis_techniques.md	
2026-04-17T06:47:12.788142+00:00	exp_202604170647_bd40	0.835672	0.835672	+0.000000	keep	skill	Adding a skill for advanced ecological data synthesis techniques will improve the team's ability to handle complex ecolo	skills/advanced_ecological_data_synthesis.md	
2026-04-17T06:47:37.138626+00:00	exp_202604170647_2b55	0.835672	0.835672	+0.000000	keep	skill	Adding a skill for advanced ecological data synthesis techniques will improve the team's ability to handle complex ecolo	skills/advanced_ecological_data_synthesis.md	
2026-04-17T06:56:07.503865+00:00	exp_202604170656_291f	0.835672	0.835672	+0.000000	keep	skill	Adding a skill for advanced ecological data synthesis techniques will improve the team's ability to handle complex ecolo	skills/advanced_ecological_data_synthesis_techniques.md	
2026-04-17T06:56:56.687678+00:00	exp_202604170656_5682	0.835672	0.835672	+0.000000	keep	skill	Adding a skill for advanced ecological data synthesis techniques will expand the team's capability to handle complex eco	skills/advanced_ecological_data_synthesis.md	
2026-04-17T07:40:57.018455+00:00	exp_202604170740_51fe	0.835672	0.835672	+0.000000	keep	skill	Adding a skill for advanced multi-step reasoning patterns in ecological data synthesis will improve the team's ability t	skills/advanced_multi_step_reasoning_ecological_data_synthesis.md	
2026-04-17T07:42:18.107109+00:00	exp_202604170742_b169	0.835672	0.835672	+0.000000	keep	skill	Adding a skill for advanced web search summarization techniques will improve the quality of synthesized responses from w	skills/advanced_web_search_summarization_techniques.md	
2026-04-17T08:31:15.990238+00:00	exp_202604170831_6999	0.835672	0.835672	+0.000000	keep	skill	Adding a skill for advanced multi-step reasoning patterns in ecological research will improve the team's ability to hand	skills/advanced_multi_step_reasoning_in_ecological_research.md	
2026-04-17T08:31:51.560090+00:00	exp_202604170831_2ffa	0.835672	0.835672	+0.000000	keep	skill	Adding a skill for LLM response validation and retry logic will improve robustness by handling empty or failed outputs m	skills/llm_response_validation.md	
2026-04-17T09:02:12.453374+00:00	exp_202604170902_1dc1	0.835672	0.835672	+0.000000	keep	skill	Adding a skill for multi-step reasoning patterns will enhance the team's ability to handle complex tasks by breaking the	skills/multi_step_reasoning_patterns.md	
2026-04-17T09:03:06.537882+00:00	exp_202604170903_72f0	0.835672	0.835672	+0.000000	keep	skill	Adding a skill for advanced multi-step reasoning patterns will enhance the crew's ability to handle complex ecological d	skills/advanced_multi_step_reasoning_patterns.md	
2026-04-17T09:35:38.508113+00:00	exp_202604170935_e912	0.835672	0.835672	+0.000000	keep	skill	Adding a skill for advanced multi-step reasoning patterns will enhance the team's ability to handle complex tasks by bre	skills/advanced_multi-step_reasoning_patterns.md	
2026-04-17T09:37:30.404458+00:00	exp_202604170937_06f2	0.835672	0.835672	+0.000000	keep	skill	Adding a skill for advanced multi-step reasoning patterns will enhance the team's ability to handle complex tasks by bre	skills/advanced_multi_step_reasoning.md	
2026-04-17T09:54:46.162030+00:00	exp_202604170954_82c6	0.835672	0.835672	+0.000000	keep	skill	Adding a skill for multi-step reasoning in ecological policy impact assessment will enhance the team's ability to handle	skills/ecological_policy_impact_assessment_multi_step_reasoning.md	
2026-04-17T09:55:36.988627+00:00	exp_202604170955_14af	0.835672	0.835672	+0.000000	keep	skill	Adding a skill for multi-step reasoning in ecological policy analysis will enhance the team's ability to handle complex 	skills/multi_step_reasoning_ecological_policy_analysis.md	
2026-04-17T10:21:58.440645+00:00	exp_202604171021_35f1	0.835672	0.835672	+0.000000	keep	skill	Adding a skill for advanced ecological data synthesis techniques will enhance the team's ability to process and interpre	skills/advanced_ecological_data_synthesis.md	
2026-04-17T10:22:50.627737+00:00	exp_202604171022_35f1	0.835672	0.835672	+0.000000	keep	skill	Adding a skill for advanced ecological data synthesis techniques will enhance the team's ability to process and interpre	skills/advanced_ecological_data_synthesis.md	
2026-04-17T10:57:04.212063+00:00	exp_202604171057_48c9	0.835672	0.835672	+0.000000	keep	skill	Adding a skill for advanced web search summarization techniques will improve the team's ability to synthesize and presen	skills/advanced_web_search_summarization.md	
2026-04-17T10:58:21.360703+00:00	exp_202604171058_8a63	0.835672	0.835672	+0.000000	keep	skill	Adding a skill for multi-step reasoning in ecological policy analysis will enhance the team's ability to handle complex 	skills/multi_step_reasoning_ecological_policy_analysis.md	
2026-04-17T11:44:28.978163+00:00	exp_202604171144_f46d	0.835672	0.835672	+0.000000	keep	skill	Adding a skill for advanced multi-step reasoning in ecological policy analysis will enhance the team's ability to handle	skills/advanced_multi_step_reasoning_ecological_policy_analysis.md	
2026-04-17T11:47:06.167269+00:00	exp_202604171147_a0a5	0.835672	0.835672	+0.000000	keep	skill	Adding a skill for advanced multi-step reasoning patterns in ecological policy impact assessment will enhance the team's	skills/ecological_policy_multi_step_reasoning.md	
2026-04-17T12:01:10.558239+00:00	exp_202604171201_97a4	0.835672	0.835672	+0.000000	keep	skill	Adding a skill for advanced multi-step reasoning in ecological policy analysis will enhance the team's ability to handle	skills/advanced_multi_step_reasoning_ecological_policy.md	
2026-04-17T12:01:24.812482+00:00	exp_202604171201_97f6	0.835672	0.835672	+0.000000	keep	skill	Adding a skill for multi-step reasoning in ecological policy analysis will enhance the team's ability to handle complex 	skills/multi_step_reasoning_ecological_policy_analysis.md	
2026-04-17T12:33:18.844138+00:00	exp_202604171233_619e	0.835672	0.835672	+0.000000	keep	skill	Adding a skill for multi-step reasoning in ecological policy analysis will enhance the team's ability to handle complex 	skills/multi_step_reasoning_ecological_policy_analysis.md	
2026-04-17T17:44:55.541515+00:00	exp_202604171744_ecbb	0.876861	0.876861	+0.000000	keep	skill	Adding a skill for advanced multi-step reasoning in ecological policy impact assessment will enhance the team's ability 	skills/advanced_multi_step_reasoning_ecological_policy_impact_assessment.md	
2026-04-17T17:46:13.306681+00:00	exp_202604171746_50ad	0.876861	0.876861	+0.000000	keep	skill	Adding a skill for advanced web search result synthesis and summarization will improve the quality of responses by provi	skills/advanced_web_search_summarization.md	
2026-04-17T18:00:27.724176+00:00	exp_202604171800_cfcd	0.876861	0.876861	+0.000000	keep	skill	Adding a skill for advanced multi-step reasoning in ecological policy analysis will improve the team's ability to handle	skills/advanced_multi_step_reasoning_ecological_policy.md	
2026-04-17T18:02:12.842987+00:00	exp_202604171802_e43e	0.876861	0.876861	+0.000000	keep	skill	Adding a skill for multi-step reasoning in ecological policy impact assessment will enhance the team's ability to handle	skills/multi_step_reasoning_ecological_policy_impact_assessment.md	
2026-04-17T18:27:53.237882+00:00	exp_202604171827_c45a	0.883490	0.883490	+0.000000	keep	skill	Adding a skill for advanced multi-step reasoning in ecological policy will enhance the team's ability to handle complex 	skills/advanced_multi_step_reasoning_in_ecological_policy.md	
2026-04-17T18:27:59.959472+00:00	exp_202604171827_c45a	0.883490	0.883490	+0.000000	keep	skill	Adding a skill for advanced multi-step reasoning in ecological policy will enhance the team's ability to handle complex 	skills/advanced_multi_step_reasoning_in_ecological_policy.md	
2026-04-17T18:42:08.726708+00:00	exp_202604171842_1874	0.876835	0.876835	+0.000000	keep	skill	Adding a skill for advanced ecological data synthesis techniques will improve the team's ability to handle complex ecolo	skills/advanced_ecological_data_synthesis_techniques.md	
