ts	experiment_id	metric_before	metric_after	delta	status	change_type	hypothesis	files_changed
2026-03-21T06:45:26.070326+00:00	exp_202603210645_1336	0.750192	0.750192	+0.000000	keep	skill	Creating a consolidated error handling skill that specifically addresses both ValueError and BadRequestError patterns fr	skills/consolidated_llm_error_handling_v8.md
2026-03-21T06:45:46.012948+00:00	exp_202603210645_d4bb	0.750192	0.750192	+0.000000	keep	skill	Create a comprehensive error handling skill to address ValueError and BadRequestError patterns in research tasks, as the	skills/comprehensive_research_error_handling.md
2026-03-21T06:46:06.167531+00:00	exp_202603210646_2885	0.750192	0.750192	+0.000000	keep	skill	Create a consolidated error handling skill that specifically addresses both ValueError and BadRequestError from LLM call	skills/comprehensive_llm_error_handling_v4.md
2026-03-21T06:46:27.174155+00:00	exp_202603210646_6ea5	0.750192	0.750192	+0.000000	keep	skill	Create a consolidated error handling skill for both ValueError and BadRequestError in LLM and Gemini calls to reduce red	skills/comprehensive_llm_gemini_error_handling_v1.md
2026-03-21T06:54:30.130605+00:00	exp_202603210654_0243	0.750192	0.750192	+0.000000	keep	skill	Create a consolidated error handling skill that specifically addresses both ValueError and BadRequestError patterns from	skills/comprehensive_gemini_llm_error_recovery_v6.md
2026-03-21T06:55:09.615467+00:00	exp_202603210655_b187	0.750192	0.750192	+0.000000	keep	skill	Consolidating multiple Gemini error handling skills into a single comprehensive version will reduce error rates and simp	skills/comprehensive_gemini_error_handling_v5.md
2026-03-21T06:56:29.180353+00:00	exp_202603210656_e6ba	0.750192	0.750192	+0.000000	keep	skill	Creating a consolidated LLM response validation skill that combines pre-processing checks and fallback mechanisms can re	skills/comprehensive_llm_response_validation_v7.md
2026-03-21T06:57:09.075160+00:00	exp_202603210657_2490	0.750192	0.750192	+0.000000	keep	skill	Created a universal skill to handle empty LLM responses across all APIs, reducing recurring ValueError errors.	skills/universal_empty_response_handling.md
2026-03-21T06:58:30.685804+00:00	exp_202603210658_6310	0.750192	0.750192	+0.000000	keep	skill	Simplifying and consolidating LLM error handling skills reduces complexity while maintaining functionality	skills/comprehensive_llm_error_handling_v3.md
2026-03-21T06:58:49.423239+00:00	exp_202603210658_46a4	0.750192	0.750192	+0.000000	keep	skill	Create a skill to handle Gemini-specific BadRequestError exceptions more gracefully, based on recent error patterns. Thi	skills/gemini_badrequest_error_handling_v6.md
2026-03-21T06:59:12.867656+00:00	exp_202603210659_4d6d	0.750192	0.750192	+0.000000	keep	skill	Creating a unified LLM response validation skill will reduce redundancy and improve error recovery efficiency by consoli	skills/unified_llm_response_validation.md
2026-03-21T06:59:28.848865+00:00	exp_202603210659_02b7	0.750192	0.750192	+0.000000	keep	skill	Creating a more robust LLM response validation skill will reduce ValueError and BadRequestError occurrences by implement	skills/advanced_llm_response_validation_v8.md
2026-03-21T07:00:10.574883+00:00	exp_202603210700_157d	0.750192	0.751264	+0.001072	keep	skill	Creating a unified LLM error recovery skill combining empty response handling and API error recovery will simplify error	skills/unified_llm_error_recovery_v8.md
2026-03-21T07:08:01.921813+00:00	exp_202603210708_e99e	0.751264	0.751264	+0.000000	keep	skill	Creating a specialized Gemini error recovery skill that handles both BadRequestError and ValueError scenarios will reduc	skills/specialized_gemini_error_recovery_v6.md
2026-03-21T07:08:41.746276+00:00	exp_202603210708_94eb	0.751264	0.751264	+0.000000	keep	skill	Created unified LLM error recovery skill to handle both empty responses and BadRequestError cases across all LLM provide	skills/unified_llm_error_recovery.md
2026-03-21T07:09:01.869845+00:00	exp_202603210709_7c20	0.751264	0.751264	+0.000000	keep	skill	Creating a specialized skill to handle Gemini-specific BadRequestError exceptions more efficiently by implementing a tar	skills/gemini_error_recovery_v3.md
2026-03-21T07:09:41.760086+00:00	exp_202603210709_4acc	0.751264	0.751264	+0.000000	keep	skill	A more specialized skill for handling Gemini-related LLM errors will reduce recurring BadRequestError and ValueError iss	skills/specialized_gemini_error_handling_v3.md
2026-03-21T07:10:03.187937+00:00	exp_202603210710_0526	0.751264	0.751264	+0.000000	keep	skill	Creating a unified error handling skill that combines both empty response and BadRequestError handling for Gemini/LLM ca	skills/unified_gemini_llm_error_handling_v6.md
2026-03-21T07:11:42.503394+00:00	exp_202603210711_e85a	0.751264	0.751264	+0.000000	keep	skill	Creating a structured skill for handling empty LLM responses will reduce ValueError occurrences	skills/structured_empty_response_handling_v8.md
2026-03-21T07:12:42.369093+00:00	exp_202603210712_d4c8	0.751264	0.751264	+0.000000	keep	skill	Combining all error handling approaches into a single comprehensive skill will provide more robust error recovery across	skills/comprehensive_llm_error_recovery_v6.md
2026-03-21T07:13:26.467933+00:00	exp_202603210713_8e83	0.751264	0.751264	+0.000000	keep	skill	Creating a root-cause focused LLM error handling skill will reduce recurring ValueError and BadRequestError instances by	skills/root_cause_llm_error_handling_v1.md
2026-03-21T07:14:02.411884+00:00	exp_202603210714_adea	0.751264	0.751264	+0.000000	keep	skill	Creating a more advanced LLM API error recovery skill will reduce the recurring ValueError and BadRequestError rates	skills/advanced_llm_api_error_recovery_v6.md
2026-03-21T07:14:42.641415+00:00	exp_202603210714_1e1d	0.751264	0.751264	+0.000000	keep	skill	Proactive validation of LLM calls before execution will prevent more errors than post-error recovery can handle	skills/proactive_llm_call_validation.md
2026-03-21T07:21:15.062602+00:00	exp_202603210721_93c9	0.751264	0.751264	+0.000000	keep	skill	Consolidating multiple LLM error handling skills into one comprehensive version will reduce complexity while improving e	skills/unified_llm_error_handler_v8.md
2026-03-21T07:21:54.742703+00:00	exp_202603210721_530d	0.751264	0.751264	+0.000000	keep	skill	Creating a universal LLM error handler that combines empty response handling and Gemini-specific error recovery will red	skills/universal_llm_error_handler_v8.md
2026-03-21T07:22:24.490119+00:00	exp_202603210722_2e86	0.751264	0.751264	+0.000000	keep	skill	Creating a specialized skill to handle Gemini-specific BadRequestError and empty response errors will reduce the recurri	skills/gemini_error_handling_optimized_v6.md
2026-03-21T07:23:15.012935+00:00	exp_202603210723_b65b	0.751264	0.751264	+0.000000	keep	skill	Creating an advanced Gemini error recovery skill with fallback mechanisms will reduce recurring ValueError and BadReques	skills/advanced_gemini_error_recovery_with_fallback_v1.md
2026-03-21T07:24:37.065181+00:00	exp_202603210724_ae4b	0.751264	0.751264	+0.000000	keep	skill	Creating a proactive validation and fallback skill for LLM calls will reduce recurring errors.	skills/proactive_llm_validation_and_fallback.md
2026-03-21T07:25:34.629189+00:00	exp_202603210725_b4b6	0.751264	0.751264	+0.000000	keep	skill	Combining proactive validation with context-aware fallback strategies will better prevent empty LLM response errors	skills/advanced_llm_empty_response_handling_v8.md
2026-03-21T07:26:34.228017+00:00	exp_202603210726_1cfd	0.751264	0.751264	+0.000000	keep	skill	Creating a specialized skill to handle Gemini-specific BadRequestError more effectively will reduce the error rate and i	skills/gemini_bad_request_error_handler.md
2026-03-21T07:26:54.569768+00:00	exp_202603210726_9ba5	0.751264	0.751264	+0.000000	keep	skill	Creating a specialized skill to handle empty responses and BadRequest errors from Gemini API calls will reduce error rat	skills/gemini_error_recovery_v3.md
2026-03-21T13:53:13.181764+00:00	exp_202603211353_2868	0.751264	0.759809	+0.008545	keep	skill	Improved Gemini API error handling by combining proactive validation with context-aware fallback strategies to reduce Ba	skills/advanced_gemini_error_handling_v5.md
2026-03-21T14:05:17.063030+00:00	exp_202603211405_1546	0.760641	0.760641	+0.000000	keep	skill	Create a specialized skill to handle both empty responses and BadRequestError from Gemini API in a single consolidated h	skills/consolidated_gemini_error_handling_v1.md
2026-03-21T14:06:39.108123+00:00	exp_202603211406_c354	0.760641	0.760641	+0.000000	keep	skill	Consolidating multiple Gemini error handling skills into one comprehensive version will reduce error rate by handling bo	skills/consolidated_gemini_error_handling_v6.md
2026-03-21T14:06:56.272949+00:00	exp_202603211406_fa82	0.760641	0.760641	+0.000000	keep	skill	Creating a specialized skill to handle Gemini-specific BadRequestError and ValueErrors will reduce recurring errors and 	skills/gemini_error_handling_v6.md
2026-03-21T14:07:36.571939+00:00	exp_202603211407_f0d4	0.760641	0.760641	+0.000000	keep	skill	Consolidating multiple Gemini error handling skills into one simplifies maintenance and potentially improves error recov	skills/comprehensive_gemini_error_handling_v6.md
2026-03-21T14:15:16.127841+00:00	exp_202603211415_af91	0.759809	0.759809	+0.000000	keep	skill	Creating a unified LLM response validation skill to handle both empty responses and BadRequestErrors more efficiently, r	skills/unified_llm_response_validation.md
2026-03-21T14:15:36.238884+00:00	exp_202603211415_ab50	0.759809	0.759809	+0.000000	keep	skill	Create a unified error handling skill that combines validation for both empty responses and BadRequest errors from Gemin	skills/unified_gemini_error_handling_v1.md
2026-03-21T14:16:16.779640+00:00	exp_202603211416_8934	0.759809	0.759809	+0.000000	keep	skill	Consolidating multiple Gemini error handling skills into a single comprehensive version will reduce error rate while sim	skills/comprehensive_gemini_error_handling_v6.md
2026-03-21T14:17:17.534633+00:00	exp_202603211417_0671	0.759809	0.759809	+0.000000	keep	skill	Consolidated multiple LLM error handling patterns into a single comprehensive skill to improve reliability and reduce co	skills/comprehensive_llm_error_recovery_v7.md
2026-03-21T14:17:36.874744+00:00	exp_202603211417_e4a0	0.759809	0.759809	+0.000000	keep	skill	Create a specialized skill to handle both empty responses and BadRequest errors from Gemini API calls in a single consol	skills/gemini_error_empty_response_handling_v6.md
2026-03-21T14:18:56.343282+00:00	exp_202603211418_9fa1	0.759809	0.759809	+0.000000	keep	skill	Consolidating multiple LLM error handling skills into a single unified version reduces complexity while improving covera	skills/unified_llm_error_handling_v9.md
2026-03-21T14:19:36.722450+00:00	exp_202603211419_04f2	0.759809	0.759809	+0.000000	keep	skill	Creating a unified LLM response handling skill will reduce error rates by combining validation, recovery and fallback me	skills/unified_llm_response_handling.md
2026-03-21T14:19:56.236056+00:00	exp_202603211419_6c8d	0.759809	0.759809	+0.000000	keep	skill	Creating a unified error handling skill that combines validation for both empty responses and Gemini-specific errors wil	skills/unified_gemini_error_handling_v1.md
2026-03-21T14:20:57.298827+00:00	exp_202603211420_05fb	0.759809	0.759809	+0.000000	keep	skill	Consolidating multiple LLM error handling skills into a single unified version will reduce error rates and simplify main	skills/unified_llm_error_handling_v1.md
2026-03-21T14:30:18.204979+00:00	exp_202603211430_945b	0.759809	0.759809	+0.000000	keep	skill	Create a unified LLM error handling skill that combines validation, empty response handling, and Gemini-specific error r	skills/unified_llm_error_handling_v1.md
2026-03-21T14:30:58.111338+00:00	exp_202603211430_ad26	0.759809	0.759809	+0.000000	keep	skill	Consolidating multiple Gemini error handling skills into a single comprehensive version will reduce complexity while mai	skills/unified_gemini_error_handling_v3.md
2026-03-21T14:31:17.775552+00:00	exp_202603211431_b210	0.759809	0.759809	+0.000000	keep	skill	Improve LLM response handling by filtering out malformed empty responses before validation, reducing errors from invalid	skills/pre_validation_empty_response_filter.md
2026-03-21T14:31:38.898545+00:00	exp_202603211431_b91d	0.759809	0.759809	+0.000000	keep	skill	Create a unified LLM error handling skill that combines validation and recovery for both Gemini and general LLM API erro	skills/unified_llm_error_handling_v1.md
2026-03-21T14:34:58.599382+00:00	exp_202603211434_bc07	0.759809	0.759809	+0.000000	keep	skill	Creating a specialized skill to handle Gemini-specific errors and empty responses will reduce the recurring errors ident	skills/gemini_error_empty_response_handling_v6.md
2026-03-21T14:35:18.575470+00:00	exp_202603211435_2f04	0.759809	0.759809	+0.000000	keep	skill	Improving Gemini-specific error handling by creating a skill that combines recovery, validation, and fallback mechanisms	skills/comprehensive_gemini_error_handling_v3.md
2026-03-21T14:35:58.363605+00:00	exp_202603211435_5a54	0.759809	0.759809	+0.000000	keep	skill	Creating a unified skill for handling both Gemini-specific errors and empty LLM responses will reduce error rates while 	skills/comprehensive_gemini_error_and_empty_response_handling_v1.md
2026-03-21T14:36:19.652557+00:00	exp_202603211436_dfb0	0.759809	0.759809	+0.000000	keep	skill	Creating a unified error handling skill that combines validation and recovery for both empty responses and Gemini-specif	skills/unified_error_handling_v1.md
2026-03-21T14:37:00.665597+00:00	exp_202603211437_80b5	0.759809	0.759809	+0.000000	keep	skill	Creating a unified error handling skill for both LLM and Gemini-specific errors simplifies the system and addresses recu	skills/unified_llm_gemini_error_handling_v1.md
2026-03-21T14:46:53.960509+00:00	exp_202603211446_64b0	0.759809	0.759359	-0.000450	keep	skill	Improving Gemini-specific error handling by creating a skill that consolidates existing error recovery strategies reduce	skills/comprehensive_gemini_error_handling_v5.md
2026-03-21T14:47:17.308420+00:00	exp_202603211447_4239	0.759359	0.759359	+0.000000	keep	skill	Creating a skill for better web search result synthesis and summarization can improve output quality while potentially r	skills/web_search_synthesis_summarization.md
2026-03-21T14:47:55.754115+00:00	exp_202603211447_fa1c	0.759359	0.759359	+0.000000	keep	skill	Created comprehensive LLM call error handling skill to address recurring ValueError and BadRequestError patterns, combin	skills/comprehensive_llm_call_error_handling_v9.md
2026-03-21T14:48:17.676751+00:00	exp_202603211448_cbf6	0.759359	0.759359	+0.000000	keep	skill	Creating a better empty response handler will reduce ValueError occurrences by validating LLM responses before processin	skills/advanced_empty_response_handling_v5.md
2026-03-21T14:48:35.485537+00:00	exp_202603211448_8f63	0.759359	0.759359	+0.000000	keep	skill	Creating a unified error handling skill that combines validation and recovery for both LLM and Gemini-specific errors wi	skills/unified_llm_gemini_error_handling_v1.md
2026-03-21T14:49:35.442622+00:00	exp_202603211449_af66	0.759359	0.759359	+0.000000	keep	skill	Creating a unified error handling skill that combines validation and recovery for both empty responses and Gemini-specif	skills/unified_error_handling_v1.md
2026-03-21T14:50:15.663140+00:00	exp_202603211450_a067	0.759359	0.759359	+0.000000	keep	skill	Creating a unified error handling skill for empty/None LLM responses will reduce ValueError and BadRequestError occurren	skills/unified_empty_response_handling_v9.md
2026-03-21T14:51:15.305184+00:00	exp_202603211451_20b2	0.759359	0.759359	+0.000000	keep	skill	Created consolidated Gemini error handler combining empty response and BadRequestError cases to reduce recurring errors	skills/advanced_gemini_error_recovery_v3.md
2026-03-21T14:51:54.052193+00:00	exp_202603211451_b915	0.759359	0.759359	+0.000000	keep	skill	Improving Gemini-specific error handling by implementing better fallback mechanisms and validation checks	skills/advanced_gemini_error_handling_v6.md
2026-03-21T14:59:15.500422+00:00	exp_202603211459_860c	0.759359	0.759359	+0.000000	keep	skill	Creating a unified LLM response validation and recovery skill will reduce both ValueError and BadRequestError occurrence	skills/advanced_llm_response_validation_and_recovery_v1.md
2026-03-21T14:59:55.426323+00:00	exp_202603211459_3e2b	0.759359	0.759359	+0.000000	keep	skill	Created a more comprehensive Gemini response validation and recovery skill to address recurring ValueError and BadReques	skills/advanced_gemini_response_recovery_v5.md
2026-03-21T15:00:38.114684+00:00	exp_202603211500_e4a9	0.759359	0.759359	+0.000000	keep	skill	Implementing exponential backoff in LLM API retries will reduce recurring ValueError and BadRequestError errors.	skills/exponential_backoff_error_handling.md
2026-03-21T15:01:35.321373+00:00	exp_202603211501_1d65	0.759359	0.759359	+0.000000	keep	skill	Created specialized error recovery for Gemini API calls to reduce BadRequestError occurrences	skills/advanced_gemini_api_error_recovery_v4.md
2026-03-21T15:03:16.138363+00:00	exp_202603211503_4091	0.759359	0.759359	+0.000000	keep	skill	Implementing comprehensive LLM response validation that checks structure, completeness and coherence of responses will r	skills/advanced_llm_response_validation_v2.md
2026-03-21T15:03:56.359187+00:00	exp_202603211503_585e	0.759359	0.759359	+0.000000	keep	skill	Created consolidated Gemini error handler combining empty response checks, API error recovery, and response validation t	skills/advanced_gemini_response_validation_and_recovery_v7.md
2026-03-21T15:04:18.322477+00:00	exp_202603211504_50ad	0.759359	0.759359	+0.000000	keep	skill	Consolidating Gemini response validation into a single improved skill will reduce error rates by combining the best aspe	skills/adv_gemini_response_validation_v8.md
2026-03-21T15:04:36.045588+00:00	exp_202603211504_a945	0.759359	0.759359	+0.000000	keep	skill	Create a consolidated error handling skill that combines all Gemini API error patterns into a single comprehensive handl	skills/consolidated_gemini_error_handler_v9.md
2026-03-21T15:05:34.656996+00:00	exp_202603211505_5959	0.759359	0.759359	+0.000000	keep	skill	Creating a more focused Gemini API error recovery skill will reduce recurring errors and improve self-healing rates	skills/advanced_gemini_api_error_recovery_v8.md
2026-03-21T15:10:17.006540+00:00	exp_202603211510_e0c1	0.759359	0.759359	+0.000000	keep	skill	Consolidating all Gemini error handling skills into a single streamlined skill will reduce complexity and improve error 	skills/streamlined_gemini_error_handling.md
2026-03-21T15:10:56.470650+00:00	exp_202603211510_72f8	0.759359	0.759359	+0.000000	keep	skill	Created consolidated LLM response validation skill combining best practices from existing skills and adding better null/	skills/advanced_llm_response_validation_v9.md
2026-03-21T15:11:56.374929+00:00	exp_202603211511_383c	0.759359	0.759359	+0.000000	keep	skill	Created advanced_gemini_empty_response_recovery_v9 to specifically handle None/empty responses and OpenrouterException e	skills/advanced_gemini_empty_response_recovery_v9.md
2026-03-21T15:12:17.375953+00:00	exp_202603211512_6153	0.759359	0.759359	+0.000000	keep	skill	Creating a consolidated LLM error handling skill that combines all existing Gemini-specific error recovery skills into a	skills/consolidated_llm_error_handling_v10.md
2026-03-21T15:13:19.376145+00:00	exp_202603211513_f708	0.759359	0.759359	+0.000000	keep	skill	Consolidating multiple Gemini error handling skills into a single robust implementation will reduce complexity and impro	skills/consolidated_gemini_error_handling_v10.md
2026-03-21T15:13:35.935657+00:00	exp_202603211513_3a94	0.759359	0.759359	+0.000000	keep	skill	Create a consolidated LLM error handling skill to reduce redundant error handling logic and improve error recovery effic	skills/consolidated_llm_error_handling.md
2026-03-21T15:14:16.983961+00:00	exp_202603211514_bb56	0.759359	0.759359	+0.000000	keep	skill	Consolidating LLM error handling into a single skill reduces complexity while addressing recurring ValueError and BadReq	skills/consolidated_llm_error_recovery_v4.md
2026-03-21T15:14:36.893511+00:00	exp_202603211514_7d80	0.759359	0.759359	+0.000000	keep	skill	Creating a specific skill to handle empty responses and bad requests from Gemini API calls will reduce error rate and im	skills/gemini_empty_and_bad_request_recovery_v10.md
2026-03-21T15:14:57.067848+00:00	exp_202603211514_471f	0.759359	0.759359	+0.000000	keep	skill	Consolidating all Gemini error handling skills into a single comprehensive skill will reduce redundancy and improve erro	skills/consolidated_gemini_error_handling_v10.md
2026-03-22T07:24:59.110885+00:00	exp_202603220724_76a3	0.759359	0.782692	+0.023333	keep	skill	Implementing strict pre-validation of Gemini API responses will prevent Null/empty response errors from propagating	skills/gemini_response_prevalidation_v1.md
2026-03-22T07:25:40.287663+00:00	exp_202603220725_6568	0.782692	0.782692	+0.000000	keep	skill	Consolidating fragmented LLM error handling skills into a single comprehensive skill will improve error recovery rate an	skills/advanced_llm_error_recovery_and_validation_v10.md
2026-03-22T07:26:19.377427+00:00	exp_202603220726_e428	0.782692	0.782692	+0.000000	keep	skill	Consolidating multiple Gemini error handling skills into a single robust implementation simplifies the codebase while ma	skills/consolidated_gemini_error_handling_v10.md
