ts	experiment_id	metric_before	metric_after	delta	status	change_type	hypothesis	files_changed
2026-04-04T09:04:29.337360+00:00	exp_202604040903_1a6e	0.827276	0.827276	+0.000000	keep	skill	Adding a skill for handling API credit-related errors will reduce recurring APIStatusError 402 errors	skills/handle_api_credit_errors.md	
2026-04-05T00:01:42.513549+00:00	exp_202604050000_43a6	0.827276	0.764763	-0.062513	discard	skill	Adding a skill for handling API credit-related errors will reduce recurring APIStatusError 402 errors and improve task s	skills/api_credit_error_handler.md	
2026-04-05T00:06:36.427326+00:00	exp_202604050006_4843	0.770120	0.000000	+0.000000	pending	code	Adding explicit validation and retry logic for LLM API calls will reduce the frequency of APIStatusError and BadRequestE		
2026-04-05T00:11:45.132624+00:00	exp_202604050010_27c0	0.827276	0.764389	-0.062887	discard	skill	Adding a skill for handling API credit-related errors will reduce recurring APIStatusError 402 errors, which currently a	skills/api_credit_error_handling.md	
2026-04-05T00:13:52.068477+00:00	exp_202604050012_ae21	0.827276	0.769562	-0.057714	discard	skill	Add a skill for handling API status errors (e.g., code 402) to reduce recurring API credit-related errors	skills/handle_api_status_errors.md	
2026-04-05T00:14:12.113367+00:00	exp_202604050014_9bd9	0.769562	0.769562	+0.000000	keep	skill	Adding a skill for advanced web search summarization techniques will improve the quality and conciseness of web search r	skills/advanced_web_search_summarization.md	
2026-04-05T00:44:39.421798+00:00	exp_202604050043_59e1	0.769562	0.768929	-0.000633	keep	skill	Adding a skill for handling API credit-related errors will reduce recurring APIStatusError 402 errors by providing clear	skills/handle_api_credit_errors.md	
2026-04-05T00:45:53.641662+00:00	exp_202604050045_c83b	0.768929	0.000000	+0.000000	pending	code	Adding explicit validation and retry logic for LLM API calls will reduce the frequency of APIStatusError (code 402) erro		
2026-04-05T02:03:51.876542+00:00	exp_202604050203_e34e	0.768929	0.000000	+0.000000	pending	code	Adding explicit validation and retry logic for LLM API calls to handle recurring APIStatusError (code 402) will reduce e		
2026-04-05T02:04:30.153473+00:00	exp_202604050204_4103	0.768929	0.000000	+0.000000	pending	code	Fixing the recurring 'APIStatusError: Error code: 402' by implementing a credit check and retry mechanism for API calls 		
2026-04-05T03:14:45.232848+00:00	exp_202604050314_273b	0.768929	0.768929	+0.000000	keep	skill	Adding advanced web search summarization techniques will improve output quality and reduce response length, aligning wit	skills/advanced_web_search_summarization.md	
2026-04-05T03:16:18.807823+00:00	exp_202604050315_5b20	0.768929	0.768231	-0.000698	keep	skill	Implementing a more robust validation and retry wrapper for LLM API calls will reduce recurring APIStatusError and BadRe	skills/handle_llm_api_validation_and_retries.md	
2026-04-05T04:44:18.910853+00:00	exp_202604050443_addc	0.768231	0.768231	+0.000000	keep	skill	Adding a skill for handling API credit-related errors (code 402) will reduce recurring APIStatusError occurrences, as th	skills/api_credit_error_handling.md	
2026-04-05T04:45:17.273693+00:00	exp_202604050444_3bba	0.768231	0.762981	-0.005250	discard	skill	Improving prompt templates for shorter, more accurate crew responses will reduce task completion time and improve output	skills/prompt_templates.md	
2026-04-06T00:01:12.103362+00:00	exp_202604060000_addc	0.768231	0.840564	+0.072333	keep	skill	Adding a skill for handling API credit-related errors (code 402) will reduce recurring APIStatusError occurrences, as th	skills/api_credit_error_handling.md	
2026-04-06T00:01:27.354932+00:00	exp_202604060001_e2e7	0.840564	0.840564	+0.000000	keep	skill	Adding a skill for advanced web search summarization techniques will improve the synthesis of web search results, leadin	skills/advanced_web_search_summarization.md	
2026-04-06T00:08:01.093164+00:00	exp_202604060007_3fe8	0.840564	0.842231	+0.001667	keep	skill	Adding a skill for handling API credit-related errors will reduce recurring 'APIStatusError: Error code: 402' errors	skills/handle_api_credit_errors.py	
2026-04-06T00:10:12.763980+00:00	exp_202604060009_56d3	0.842231	0.841472	-0.000759	keep	skill	Adding a skill for handling API credit-related errors will reduce recurring APIStatusError: Error code: 402 errors and i	skills/api_credit_error_handler.py	
2026-04-06T00:10:46.948392+00:00	exp_202604060010_f844	0.841472	0.000000	+0.000000	pending	code	Fixing the recurring 'APIStatusError: Error code: 402' by implementing explicit credit check and retry logic in the API 		
2026-04-07T00:00:42.435436+00:00	exp_202604070000_d0f4	0.913522	0.000000	+0.000000	pending	code	Fixing the recurring 'APIStatusError: Error code: 402' by implementing a validation and retry wrapper for LLM API calls 		
2026-04-07T00:00:58.358288+00:00	exp_202604070000_37e1	0.913522	0.000000	+0.000000	pending	code	Fixing the recurring 'APIStatusError: Error code: 402' by implementing a check for API credit balance before making requ		
2026-04-07T00:03:01.222424+00:00	exp_202604070003_37a6	0.913522	0.000000	+0.000000	pending	code	Fixing the recurring 'APIStatusError: Error code: 402' by implementing a retry mechanism with exponential backoff for AP		
2026-04-07T00:36:29.384731+00:00	exp_202604070036_cf2c	0.914375	0.000000	+0.000000	pending	code	Create an error journal file to track and diagnose recurring errors, starting with the 'APIStatusError: Error code: 402'		
2026-04-07T03:05:40.689091+00:00	exp_202604070003_6b80	0.841472	0.908314	+0.066842	keep	skill	Adding a skill for handling API credit-related errors will reduce recurring 'APIStatusError: Error code: 402' errors and	skills/handle_api_credit_errors.md	
2026-04-07T03:23:04.679386+00:00	exp_202604070306_f039	0.912600	0.000000	+0.000000	pending	code	Fixing the recurring 'APIStatusError: Error code: 402' by implementing a retry mechanism for API calls that fail due to 		
2026-04-07T04:01:30.698739+00:00	exp_202604070036_1cd1	0.500000	0.907481	+0.407481	keep	skill	Adding a skill for handling API credit-related errors will reduce recurring 'APIStatusError: Error code: 402' errors and	skills/handle_api_credit_errors.md	
2026-04-08T01:33:02.319037+00:00	exp_202604080002_04ef	0.907481	0.893308	-0.014173	discard	skill	Adding a skill for optimizing memory retrieval timing will reduce response time and improve task success rate by ensurin	skills/memory_retrieval_optimization.py	
2026-04-08T04:35:10.260709+00:00	exp_202604080134_fe73	0.907481	0.899383	-0.008098	discard	skill	Adding a skill to handle BadRequestError (Error code: 400) will reduce recurring errors and improve error resolution rat	skills/coding/BadRequestError_handling.py	
2026-04-08T04:38:38.883370+00:00	exp_202604080438_ce8c	0.903041	0.000000	+0.000000	pending	code	Fixing the recurring 'ConnectionError: Failed to connect to OpenAI API: Request timed out' by implementing a retry mecha		
2026-04-08T04:39:57.052133+00:00	exp_202604080439_0d85	0.903041	0.000000	+0.000000	pending	code	Fixing the recurring 'BadRequestError' by implementing a validation wrapper for API requests to ensure required paramete		
2026-04-08T04:43:00.498016+00:00	exp_202604080442_b5bd	0.903041	0.000000	+0.000000	pending	code	Implementing a robust validation and retry wrapper for LLM API calls will reduce the recurring 'BadRequestError' and 'AP		
2026-04-08T12:03:49.680286+00:00	exp_202604081203_e9a0	0.855658	0.855658	+0.000000	keep	skill	Adding a skill for advanced multi-step reasoning patterns will improve the team's ability to handle complex tasks, as it	skills/advanced_multi_step_reasoning.md	
2026-04-08T12:04:17.860547+00:00	exp_202604081204_6cdf	0.855658	0.855658	+0.000000	keep	skill	Adding a skill for advanced multi-step reasoning patterns will improve the team's ability to handle complex tasks by bre	skills/advanced_multi_step_reasoning.md	
2026-04-08T13:05:23.832631+00:00	test_001	0.500000	0.600000	+0.100000	keep	skill	test hypothesis	test.md	test detail
2026-04-08T13:06:22.833959+00:00	test_001	0.500000	0.600000	+0.100000	keep	skill	test hypothesis	test.md	test detail
2026-04-08T13:07:19.835312+00:00	test_001	0.500000	0.600000	+0.100000	keep	skill	test hypothesis	test.md	test detail
2026-04-08T13:25:29.537665+00:00	exp_202604081325_6cdf	0.825862	0.825862	+0.000000	keep	skill	Adding a skill for advanced multi-step reasoning patterns will improve the team's ability to handle complex tasks by bre	skills/advanced_multi_step_reasoning_patterns.md	
2026-04-08T13:25:58.760477+00:00	exp_202604081325_d072	0.825862	0.825862	+0.000000	keep	skill	Adding a skill for advanced multi-step reasoning patterns will improve the crew's ability to handle complex tasks by bre	skills/advanced_multi_step_reasoning.md	
2026-04-08T13:26:15.348716+00:00	test_001	0.500000	0.600000	+0.100000	keep	skill	test hypothesis	test.md	test detail
2026-04-08T14:30:32.929679+00:00	exp_202604081430_6cdf	0.816466	0.816466	+0.000000	keep	skill	Adding a skill for advanced multi-step reasoning patterns will improve the team's ability to handle complex tasks by bre	skills/advanced_multi_step_reasoning_patterns.md	
2026-04-08T14:30:59.795548+00:00	exp_202604081430_e365	0.816466	0.816466	+0.000000	keep	skill	Adding a skill for advanced multi-step reasoning patterns will improve the team's ability to handle complex tasks by bre	skills/advanced_multi_step_reasoning.md	
2026-04-08T15:22:11.576722+00:00	exp_202604081522_6207	0.816466	0.816466	+0.000000	keep	skill	Adding a skill for advanced multi-step reasoning patterns will improve task success rate by enabling more complex proble	skills/advanced_multi_step_reasoning.md	
2026-04-08T15:22:57.640490+00:00	exp_202604081522_5610	0.816466	0.000000	+0.000000	pending	code	Implement a retry wrapper for API calls to reduce 'BadRequestError' occurrences by validating inputs before retrying.		
2026-04-08T17:06:53.049377+00:00	exp_202604081706_47e6	0.816466	0.816466	+0.000000	keep	skill	Adding a skill for advanced multi-step reasoning patterns will improve the team's ability to handle complex tasks by bre	skills/advanced_multi_step_reasoning.md	
2026-04-08T17:09:54.497286+00:00	exp_202604081709_a477	0.816466	0.816466	+0.000000	keep	skill	Adding a skill for advanced multi-step reasoning patterns will improve the team's ability to handle complex tasks by bre	skills/advanced_multi_step_reasoning.md	
2026-04-08T18:00:10.291024+00:00	exp_202604081800_6cdf	0.816466	0.816466	+0.000000	keep	skill	Adding a skill for advanced multi-step reasoning patterns will improve the team's ability to handle complex tasks by bre	skills/advanced_multi_step_reasoning.md	
2026-04-08T18:02:08.082825+00:00	exp_202604081802_5d44	0.816466	0.000000	+0.000000	pending	code	Implementing a retry wrapper for API calls to reduce 'BadRequestError' occurrences will improve task success rate by han		
2026-04-08T18:02:20.181626+00:00	exp_202604081802_d072	0.816466	0.816466	+0.000000	keep	skill	Adding a skill for advanced multi-step reasoning patterns will improve the crew's ability to handle complex tasks by bre	skills/advanced_multi-step_reasoning_patterns.md	
2026-04-08T18:03:27.726719+00:00	exp_202604081803_6cdf	0.816466	0.816466	+0.000000	keep	skill	Adding a skill for advanced multi-step reasoning patterns will improve the team's ability to handle complex tasks by bre	skills/advanced_multi_step_reasoning_patterns.md	
2026-04-08T18:04:09.728794+00:00	exp_202604081804_e365	0.816466	0.816466	+0.000000	keep	skill	Adding a skill for advanced multi-step reasoning patterns will improve the team's ability to handle complex tasks by bre	skills/advanced_multi_step_reasoning_patterns.md	
2026-04-08T20:58:26.807202+00:00	exp_202604082058_8ac3	0.816466	0.807177	-0.009289	discard	skill	Adding a skill for advanced web search result synthesis and summarization will improve output quality by providing more 	skills/advanced_web_search_summarization.md	
2026-04-08T21:02:33.902951+00:00	exp_202604082102_11f6	0.814153	0.000000	+0.000000	pending	code	Implementing a retry wrapper for API calls to reduce 'BadRequestError' occurrences by handling transient failures and ra		
2026-04-08T23:15:13.049360+00:00	exp_202604082315_5d44	0.814153	0.000000	+0.000000	pending	code	Implementing a retry wrapper for API calls to reduce 'BadRequestError' occurrences will improve task success rate by han		
2026-04-08T23:15:21.875784+00:00	exp_202604082315_b231	0.814153	0.814153	+0.000000	keep	skill	Adding a skill for advanced multi-step reasoning patterns will improve the team's ability to handle complex tasks by bre	skills/advanced_multi_step_reasoning.md	
2026-04-08T23:43:58.768686+00:00	exp_202604082343_06f2	0.822136	0.822136	+0.000000	keep	skill	Adding a skill for advanced multi-step reasoning patterns will enhance the team's ability to handle complex tasks by bre	skills/advanced_multi_step_reasoning.md	
2026-04-08T23:44:52.973747+00:00	exp_202604082344_f724	0.822136	0.822136	+0.000000	discard	code	Implementing a robust retry mechanism for API calls will reduce the recurring 'BadRequestError' and 'APIConnectionError'	app/core/api_handler.py	No improvement (delta=+0.0000), reverted
2026-04-09T00:00:26.194001+00:00	exp_202604090000_6e7f	0.822136	0.000000	+0.000000	pending	code	Implement a retry wrapper for API calls to reduce 'BadRequestError' occurrences, as it is the most frequent error patter		
2026-04-09T00:04:21.266918+00:00	exp_202604090004_3d9f	0.822136	0.822136	+0.000000	keep	skill	Adding a skill for advanced multi-step reasoning patterns will improve the team's ability to handle complex tasks by bre	skills/advanced_multi_step_reasoning.md	
2026-04-09T00:09:03.989831+00:00	exp_202604090009_fd63	0.822136	0.822136	+0.000000	keep	skill	Adding a skill for advanced multi-step reasoning patterns will improve the team's ability to handle complex tasks by bre	skills/advanced_multi_step_reasoning.md	
2026-04-09T00:17:12.386337+00:00	exp_202604090017_6deb	0.822136	0.822136	+0.000000	keep	skill	Adding a skill for advanced multi-step reasoning patterns will improve the team's ability to handle complex tasks by bre	skills/advanced_multi_step_reasoning.md	
2026-04-09T00:18:24.156804+00:00	exp_202604090018_6f50	0.822136	0.822136	+0.000000	discard	code	Improving error handling for 'APIConnectionError' by implementing a dynamic retry mechanism with exponential backoff wil	app/tools/api_handler.py	No improvement (delta=+0.0000), reverted
2026-04-09T00:21:32.397116+00:00	exp_202604090021_6cdf	0.822136	0.822136	+0.000000	keep	skill	Adding a skill for advanced multi-step reasoning patterns will improve the team's ability to handle complex tasks by bre	skills/advanced_multi_step_reasoning.md	
2026-04-09T00:21:52.776480+00:00	exp_202604090021_69ce	0.822136	0.822136	+0.000000	keep	skill	Adding a skill for advanced multi-step reasoning patterns will improve the team's ability to handle complex tasks by bre	skills/advanced_multi_step_reasoning.md	
2026-04-09T01:54:03.451678+00:00	exp_202604090154_5eef	0.825470	0.825470	+0.000000	keep	skill	Adding a skill for advanced multi-step reasoning patterns will improve the team's ability to handle complex tasks by bre	skills/advanced_multi_step_reasoning.md	
2026-04-09T01:55:07.154211+00:00	exp_202604090155_bef9	0.825470	0.825470	+0.000000	keep	skill	Adding a skill for advanced web search summarization techniques will improve synthesis and summarization of web search r	skills/advanced_web_search_summarization.md	
2026-04-09T02:18:57.830226+00:00	exp_202604090218_45f0	0.825470	0.825470	+0.000000	keep	skill	Adding a skill for advanced multi-step reasoning patterns will improve the team's ability to handle complex tasks by bre	skills/advanced_multi_step_reasoning_patterns.md	
2026-04-09T02:19:43.377339+00:00	exp_202604090219_c9d7	0.825470	0.825470	+0.000000	keep	skill	Adding a skill for advanced multi-step reasoning patterns will improve the team's ability to handle complex tasks by bre	skills/advanced_multi_step_reasoning.md	
2026-04-09T06:02:46.484961+00:00	exp_202604090602_87be	0.843089	0.843089	+0.000000	discard	code	Optimize the memory retrieval timing to reduce average response time by implementing a caching mechanism for frequently 	app/memory/memory_store.py	No improvement (delta=+0.0000), reverted
2026-04-09T06:04:08.020736+00:00	exp_202604090604_5d4f	0.843089	0.843089	+0.000000	discard	code	Implementing a robust validation wrapper for API calls will reduce recurring 'BadRequestError' (Error code: 400) errors 	app/tools/api_handler.py	No improvement (delta=+0.0000), reverted
2026-04-09T06:04:59.380918+00:00	exp_202604090604_47e6	0.843089	0.843089	+0.000000	keep	skill	Adding a skill for advanced multi-step reasoning patterns will improve the team's ability to handle complex tasks by bre	skills/advanced_multi_step_reasoning.md	
2026-04-09T06:36:45.192238+00:00	exp_202604090636_e365	0.843089	0.843089	+0.000000	keep	skill	Adding a skill for advanced multi-step reasoning patterns will improve the team's ability to handle complex tasks by bre	skills/advanced_multi_step_reasoning_patterns.md	
2026-04-09T07:34:50.177178+00:00	exp_202604090734_96ba	0.843089	0.843089	+0.000000	keep	skill	Adding a skill for advanced multi-step reasoning patterns will improve the team's ability to handle complex tasks by bre	skills/advanced_multi_step_reasoning_patterns.md	
2026-04-09T07:35:39.285212+00:00	exp_202604090735_9ed0	0.830684	0.830684	+0.000000	discard	code	Improving error recovery for 'coding:BadRequestError' by implementing dynamic parameter validation before API calls will	app/tools/api_wrapper.py	No improvement (delta=+0.0000), reverted
2026-04-09T07:47:18.583794+00:00	exp_202604090747_64fc	0.829951	0.829951	+0.000000	discard	code	Optimizing prompt templates for more concise Signal-friendly responses will improve output quality by reducing verbosity	app/prompts/templates.py	No improvement (delta=+0.0000), reverted
2026-04-09T07:51:46.404046+00:00	exp_202604090751_6cdf	0.829951	0.829951	+0.000000	keep	skill	Adding a skill for advanced multi-step reasoning patterns will improve the team's ability to handle complex tasks by bre	skills/advanced_multi_step_reasoning.md	
2026-04-09T07:54:31.516015+00:00	exp_202604090754_ade2	0.829951	0.000000	+0.000000	pending	code	Optimizing the memory retrieval timing to reduce average response time by implementing a pre-fetch mechanism for commonl		
2026-04-09T07:54:45.522565+00:00	exp_202604090754_b752	0.829951	0.829951	+0.000000	keep	skill	Adding a skill for advanced cross-crew information sharing patterns will improve collaboration efficiency and reduce red	skills/advanced_cross_crew_information_sharing.md	
2026-04-09T11:54:48.124640+00:00	exp_202604091154_c898	0.842681	0.842681	+0.000000	keep	skill	Adding a skill for advanced cross-crew information sharing patterns will improve the team's ability to leverage parallel	skills/advanced_cross_crew_information_sharing.md	
2026-04-09T11:56:16.330376+00:00	exp_202604091156_39fe	0.842681	0.842681	+0.000000	keep	skill	Adding a skill for advanced web search summarization techniques will improve the quality of synthesized information from	skills/advanced_web_search_summarization.md	
2026-04-09T11:56:29.402485+00:00	exp_202604091156_ad18	0.842681	0.842681	+0.000000	keep	skill	Adding a skill for advanced web search summarization techniques will improve output quality and reduce response length w	skills/advanced_web_search_summarization.md	
2026-04-09T12:01:11.644087+00:00	exp_202604091201_5eef	0.842681	0.842681	+0.000000	keep	skill	Adding a skill for advanced multi-step reasoning patterns will improve the team's ability to handle complex tasks by bre	skills/advanced_multi_step_reasoning.md	
2026-04-09T12:01:20.961803+00:00	exp_202604091201_6cdf	0.842681	0.842681	+0.000000	keep	skill	Adding a skill for advanced multi-step reasoning patterns will improve the team's ability to handle complex tasks by bre	skills/advanced_multi_step_reasoning.md	
2026-04-09T12:01:30.329190+00:00	exp_202604091201_a493	0.842681	0.842681	+0.000000	keep	skill	Adding a skill for advanced multi-step reasoning patterns will improve the team's ability to handle complex tasks by bre	skills/advanced_multi_step_reasoning.md	
2026-04-09T12:01:58.397091+00:00	exp_202604091201_b752	0.842681	0.842681	+0.000000	keep	skill	Adding a skill for advanced cross-crew information sharing patterns will improve collaboration efficiency and reduce red	skills/advanced_cross_crew_information_sharing.md	
2026-04-09T12:20:29.819072+00:00	exp_202604091220_6cdf	0.842681	0.842681	+0.000000	keep	skill	Adding a skill for advanced multi-step reasoning patterns will improve the team's ability to handle complex tasks by bre	skills/advanced_multi_step_reasoning.md	
2026-04-09T12:21:06.577914+00:00	exp_202604091221_6cdf	0.842681	0.842681	+0.000000	keep	skill	Adding a skill for advanced multi-step reasoning patterns will improve the team's ability to handle complex tasks by bre	skills/advanced_multi_step_reasoning_patterns.md	
2026-04-09T14:41:28.741643+00:00	exp_202604091441_6cdf	0.898970	0.898970	+0.000000	keep	skill	Adding a skill for advanced multi-step reasoning patterns will improve the team's ability to handle complex tasks by bre	skills/advanced_multi_step_reasoning_patterns.md	
2026-04-09T14:45:28.172321+00:00	exp_202604091445_cab9	0.898970	0.898970	+0.000000	keep	skill	Adding a skill for advanced multi-step reasoning patterns will improve the team's ability to handle complex tasks by bre	skills/advanced_multi_step_reasoning.md	
2026-04-09T14:45:54.867733+00:00	exp_202604091445_6cdf	0.898970	0.898970	+0.000000	keep	skill	Adding a skill for advanced multi-step reasoning patterns will improve the team's ability to handle complex tasks by bre	skills/advanced_multi_step_reasoning.md	
