ts	experiment_id	metric_before	metric_after	delta	status	change_type	hypothesis	files_changed
2026-03-31T00:07:53.035417+00:00	exp_202603310007_ab53	0.876445	0.000000	+0.000000	pending	code	Adding initial validation checks for None/empty LLM responses and API errors before processing will reduce error rate		
2026-03-31T00:08:08.713838+00:00	exp_202603310008_a96a	0.876445	0.000000	+0.000000	pending	code	Adding explicit validation and retry logic for empty/None LLM responses will reduce ValueError occurrences and improve t		
2026-03-31T00:08:38.048999+00:00	exp_202603310008_d8f6	0.876445	0.000000	+0.000000	pending	code	Adding explicit validation and retry logic for empty/None LLM responses will reduce error rates and improve task success		
2026-03-31T00:08:55.301014+00:00	exp_202603310008_efbd	0.876445	0.000000	+0.000000	pending	code	Adding explicit validation and retry logic for None/empty LLM responses in the handle_task function will reduce the recu		
2026-03-31T00:09:10.470618+00:00	exp_202603310009_9213	0.876445	0.000000	+0.000000	pending	code	Adding explicit validation and retry logic for LLM responses will reduce errors caused by empty or None responses		
2026-03-31T00:09:22.691838+00:00	exp_202603310009_e577	0.876445	0.000000	+0.000000	pending	code	Adding explicit validation and retry logic for None/empty LLM responses will reduce ValueError and BadRequestError occur		
2026-03-31T00:09:32.410311+00:00	exp_202603310009_b0ed	0.876445	0.000000	+0.000000	pending	code	Adding explicit validation and retry logic for None/empty LLM responses will reduce the ValueError occurrences and impro		
2026-03-31T12:00:26.559874+00:00	exp_202603311200_99e5	0.878112	0.000000	+0.000000	pending	code	Adding explicit validation checks for None/empty LLM responses will reduce ValueError occurrences and improve system rel		
2026-03-31T12:00:59.916195+00:00	exp_202603311200_7589	0.878112	0.000000	+0.000000	pending	code	Adding explicit validation and retry logic for None/empty LLM responses will reduce ValueError occurrences and improve t		
2026-03-31T12:01:17.756928+00:00	exp_202603311201_c81c	0.878112	0.000000	+0.000000	pending	code	Adding explicit validation and retry logic for None/empty LLM responses will reduce the recurring ValueError errors and 		
2026-03-31T12:01:37.673302+00:00	exp_202603311201_b31c	0.878112	0.000000	+0.000000	pending	code	Adding explicit validation and retry logic for None/empty LLM responses will reduce the recurring ValueError errors seen		
2026-03-31T12:02:14.651207+00:00	exp_202603311202_d732	0.878112	0.000000	+0.000000	pending	code	Adding explicit validation and retry logic for empty/None LLM responses will reduce error rate by handling these cases g		
2026-03-31T20:30:35.111569+00:00	exp_202603312030_bb33	0.873210	0.000000	+0.000000	pending	code	Adding explicit validation and retry logic for None/empty LLM responses will reduce error rate by catching and recoverin		
2026-03-31T20:31:14.386666+00:00	exp_202603312031_7599	0.873210	0.000000	+0.000000	pending	code	Adding explicit validation and retry logic for None/empty LLM responses will reduce error rate and improve reliability		
2026-03-31T20:31:54.102978+00:00	exp_202603312031_b810	0.873210	0.000000	+0.000000	pending	code	Adding validation checks for None/empty LLM responses will reduce recurring ValueErrors and improve error handling robus		
2026-03-31T20:34:27.117934+00:00	exp_202603312034_8f43	0.873210	0.000000	+0.000000	pending	code	Adding robust validation and retry logic for LLM responses will reduce the occurrence of ValueError and BadRequestError 		
2026-03-31T20:35:52.795575+00:00	exp_202603312035_c34a	0.873210	0.000000	+0.000000	pending	code	Adding a validation wrapper with retry logic for LLM responses will reduce the recurring 'None or empty response' errors		
2026-03-31T20:37:34.568871+00:00	exp_202603312036_4101	0.500000	0.875273	+0.375273	keep	skill	Adding explicit validation and retry logic for None/empty LLM responses will reduce recurring ValueError errors and impr	skills/llm_response_validation.md	
2026-03-31T20:39:15.420243+00:00	exp_202603312038_d93e	0.875273	0.878710	+0.003437	keep	skill	Optimizing web search result synthesis and summarization will improve output quality by reducing redundant or irrelevant	skills/advanced_web_search_summarization.md	
2026-03-31T20:51:02.113169+00:00	exp_202603312049_2aec	0.878710	0.882293	+0.003583	keep	skill	Adding robust validation and retry logic for LLM responses will reduce recurring errors like ValueError and BadRequestEr	skills/comprehensive_llm_error_handling.md	
2026-03-31T20:52:48.080932+00:00	exp_202603312052_8c52	0.882293	0.000000	+0.000000	pending	code	Adding a validation wrapper with retry logic for LLM responses will reduce errors related to None/empty responses and Op		
2026-03-31T21:01:07.581586+00:00	exp_202603312054_0653	0.882293	0.879293	-0.003000	keep	skill	Adding a skill for handling API connection errors will reduce recurring APIConnectionError incidents, as they currently 	skills/api_error_handling.py	
2026-03-31T21:04:27.614204+00:00	exp_202603312104_3fa1	0.877043	0.000000	+0.000000	pending	code	Adding explicit validation and retry logic for empty/None LLM responses will reduce error rates and improve reliability		
2026-03-31T21:08:25.613685+00:00	exp_202603312108_0586	0.877043	0.000000	+0.000000	pending	code	Adding explicit validation and retry logic for None/empty LLM responses will reduce ValueErrors and BadRequestErrors		
2026-04-01T00:02:43.147787+00:00	exp_202604010002_b0ee	0.868414	0.000000	+0.000000	pending	code	Adding a comprehensive validation wrapper with retry logic will reduce None/empty LLM response errors.		
2026-04-01T00:16:08.471631+00:00	exp_202604010003_df87	0.879293	0.853466	-0.025827	discard	skill	Improving prompt engineering for concise Signal-friendly responses will enhance output quality and reduce redundancy, as	skills/prompt_templates.md	
2026-04-01T00:20:04.762655+00:00	exp_202604010020_8e83	0.853466	0.000000	+0.000000	pending	code	Adding explicit validation and retry logic for None/empty LLM responses will reduce recurring errors in handle_task and 		
2026-04-01T00:22:44.508280+00:00	exp_202604010022_fccf	0.853466	0.000000	+0.000000	pending	code	Adding comprehensive response validation and retry logic will reduce LLM-related errors by catching empty/None responses		
2026-04-01T00:23:26.803264+00:00	exp_202604010003_3ae6	0.879293	0.853466	-0.025827	discard	skill	Improving prompt engineering for more concise Signal-friendly responses will enhance output quality and user satisfactio	skills/signal_prompt_optimization_skill.py	
2026-04-01T00:25:58.281222+00:00	exp_202604010025_682a	0.853466	0.000000	+0.000000	pending	code	Adding explicit validation and retry logic for LLM API calls will reduce error rate by handling None/empty responses and		
2026-04-01T00:28:33.667093+00:00	exp_202604010028_ec10	0.853466	0.000000	+0.000000	pending	code	Adding validation and retry logic for LLM API calls will reduce ValueError occurrences from None/empty responses		
2026-04-01T00:29:47.801994+00:00	exp_202604010029_1217	0.853466	0.000000	+0.000000	pending	code	Adding comprehensive response validation and retry logic for LLM API calls will reduce errors and improve reliability		
2026-04-01T00:30:27.655484+00:00	exp_202604010030_5f93	0.853466	0.853466	+0.000000	discard	code	Adding a validation wrapper with retry logic for LLM responses will reduce recurring errors like ValueError and BadReque	skills/validation.py,skills/handle_task.py,skills/research.py	No improvement (delta=+0.0000), reverted
2026-04-01T00:33:24.804414+00:00	exp_202604010033_fa94	0.853466	0.000000	+0.000000	pending	code	Adding explicit None/empty response validation and retry logic will reduce LLM API errors		
2026-04-01T00:34:57.841722+00:00	exp_202604010034_6894	0.853466	0.000000	+0.000000	pending	code	Adding comprehensive validation and retry logic for LLM API calls will reduce error rate by handling empty/None response		
2026-04-01T00:40:14.829889+00:00	exp_202604010038_f5e1	0.500000	0.853466	+0.353466	keep	skill	Implementing explicit validation and retry logic for empty/None LLM responses will reduce recurring ValueError errors an	skills/validate_and_retry_llm_response.py	
2026-04-01T00:40:50.360479+00:00	exp_202604010040_271a	0.853466	0.000000	+0.000000	pending	code	Adding explicit validation and retry logic for None/empty LLM responses will reduce error rates and improve task success		
2026-04-01T00:42:35.412416+00:00	exp_202604010042_6667	0.853466	0.000000	+0.000000	pending	code	Adding explicit validation and retry logic for LLM API calls will reduce recurring errors related to invalid or empty re		
2026-04-01T00:50:04.648153+00:00	exp_202604010050_c899	0.853466	0.000000	+0.000000	pending	code	Adding explicit validation and retry logic for LLM API calls will reduce error rate by handling None/empty responses and		
2026-04-01T00:52:19.892261+00:00	exp_202604010052_dee3	0.853466	0.000000	+0.000000	pending	code	Adding explicit validation and retry logic for None/empty LLM responses will reduce error rate by catching and retrying 		
2026-04-01T00:53:08.040793+00:00	exp_202604010053_3fe7	0.853466	0.000000	+0.000000	pending	code	Adding comprehensive validation and retry logic for all LLM API calls will reduce the 'Invalid response from LLM call - 		
2026-04-01T00:57:27.920756+00:00	exp_202604010057_99e8	0.853466	0.000000	+0.000000	pending	code	Adding explicit validation and retry logic for None/empty LLM responses will reduce error rates and improve reliability		
2026-04-01T00:58:10.480628+00:00	exp_202604010058_940d	0.853466	0.000000	+0.000000	pending	code	Adding validation and retry logic for None/empty LLM responses will reduce errors and improve reliability		
2026-04-01T01:00:57.774921+00:00	exp_202604010059_f9da	0.500000	0.853466	+0.353466	keep	skill	Adding a skill for handling LLM API connection errors will reduce recurring APIConnectionError errors and improve task s	skills/llm_api_error_handling.py	
2026-04-01T01:02:24.715857+00:00	exp_202604010102_9c4c	0.853466	0.000000	+0.000000	pending	code	Adding explicit validation and retry logic for LLM API calls will reduce error rate and improve reliability		
2026-04-01T01:05:40.132760+00:00	exp_202604010105_4598	0.853466	0.000000	+0.000000	pending	code	Adding explicit validation and retry logic for None/empty LLM responses will reduce errors		
2026-04-01T01:14:43.620517+00:00	exp_202604010114_56ad	0.853466	0.000000	+0.000000	pending	code	Adding robust validation and retry logic for LLM API calls will reduce error rates and improve task success		
2026-04-01T01:15:38.533254+00:00	exp_202604010114_507d	0.853466	0.853466	+0.000000	keep	skill	Improving multi-step reasoning patterns for complex tasks will enhance output quality and reduce redundancy in responses	skills/multi_step_reasoning_complex_tasks.py	
2026-04-01T01:19:05.634473+00:00	exp_202604010119_9031	0.848216	0.000000	+0.000000	pending	code	Implementing a validation wrapper with retry logic for LLM API responses will reduce recurring None/empty response error		
2026-04-01T01:19:27.785752+00:00	exp_202604010119_ab84	0.848216	0.848216	+0.000000	discard	code	Adding explicit validation and retry logic for None/empty LLM responses will reduce recurring ValueError errors	skills/comprehensive_llm_error_handling.py	No improvement (delta=+0.0000), reverted
2026-04-01T01:20:40.077668+00:00	exp_202604010120_56dc	0.848216	0.000000	+0.000000	pending	code	Adding robust validation and retry logic for LLM API responses will reduce None/empty errors by catching them at the sou		
2026-04-02T00:06:39.109784+00:00	exp_202604020005_b315	0.853466	0.918247	+0.064781	keep	skill	Adding advanced web search summarization techniques will improve the efficiency and relevance of search result synthesis	skills/advanced_web_search_summarization.md	
2026-04-02T00:07:37.542182+00:00	exp_202604020007_2cd7	0.918247	0.000000	+0.000000	pending	code	Adding explicit validation and retry logic for None/empty LLM responses will reduce the recurring ValueError errors obse		
2026-04-02T00:08:32.460596+00:00	exp_202604020008_0498	0.918247	0.000000	+0.000000	pending	code	Adding explicit validation and retry logic for LLM API calls to handle None/empty responses will reduce the recurring 'V		
2026-04-02T00:09:05.116390+00:00	exp_202604020009_01ea	0.918247	0.000000	+0.000000	pending	code	Adding explicit validation and retry logic for None/empty LLM responses will reduce the recurring 'ValueError: Invalid r		
2026-04-02T00:10:38.498263+00:00	exp_202604020010_2db5	0.918247	0.000000	+0.000000	pending	code	Adding explicit validation and retry logic for None/empty LLM responses will reduce recurring ValueError errors in resea		
2026-04-02T12:02:24.453568+00:00	exp_202604021202_eb3b	0.918247	0.000000	+0.000000	pending	code	Adding explicit validation and retry logic for None/empty LLM responses will reduce the recurring ValueError errors obse		
2026-04-02T12:06:13.732225+00:00	exp_202604021205_ee62	0.500000	0.918247	+0.418247	keep	skill	Adding a skill for advanced web search summarization techniques will improve the quality and conciseness of responses by	skills/advanced_web_search_summarization.md	
2026-04-02T12:09:34.884950+00:00	exp_202604021209_edb1	0.918247	0.000000	+0.000000	pending	code	Adding explicit validation and retry logic for LLM API calls will reduce the occurrence of 'Invalid response from LLM ca		
2026-04-02T13:07:02.827397+00:00	exp_202604021307_fa1c	0.918247	0.918247	+0.000000	keep	skill	Improving multi-step reasoning patterns for complex tasks will enhance the team's ability to handle intricate queries mo	skills/advanced_multi_step_reasoning.md	
2026-04-02T13:10:29.640446+00:00	exp_202604021309_761d	0.918247	0.918247	+0.000000	keep	skill	Implementing a robust validation and retry wrapper for LLM API calls will reduce recurring errors like ValueError and Ba	skills/llm_api_error_handling.py	
2026-04-02T13:13:48.371949+00:00	exp_202604021313_ae83	0.918247	0.000000	+0.000000	pending	code	Adding robust validation and retry logic for LLM API calls to handle None/empty responses and BadRequestError errors, wh		
2026-04-02T13:15:46.139733+00:00	exp_202604021315_fb81	0.918247	0.000000	+0.000000	pending	code	Adding explicit validation and retry logic for LLM API responses to handle None/empty responses will reduce error rates 		
2026-04-02T13:17:10.356413+00:00	exp_202604021316_4fd4	0.918247	0.909962	-0.008285	discard	skill	Adding advanced web search summarization techniques will improve the relevance and efficiency of search result summaries	skills/advanced_web_search_summarization.md	
2026-04-03T00:00:25.234288+00:00	exp_202604030000_8af8	0.760310	0.760310	+0.000000	discard	code	Adding robust validation and retry logic for None/empty LLM responses will reduce recurring ValueError errors in handle_	error_handling.py	No improvement (delta=+0.0000), reverted
2026-04-03T00:02:06.694540+00:00	exp_202604030002_2c7e	0.760310	0.000000	+0.000000	pending	code	Adding explicit validation and retry logic for None/empty LLM responses will reduce the recurring ValueError errors and 		
2026-04-03T00:03:25.312179+00:00	exp_202604030003_b78d	0.760310	0.000000	+0.000000	pending	code	Adding explicit validation and retry logic for None/empty LLM responses will reduce error rate and improve task success 		
2026-04-03T00:04:17.832535+00:00	exp_202604030004_ac4e	0.760310	0.000000	+0.000000	pending	code	Adding explicit validation and retry logic for None/empty LLM responses will reduce the 'Invalid response from LLM call 		
2026-04-03T00:07:59.459200+00:00	exp_202604030007_f0e3	0.760310	0.000000	+0.000000	pending	code	Adding explicit validation and retry logic for LLM API calls to handle None/empty responses will reduce error rates and 		
2026-04-03T06:01:41.659275+00:00	exp_202604030600_c763	0.500000	0.760310	+0.260310	keep	skill	Adding a skill for advanced web search summarization techniques will improve synthesis and summarization of web search r	skills/advanced_web_search_summarization_techniques.md	
2026-04-03T06:05:13.857342+00:00	exp_202604030605_4ca2	0.765560	0.000000	+0.000000	pending	code	Adding explicit validation and retry logic for None/empty LLM responses will reduce error rates by handling cases where 		
2026-04-03T06:06:57.411965+00:00	exp_202604030605_09fb	0.760310	0.765841	+0.005531	keep	skill	Improving prompt engineering for more concise Signal-friendly responses will reduce redundancy and improve output qualit	skills/Signal_friendly_prompt_engineering.md	
2026-04-03T06:08:56.628540+00:00	exp_202604030608_7132	0.765841	0.765841	+0.000000	keep	skill	Adding a skill for advanced web search summarization techniques will improve the quality of synthesized responses from w	skills/advanced_web_search_summarization.md	
2026-04-03T06:11:28.364763+00:00	exp_202604030611_35f0	0.765841	0.000000	+0.000000	pending	code	Adding explicit validation and retry logic for LLM API calls to handle None/empty responses will reduce error rate and i		
2026-04-03T12:00:18.480050+00:00	exp_202604031200_35f0	0.772508	0.000000	+0.000000	pending	code	Adding explicit validation and retry logic for LLM API calls to handle None/empty responses will reduce error rate and i		
2026-04-03T12:00:49.141942+00:00	exp_202604031200_cdec	0.772508	0.000000	+0.000000	pending	code	Implementing explicit validation and retry logic for LLM API calls to handle None/empty responses will reduce error rate		
2026-04-03T12:10:16.500419+00:00	exp_202604031210_c97f	0.772508	0.000000	+0.000000	pending	code	Adding explicit validation and retry logic for LLM API calls to handle None/empty responses will reduce the 'Invalid res		
2026-04-03T12:15:03.867779+00:00	exp_202604031215_5eec	0.772508	0.000000	+0.000000	pending	code	Adding explicit validation and retry logic for LLM API responses to handle None/empty responses will reduce error rates 		
2026-04-03T12:17:35.900271+00:00	exp_202604031217_ebae	0.500000	0.772508	+0.272508	keep	skill	Adding a skill for advanced ecological crisis scenario planning will improve the team's ability to handle complex enviro	skills/advanced_ecological_crisis_scenario_planning.md	
2026-04-04T00:00:30.377321+00:00	exp_202604040000_3f36	0.894859	0.000000	+0.000000	pending	code	Implement a retry wrapper for LLM API calls to handle None/empty responses, which are causing recurring ValueError error		
2026-04-04T00:01:29.532373+00:00	exp_202604040000_55e3	0.772508	0.888450	+0.115942	keep	skill	Adding a skill for handling API credit-related errors will reduce recurring APIStatusError (402) errors by providing alt	skills/api_credit_error_handling.md	
2026-04-04T06:02:21.729014+00:00	exp_202604040602_40f5	0.894971	0.000000	+0.000000	pending	code	Adding explicit validation and retry logic for LLM API calls to handle None/empty responses will reduce the error rate a		
2026-04-04T06:03:31.867833+00:00	exp_202604040603_c97f	0.894971	0.000000	+0.000000	pending	code	Adding explicit validation and retry logic for LLM API calls to handle None/empty responses will reduce the 'Invalid res		
2026-04-04T06:05:03.098088+00:00	exp_202604040605_ae63	0.894971	0.000000	+0.000000	pending	code	Adding explicit validation and retry logic for LLM API calls to handle None/empty responses will reduce the frequency of		
2026-04-04T06:08:49.864797+00:00	exp_202604040608_e129	0.888450	0.896638	+0.008188	keep	skill	Adding a skill for handling LLM API response validation and retries will reduce recurring errors like ValueError and API	skills/handle_llm_api_errors.py	
2026-04-04T06:09:19.878650+00:00	exp_202604040609_92a7	0.896638	0.000000	+0.000000	pending	code	Adding explicit validation and retry logic for LLM API calls will reduce the occurrence of 'Invalid response from LLM ca		
2026-04-04T08:48:44.389132+00:00	exp_202604040848_ca5d	0.827942	0.000000	+0.000000	pending	code	Adding explicit validation and retry logic for LLM API calls to handle None or empty responses will reduce the recurring		
2026-04-04T08:50:13.914439+00:00	exp_202604040849_9c23	0.896638	0.827942	-0.068696	discard	skill	Adding a skill for handling API credit-related errors will reduce recurring APIStatusError 402 errors and improve task s	skills/handle_api_credit_errors.md	
2026-04-04T08:50:36.542136+00:00	exp_202604040850_43a6	0.896638	0.816165	-0.080473	discard	skill	Adding a skill for handling API credit-related errors will reduce recurring APIStatusError 402 errors and improve task s	skills/handle_api_credit_errors.md	
2026-04-04T08:52:39.941030+00:00	exp_202604040852_a429	0.896638	0.827276	-0.069362	discard	skill	Adding a skill for handling API credit-related errors will reduce recurring APIStatusError 402 errors, as these are curr	skills/api_credit_error_handler.py	
2026-04-04T08:54:18.486981+00:00	exp_202604040854_0788	0.827276	0.000000	+0.000000	pending	code	Implementing explicit validation and retry logic for LLM API calls will reduce the error rate by handling transient fail		
2026-04-04T08:58:59.974570+00:00	exp_202604040858_ea99	0.827276	0.827276	+0.000000	keep	skill	Adding a skill for advanced web search summarization techniques will improve the quality and efficiency of web search re	skills/advanced_web_search_summarization.md	
2026-04-04T08:59:58.642522+00:00	exp_202604040859_98b5	0.827276	0.000000	+0.000000	pending	code	Adding explicit validation and retry logic for LLM API calls to handle None/empty responses and APIStatusError 402 error		
2026-04-04T09:02:13.752209+00:00	exp_202604040902_98b5	0.827276	0.000000	+0.000000	pending	code	Adding explicit validation and retry logic for LLM API calls to handle None/empty responses and APIStatusError 402 error		
2026-04-04T09:03:44.131586+00:00	exp_202604040902_a470	0.827276	0.827276	+0.000000	keep	skill	Adding a skill for handling API credit-related errors will reduce recurring APIStatusError (402) issues, improving task 	skills/api_credit_error_handling.md	
