ts	experiment_id	metric_before	metric_after	delta	status	change_type	hypothesis	files_changed
2026-04-09T16:00:06.245453+00:00	exp_202604091600_49d7	0.898970	0.898970	+0.000000	discard	code	Optimizing prompt templates for shorter, more accurate responses will reduce average response time and improve output qu	app/core/prompt_templates.py	No improvement (delta=+0.0000), reverted
2026-04-09T16:03:45.770920+00:00	exp_202604091603_6cdf	0.898970	0.898970	+0.000000	keep	skill	Adding a skill for advanced multi-step reasoning patterns will improve the team's ability to handle complex tasks by bre	skills/advanced_multi_step_reasoning_patterns.md	
2026-04-09T16:22:24.721357+00:00	exp_202604091622_fd63	0.898970	0.898970	+0.000000	keep	skill	Adding a skill for advanced multi-step reasoning patterns will improve the team's ability to handle complex tasks by bre	skills/advanced_multi_step_reasoning_patterns.md	
2026-04-09T16:23:02.729728+00:00	exp_202604091623_e365	0.898970	0.898970	+0.000000	keep	skill	Adding a skill for advanced multi-step reasoning patterns will improve the team's ability to handle complex tasks by bre	skills/advanced_multi-step_reasoning_patterns.md	
2026-04-09T16:29:38.624771+00:00	exp_202604091629_6cdf	0.898970	0.898970	+0.000000	keep	skill	Adding a skill for advanced multi-step reasoning patterns will improve the team's ability to handle complex tasks by bre	skills/advanced_multi_step_reasoning.md	
2026-04-09T16:58:32.388740+00:00	exp_202604091658_e365	0.898970	0.898970	+0.000000	keep	skill	Adding a skill for advanced multi-step reasoning patterns will improve the team's ability to handle complex tasks by bre	skills/advanced_multi-step_reasoning_patterns.md	
2026-04-09T18:12:57.600965+00:00	exp_202604091812_7353	0.898970	0.898970	+0.000000	discard	code	Improving error recovery for 'coding:APIConnectionError' by implementing a dynamic retry mechanism with exponential back	app/tools/api_handler.py	No improvement (delta=+0.0000), reverted
2026-04-09T18:53:32.426023+00:00	exp_202604091853_47e6	0.914436	0.914436	+0.000000	keep	skill	Adding a skill for advanced multi-step reasoning patterns will improve the team's ability to handle complex tasks by bre	skills/advanced_multi_step_reasoning_patterns.md	
2026-04-09T22:18:07.171915+00:00	exp_202604092218_ee5d	0.917769	0.917769	+0.000000	keep	skill	Adding a skill for advanced web search summarization techniques will improve the quality and conciseness of search resul	skills/advanced_web_search_summarization.md	
2026-04-09T22:20:08.588634+00:00	exp_202604092220_3b11	0.917769	0.917769	+0.000000	keep	skill	Adding a skill for advanced ecological crisis communication strategies will enhance the team's ability to synthesize and	skills/advanced_ecological_crisis_communication.md	
2026-04-09T22:28:36.505867+00:00	exp_202604092228_644f	0.917769	0.917769	+0.000000	keep	skill	Adding a skill for advanced multi-modal reasoning patterns will enhance the team's ability to handle complex tasks that 	skills/advanced_multi_modal_reasoning_patterns.md	
2026-04-09T22:28:58.420595+00:00	exp_202604092228_e365	0.917769	0.917769	+0.000000	keep	skill	Adding a skill for advanced multi-step reasoning patterns will improve the team's ability to handle complex tasks by bre	skills/advanced_multi-step_reasoning_patterns.md	
2026-04-09T22:38:54.560818+00:00	exp_202604092238_7930	0.917769	0.000000	+0.000000	pending	code	Optimize memory retrieval by implementing a caching mechanism for frequently accessed data to reduce redundant API calls		
2026-04-09T22:40:32.788010+00:00	exp_202604092240_1c5e	0.917769	0.917769	+0.000000	keep	skill	Adding a skill for advanced multi-modal reasoning patterns will improve the team's ability to synthesize information fro	skills/advanced_multi_modal_reasoning_patterns.md	
2026-04-10T05:45:28.171040+00:00	exp_202604100545_1a82	0.933236	0.933236	+0.000000	keep	skill	Adding a skill for advanced multi-modal reasoning patterns will expand the team's capability to handle complex tasks tha	skills/advanced_multi_modal_reasoning.md	
2026-04-10T05:45:38.334264+00:00	exp_202604100545_4fbe	0.933236	0.933236	+0.000000	keep	skill	Adding a skill for advanced multi-modal reasoning patterns will expand the team's capability to handle complex tasks tha	skills/advanced_multi_modal_reasoning_patterns.md	
2026-04-10T06:02:51.392447+00:00	exp_202604100602_320b	0.933236	0.933236	+0.000000	keep	skill	Adding a skill for advanced multi-modal reasoning patterns will expand the team's capability to handle complex tasks tha	skills/advanced_multi_modal_reasoning.md	
2026-04-10T06:05:02.377952+00:00	exp_202604100605_ed1b	0.933236	0.933236	+0.000000	discard	code	Implementing a caching mechanism for memory retrieval will optimize response times and reduce redundant API calls, impro	app/core/memory_retrieval.py	No improvement (delta=+0.0000), reverted
2026-04-10T06:05:26.759537+00:00	exp_202604100605_fd7f	0.933236	0.933236	+0.000000	keep	skill	Adding a skill for advanced ecological crisis communication strategies will enhance the team's ability to synthesize and	skills/advanced_ecological_crisis_communication_strategies.md	
2026-04-10T06:05:38.901029+00:00	exp_202604100605_6cdf	0.933236	0.933236	+0.000000	keep	skill	Adding a skill for advanced multi-step reasoning patterns will improve the team's ability to handle complex tasks by bre	skills/advanced_multi_step_reasoning_patterns.md	
2026-04-10T06:05:55.511728+00:00	exp_202604100605_2d68	0.933236	0.933236	+0.000000	keep	skill	Adding a skill for advanced multi-modal reasoning patterns will expand the team's capability to handle complex tasks tha	skills/advanced_multi_modal_reasoning.md	
2026-04-10T07:04:12.414363+00:00	exp_202604100704_50ad	0.931315	0.931315	+0.000000	keep	skill	Adding a skill for advanced web search result synthesis and summarization will improve the quality of responses by provi	skills/advanced_web_search_summarization.md	
2026-04-10T07:07:09.970082+00:00	exp_202604100707_0b23	0.931315	0.931315	+0.000000	keep	skill	Adding a skill for advanced multi-step reasoning patterns will improve the team's ability to handle complex tasks by bre	skills/advanced_multi_step_reasoning_patterns.md	
2026-04-10T07:13:21.006226+00:00	exp_202604100713_3398	0.931315	0.931315	+0.000000	discard	code	Improve prompt engineering for concise Signal-friendly responses to enhance output quality and reduce verbosity.	app/prompt_templates.py	No improvement (delta=+0.0000), reverted
2026-04-10T07:17:09.924409+00:00	exp_202604100717_3adb	0.928315	0.928315	+0.000000	keep	skill	Adding a skill for advanced multi-step reasoning patterns will improve the team's ability to handle complex tasks by bre	skills/advanced_multi_step_reasoning_patterns.md	
2026-04-10T07:17:23.782151+00:00	exp_202604100717_fd63	0.928315	0.928315	+0.000000	keep	skill	Adding a skill for advanced multi-step reasoning patterns will improve the team's ability to handle complex tasks by bre	skills/advanced_multi_step_reasoning.md	
2026-04-11T18:00:09.007526+00:00	exp_202604111800_d072	0.860981	0.860981	+0.000000	keep	skill	Adding a skill for advanced multi-step reasoning patterns will improve the crew's ability to handle complex tasks by bre	skills/advanced_multi_step_reasoning_patterns.md	
2026-04-11T18:00:56.967955+00:00	exp_202604111800_a38d	0.860981	0.860981	+0.000000	keep	skill	Adding a skill for advanced multi-step reasoning patterns will improve the team's ability to handle complex tasks by bre	skills/advanced_multi_step_reasoning.md	
2026-04-11T18:02:55.442439+00:00	exp_202604111802_6cdf	0.860981	0.860981	+0.000000	keep	skill	Adding a skill for advanced multi-step reasoning patterns will improve the team's ability to handle complex tasks by bre	skills/advanced_multi_step_reasoning_patterns.md	
2026-04-11T18:03:24.999678+00:00	exp_202604111803_fd63	0.860981	0.860981	+0.000000	keep	skill	Adding a skill for advanced multi-step reasoning patterns will improve the team's ability to handle complex tasks by bre	skills/advanced_multi_step_reasoning.md	
2026-04-11T18:03:33.122446+00:00	exp_202604111803_62bd	0.860981	0.860981	+0.000000	keep	skill	Adding a skill for advanced multi-step reasoning patterns will improve the team's ability to handle complex tasks by bre	skills/advanced_multi_step_reasoning_patterns.md	
2026-04-12T00:00:08.625943+00:00	exp_202604120000_e365	0.895745	0.895745	+0.000000	keep	skill	Adding a skill for advanced multi-step reasoning patterns will improve the team's ability to handle complex tasks by bre	skills/advanced_multi-step_reasoning_patterns.md	
2026-04-12T00:00:16.822561+00:00	exp_202604120000_591b	0.895745	0.895745	+0.000000	keep	skill	Adding a skill for advanced multi-modal reasoning patterns will enhance the team's ability to synthesize diverse data ty	skills/advanced_multi_modal_reasoning.md	
2026-04-12T00:00:26.118367+00:00	exp_202604120000_32c3	0.895745	0.895745	+0.000000	keep	skill	Adding a skill for advanced multi-modal reasoning patterns will expand the team's capability to handle complex tasks tha	skills/advanced_multi_modal_reasoning.md	
2026-04-12T00:00:33.590709+00:00	exp_202604120000_3b11	0.895745	0.895745	+0.000000	keep	skill	Adding a skill for advanced ecological crisis communication strategies will enhance the team's ability to synthesize and	skills/advanced_ecological_crisis_communication.md	
2026-04-12T00:05:49.728553+00:00	exp_202604120005_c753	0.895745	0.895745	+0.000000	keep	skill	Adding a skill for advanced ecological crisis communication will improve the team's ability to handle complex environmen	skills/advanced_ecological_crisis_communication.md	
2026-04-12T06:04:54.480679+00:00	exp_202604120604_d3ea	0.895745	0.895745	+0.000000	keep	skill	Adding a skill for advanced multi-step reasoning patterns will improve the team's ability to handle complex tasks by bre	skills/advanced_multi_step_reasoning_patterns.md	
2026-04-12T06:05:01.433560+00:00	exp_202604120605_e365	0.895745	0.895745	+0.000000	keep	skill	Adding a skill for advanced multi-step reasoning patterns will improve the team's ability to handle complex tasks by bre	skills/advanced_multi-step_reasoning_patterns.md	
2026-04-12T06:09:10.204312+00:00	exp_202604120609_e365	0.895745	0.895745	+0.000000	keep	skill	Adding a skill for advanced multi-step reasoning patterns will improve the team's ability to handle complex tasks by bre	skills/advanced_multi-step_reasoning_patterns.md	
2026-04-12T06:10:08.577286+00:00	exp_202604120609_cbbe	0.895745	0.895745	+0.000000	keep	skill	Adding a skill for advanced web search summarization techniques will improve output quality by reducing response length 	skills/advanced_web_search_summarization_techniques.md	
2026-04-12T06:11:33.266493+00:00	exp_202604120611_58a8	0.895745	0.895745	+0.000000	discard	code	Optimizing web search result synthesis and summarization to reduce redundant API calls and improve response accuracy	app/tools/web_search.py	No improvement (delta=+0.0000), reverted
2026-04-12T12:02:04.725287+00:00	exp_202604121202_fd63	0.896471	0.896471	+0.000000	keep	skill	Adding a skill for advanced multi-step reasoning patterns will improve the team's ability to handle complex tasks by bre	skills/advanced_multi_step_reasoning.md	
2026-04-12T12:07:59.669023+00:00	exp_202604121207_e9bd	0.896471	0.896471	+0.000000	keep	skill	Adding a skill for advanced web search summarization techniques will improve the quality and efficiency of web search re	skills/advanced_web_search_summarization.md	
2026-04-12T12:08:14.318165+00:00	exp_202604121208_ebc0	0.896471	0.896471	+0.000000	keep	skill	Adding a skill for advanced multi-modal reasoning patterns will expand the team's capability to handle complex tasks tha	skills/advanced_multi_modal_reasoning_patterns.md	
2026-04-12T12:09:41.837676+00:00	exp_202604121209_1a96	0.896471	0.896471	+0.000000	keep	skill	Adding a skill for advanced multi-modal reasoning patterns will improve the team's ability to handle complex tasks that 	skills/advanced_multi_modal_reasoning_patterns.md	
2026-04-12T12:10:49.115638+00:00	exp_202604121210_5cfd	0.896471	0.896471	+0.000000	keep	skill	Adding a skill for optimizing memory retrieval patterns will improve efficiency by reducing redundant retrievals and foc	skills/memory_retrieval_optimization.md	
2026-04-12T18:03:15.526940+00:00	exp_202604121803_99ee	0.895308	0.895308	+0.000000	keep	skill	Adding a skill for optimizing prompt engineering to reduce response length while maintaining accuracy will improve outpu	skills/optimized_prompt_engineering.md	
2026-04-12T18:04:55.762322+00:00	exp_202604121804_d9db	0.895308	0.895308	+0.000000	keep	skill	Adding a skill for advanced multi-modal reasoning patterns will enhance the team's ability to synthesize information fro	skills/advanced_multi_modal_reasoning.md	
2026-04-12T18:05:29.915625+00:00	exp_202604121805_abce	0.895308	0.895308	+0.000000	keep	skill	Adding a skill for advanced prompt engineering techniques to improve response conciseness and clarity, aligning with the	skills/advanced_prompt_engineering.md	
2026-04-12T18:19:18.204712+00:00	exp_202604121810_6099	0.895308	0.894117	-0.001191	keep	skill	Adding a skill for rapid ecological report summarization will improve synthesis of biodiversity assessments and stakehol	skills/rapid_ecological_report_summarization.md	
2026-04-12T18:27:54.761198+00:00	exp_202604121827_4507	0.894117	0.894117	+0.000000	keep	skill	Adding a skill for optimizing web search result synthesis and summarization will improve output quality by reducing redu	skills/optimized_web_search_synthesis.md	
2026-04-13T00:00:28.613675+00:00	exp_202604130000_ad18	0.886554	0.886554	+0.000000	keep	skill	Adding a skill for advanced web search summarization techniques will improve output quality and reduce response length w	skills/advanced_web_search_summarization.md	
2026-04-13T00:00:38.823295+00:00	exp_202604130000_abd8	0.886554	0.886554	+0.000000	keep	skill	Adding a skill for advanced multi-modal reasoning patterns will expand the team's capability to handle complex tasks tha	skills/advanced_multi_modal_reasoning.md	
2026-04-13T00:02:34.767223+00:00	exp_202604130002_b298	0.886554	0.886554	+0.000000	keep	skill	Adding a skill for advanced multi-modal reasoning patterns will enhance the team's ability to synthesize information fro	skills/advanced_multi_modal_reasoning_patterns.md	
2026-04-13T00:03:17.641871+00:00	exp_202604130003_28f3	0.886554	0.886554	+0.000000	keep	skill	Adding a skill for advanced multi-step reasoning patterns will improve the team's ability to handle complex ecological r	skills/advanced_multi_step_reasoning_patterns.md	
2026-04-13T00:03:25.852348+00:00	exp_202604130003_e365	0.886554	0.886554	+0.000000	keep	skill	Adding a skill for advanced multi-step reasoning patterns will improve the team's ability to handle complex tasks by bre	skills/advanced_multi-step_reasoning_patterns.md	
2026-04-14T00:10:07.863687+00:00	exp_202604140010_49e2	0.904804	0.904804	+0.000000	keep	skill	Adding a skill for optimizing web search result synthesis and summarization will improve output quality by reducing redu	skills/optimized_web_search_synthesis.md	
2026-04-14T00:11:10.326708+00:00	exp_202604140011_9bd7	0.904804	0.904804	+0.000000	keep	skill	Adding a skill for advanced multi-step reasoning patterns will improve the team's ability to handle complex tasks by bre	skills/advanced_multi_step_reasoning.md	
2026-04-14T00:11:18.336824+00:00	exp_202604140011_8be8	0.904804	0.904804	+0.000000	keep	skill	Adding a skill for advanced multi-step reasoning patterns will improve the team's ability to handle complex ecological r	skills/advanced_multi_step_reasoning_patterns.md	
2026-04-14T00:11:25.447028+00:00	exp_202604140011_8be8	0.904804	0.904804	+0.000000	keep	skill	Adding a skill for advanced multi-step reasoning patterns will improve the team's ability to handle complex ecological r	skills/advanced_multi_step_reasoning_ecology.md	
2026-04-14T00:12:00.674530+00:00	exp_202604140011_ac9d	0.904804	0.904804	+0.000000	keep	skill	Adding a skill for LLM response validation and retry logic will reduce error rates by handling empty or failed responses	skills/llm_response_validation.md	
2026-04-14T06:01:34.822999+00:00	exp_202604140601_6cdf	0.905622	0.905622	+0.000000	keep	skill	Adding a skill for advanced multi-step reasoning patterns will improve the team's ability to handle complex tasks by bre	skills/advanced_multi_step_reasoning_patterns.md	
2026-04-14T06:01:43.186713+00:00	exp_202604140601_fe7d	0.905622	0.905622	+0.000000	keep	skill	Adding a skill for advanced multi-modal reasoning patterns will enhance the team's ability to synthesize information fro	skills/advanced_multi_modal_reasoning.md	
2026-04-14T06:29:35.445658+00:00	exp_202604140629_3bc3	0.905622	0.905622	+0.000000	keep	skill	Adding a skill for advanced multi-modal reasoning patterns will improve the team's ability to synthesize and analyze com	skills/advanced_multi_modal_reasoning.md	
2026-04-14T06:37:01.447127+00:00	exp_202604140637_703e	0.905622	0.905622	+0.000000	keep	skill	Adding advanced web search summarization techniques will improve output quality and reduce response length without losin	skills/advanced_web_search_summarization.md	
2026-04-14T06:42:26.717894+00:00	exp_202604140642_6315	0.905622	0.905622	+0.000000	keep	skill	Adding a skill for optimizing multi-step reasoning patterns will improve the team's ability to handle complex tasks by b	skills/advanced_multi_step_reasoning_patterns.md	
2026-04-14T12:00:34.881314+00:00	exp_202604141200_5eef	0.905495	0.905495	+0.000000	keep	skill	Adding a skill for advanced multi-step reasoning patterns will improve the team's ability to handle complex tasks by bre	skills/advanced_multi_step_reasoning_patterns.md	
2026-04-14T12:06:42.815539+00:00	exp_202604141206_5eef	0.905495	0.905495	+0.000000	keep	skill	Adding a skill for advanced multi-step reasoning patterns will improve the team's ability to handle complex tasks by bre	skills/advanced_multi_step_reasoning.md	
2026-04-14T12:07:25.007106+00:00	exp_202604141207_39a0	0.905495	0.905495	+0.000000	keep	skill	Adding a skill for advanced multi-modal reasoning patterns will expand the team's capability to handle complex tasks tha	skills/advanced_multi_modal_reasoning.md	
2026-04-14T12:10:58.104943+00:00	exp_202604141210_f728	0.905495	0.905495	+0.000000	keep	skill	Adding a skill for advanced web search summarization will improve the synthesis of web search results, leading to more a	skills/advanced_web_search_summarization.md	
2026-04-14T12:12:51.258931+00:00	exp_202604141212_47e6	0.905495	0.905495	+0.000000	keep	skill	Adding a skill for advanced multi-step reasoning patterns will improve the team's ability to handle complex tasks by bre	skills/advanced_multi_step_reasoning.md	
2026-04-14T18:04:50.439828+00:00	exp_202604141801_9a7e	0.905495	0.906792	+0.001297	keep	skill	Adding a skill for advanced ecological crisis scenario planning will improve the team's ability to handle complex ecolog	skills/advanced_ecological_crisis_scenario_planning.md	
2026-04-15T00:00:41.963349+00:00	exp_202604150000_2ee0	0.906792	0.908643	+0.001851	keep	skill	Adding a skill for LLM response validation and retry logic will reduce the occurrence of empty or failed outputs by impl	skills/llm_response_validation.md	
2026-04-15T00:00:58.372746+00:00	exp_202604150000_c4b9	0.908643	0.908643	+0.000000	keep	skill	Adding a skill for advanced ecological data synthesis will improve the team's ability to handle complex ecological resea	skills/advanced_ecological_data_synthesis.md	
2026-04-15T00:03:39.555341+00:00	exp_202604150003_a467	0.908643	0.908643	+0.000000	keep	skill	Adding a skill for Ecological Policy Impact Assessment (EcIA) will enhance the team's ability to handle ecological resea	skills/ecological_policy_impact_assessment.md	
2026-04-15T00:05:11.154980+00:00	exp_202604150005_a4fc	0.908643	0.908643	+0.000000	keep	skill	Adding a skill for advanced web search summarization will improve the quality of synthesized information from search res	skills/advanced_web_search_summarization.md	
2026-04-15T00:06:02.895225+00:00	exp_202604150006_4d52	0.908643	0.908643	+0.000000	discard	code	Optimizing memory retrieval patterns will reduce redundant API calls and improve response accuracy by implementing selec	app/handlers/memory_handler.py	No improvement (delta=+0.0000), reverted
2026-04-15T06:02:18.656267+00:00	exp_202604150602_00ab	0.908367	0.908367	+0.000000	keep	skill	Adding a skill for advanced ecological policy impact assessment will enhance the team's ability to analyze and report on	skills/advanced_ecological_policy_impact_assessment.md	
2026-04-15T06:02:33.132324+00:00	exp_202604150602_fd24	0.908367	0.908367	+0.000000	keep	skill	Adding a skill for advanced ecological policy impact assessment will improve the team's ability to handle complex policy	skills/advanced_ecological_policy_impact_assessment.md	
2026-04-15T06:02:41.043605+00:00	exp_202604150602_be2a	0.908367	0.908367	+0.000000	keep	skill	Adding a skill for advanced ecological policy impact assessment will improve the team's ability to handle complex policy	skills/advanced_ecological_policy_impact_assessment.md	
2026-04-15T06:07:13.245164+00:00	exp_202604150607_094b	0.908367	0.908367	+0.000000	keep	skill	Adding a skill for advanced web search summarization will improve the team's ability to synthesize and present search re	skills/advanced_web_search_summarization.md	
2026-04-15T06:08:43.875175+00:00	exp_202604150608_35a7	0.908367	0.908367	+0.000000	keep	skill	Adding a skill for advanced multi-step reasoning patterns will improve the team's ability to handle complex tasks by bre	skills/advanced_multi_step_reasoning_patterns.md	
2026-04-15T10:03:58.195496+00:00	exp_202604151003_e8b6	0.880122	0.880122	+0.000000	keep	skill	Adding a skill for advanced multi-modal reasoning patterns will improve the team's ability to synthesize information fro	skills/advanced_multi_modal_reasoning.md	
