ts	experiment_id	metric_before	metric_after	delta	status	change_type	hypothesis	files_changed
2026-03-22T09:31:26.466211+00:00	exp_202603220931_b1d7	0.782692	0.782692	+0.000000	keep	skill	Consolidating multiple Gemini error handling skills into a single unified version with enhanced validation and recovery 	skills/advanced_gemini_error_handling_unified_v15.md
2026-03-22T09:31:35.600675+00:00	exp_202603220931_00f4	0.782692	0.782692	+0.000000	keep	skill	Creating a unified skill for handling both ValueError and BadRequestError from LLM calls will reduce error rates and sim	skills/advanced_llm_error_handling_unified_v1.md
2026-03-22T09:32:18.531749+00:00	exp_202603220932_7648	0.782692	0.782692	+0.000000	keep	skill	Creating a universal Gemini error handling skill that handles both empty responses and BadRequest errors will reduce rec	skills/universal_gemini_error_handling_v1.md
2026-03-22T09:32:36.389511+00:00	exp_202603220932_fd54	0.782692	0.782692	+0.000000	keep	skill	Create a unified error handling skill that combines all existing Gemini error handling variants into a single robust ver	skills/advanced_gemini_error_handling_unified_v8.md
2026-03-22T09:33:15.315730+00:00	exp_202603220933_20f2	0.782692	0.782692	+0.000000	keep	skill	Consolidating all LLM response validation and error recovery into a single unified skill will simplify error handling an	skills/advanced_unified_llm_response_handling_v1.md
2026-03-22T09:34:59.121951+00:00	exp_202603220934_ca94	0.782692	0.782692	+0.000000	keep	skill	Creating a unified skill for handling both ValueError and BadRequestError from Gemini API calls will reduce error rates 	skills/advanced_gemini_error_handling_unified_v8.md
2026-03-22T09:35:39.068780+00:00	exp_202603220935_9d4d	0.782692	0.782692	+0.000000	keep	skill	Create a more robust LLM response validation skill that simplifies existing logic while better handling Gemini API error	skills/advanced_llm_response_validation_v14.md
2026-03-22T09:35:58.976422+00:00	exp_202603220935_8eb8	0.782692	0.782692	+0.000000	keep	skill	Create a unified error handling skill that combines all existing Gemini error recovery skills into one simpler version, 	skills/unified_gemini_error_handling_v1.md
2026-03-22T09:36:20.394824+00:00	exp_202603220936_38da	0.782692	0.782692	+0.000000	keep	skill	Combining all empty/invalid LLM response handling and Gemini API error recovery skills into a single unified skill will 	skills/advanced_unified_error_handling_v15.md
2026-03-22T09:36:58.634572+00:00	exp_202603220936_538e	0.782692	0.782692	+0.000000	keep	skill	Consolidating all LLM response validation and Gemini API error handling into a unified skill will reduce recurring error	skills/advanced_llm_gemini_error_handling_unified_v14.md
2026-03-22T09:38:19.291002+00:00	exp_202603220938_daa1	0.782692	0.782692	+0.000000	keep	skill	Consolidating all Gemini error handling skills into a single version reduces complexity while maintaining coverage, fixi	skills/advanced_gemini_api_error_recovery_unified_v15.md
2026-03-22T09:38:42.179109+00:00	exp_202603220938_6a1d	0.782692	0.782692	+0.000000	keep	skill	Consolidating multiple Gemini error recovery skills into one unified implementation will reduce complexity while maintai	skills/advanced_gemini_error_handling_unified_v8.md
2026-03-22T09:39:00.702239+00:00	exp_202603220939_d6a2	0.782692	0.782692	+0.000000	keep	skill	Consolidating error handling for None or empty LLM responses into a single unified skill will reduce errors and simplify	skills/advanced_unified_empty_response_handling.md
2026-03-22T09:39:20.350930+00:00	exp_202603220939_a8c6	0.782692	0.782692	+0.000000	keep	skill	Create a unified error handling skill that combines all existing Gemini API error recovery skills into one simplified ve	skills/unified_gemini_error_handling_v14.md
2026-03-22T09:39:39.446120+00:00	exp_202603220939_6a6d	0.782692	0.782692	+0.000000	keep	skill	Consolidate all advanced_gemini_api_error_recovery skills into a single unified version to reduce complexity and improve	skills/advanced_gemini_api_error_recovery_unified_v14.md
2026-03-22T09:45:51.682402+00:00	exp_202603220945_2464	0.782692	0.782692	+0.000000	keep	skill	Create a consolidated error handling skill for both ValueError and BadRequestError cases from LLM calls, since these are	skills/consolidated_llm_api_error_handling.md
2026-03-22T09:46:30.808099+00:00	exp_202603220946_03d6	0.782692	0.782692	+0.000000	keep	skill	A skill that preemptively validates LLM responses before they cause errors will reduce recurring ValueError and BadReque	skills/preemptive_llm_response_validation.md
2026-03-22T09:47:11.860069+00:00	exp_202603220947_ccba	0.782692	0.782692	+0.000000	keep	skill	Enhanced LLM error handling to preemptively validate responses and better handle BadRequestError, reducing recurring Val	skills/enhanced_llm_error_handling.md
2026-03-22T09:48:02.296241+00:00	exp_202603220948_00ac	0.782692	0.782692	+0.000000	keep	skill	Adding multi-step reasoning patterns will improve complex task handling and output quality by breaking down problems int	skills/multi_step_reasoning_patterns.md
2026-03-22T09:48:31.541431+00:00	exp_202603220948_85e1	0.782692	0.782692	+0.000000	keep	skill	Consolidating all LLM error handling into a single universal handler will reduce error rate and simplify maintenance by 	skills/universal_llm_error_handler.md
2026-03-22T09:50:10.597565+00:00	exp_202603220950_11d0	0.782692	0.782692	+0.000000	keep	skill	Implementing preemptive validation for Gemini API calls will reduce BadRequestError rates	skills/gemini_api_prevalidation.md
2026-03-22T09:50:50.375489+00:00	exp_202603220950_e3ad	0.782692	0.782692	+0.000000	keep	skill	Enhancing LLM error handling to manage None/empty responses and BadRequestErrors will reduce errors and improve task suc	skills/enhanced_llm_error_handling.md
2026-03-22T09:51:31.942396+00:00	exp_202603220951_3c9c	0.782692	0.782692	+0.000000	keep	skill	Consolidating all LLM response validation into a single universal validator will reduce recurring ValueError and BadRequ	skills/universal_llm_response_validator.md
2026-03-22T09:52:11.475496+00:00	exp_202603220952_f8f8	0.782692	0.782692	+0.000000	keep	skill	Adding skill for synthesizing and summarizing web search results will improve efficiency and output quality by reducing 	skills/web_search_synthesis_summary.md
2026-03-22T09:52:50.400770+00:00	exp_202603220952_b3e4	0.782692	0.782692	+0.000000	keep	skill	Adding preemptive API validation will reduce LLM call errors and BadRequestErrors by validating parameters before making	skills/preemptive_api_validation.md
2026-03-22T10:01:03.255796+00:00	exp_202603221001_6862	0.782692	0.782692	+0.000000	keep	skill	Adding a skill for handling Gemini API specific errors will reduce recurring BadRequestError occurrences by providing ta	skills/gemini_api_error_handling.md
2026-03-22T10:02:43.653204+00:00	exp_202603221002_cc45	0.782692	0.782692	+0.000000	keep	skill	Created new skill 'preemptive_api_parameter_validation' that validates API request parameters before sending to prevent 	skills/preemptive_api_parameter_validation.md
2026-03-22T10:03:23.073553+00:00	exp_202603221003_5e5f	0.782692	0.782692	+0.000000	keep	skill	Improving LLM error handling for invalid or empty responses will reduce ValueErrors and BadRequestErrors, enhancing syst	skills/llm_error_handling_for_invalid_responses.md
2026-03-22T10:05:32.980646+00:00	exp_202603221005_307e	0.782692	0.782692	+0.000000	keep	skill	Adding a specialized Gemini API error recovery skill will reduce BadRequestError occurrences and improve task success ra	skills/gemini_api_error_recovery.md
2026-03-22T10:06:24.689253+00:00	exp_202603221006_34b5	0.782692	0.782692	+0.000000	keep	skill	Creating advanced LLM response validation and error recovery skill will reduce errors related to invalid/empty responses	skills/advanced_llm_response_validation.md
2026-03-22T10:07:24.851666+00:00	exp_202603221007_93bf	0.782692	0.782692	+0.000000	keep	skill	Adding a skill for handling LLM response validation errors will reduce recurring ValueError and BadRequestError occurren	skills/advanced_llm_response_validation.md
2026-03-22T10:08:06.165836+00:00	exp_202603221008_2881	0.782692	0.782692	+0.000000	keep	skill	Consolidating LLM response validation into a single enhanced skill will reduce recurring ValueError/BadRequestError erro	skills/enhanced_llm_response_validation.md
2026-03-22T10:09:47.438455+00:00	exp_202603221009_bcf8	0.782692	0.782692	+0.000000	keep	skill	Enhanced LLM response validation with preemptive checks and fallback strategies will reduce validation error rates	skills/robust_llm_response_validation.md
2026-03-22T10:10:37.911997+00:00	exp_202603221010_02b4	0.782692	0.782692	+0.000000	keep	skill	Better error handling combining specific validation, intelligent retries with backoff, and comprehensive fallback mechan	skills/advanced_error_handling_with_fallback.md
2026-03-22T10:15:51.386972+00:00	exp_202603221015_3a36	0.782692	0.782692	+0.000000	keep	skill	Adding a specialized skill for handling empty/None LLM responses will reduce the recurring ValueError errors by providin	skills/llm_empty_response_recovery.md
2026-03-22T10:16:37.276778+00:00	exp_202603221016_356e	0.782692	0.782692	+0.000000	keep	skill	Creating a specialized skill for handling Gemini API's empty/None responses will reduce the recurring ValueError errors 	skills/gemini_empty_response_handler.md
2026-03-22T10:17:11.348126+00:00	exp_202603221017_61d9	0.782692	0.782692	+0.000000	keep	skill	Creating a specialized Gemini API error recovery skill will reduce BadRequestError occurrences by implementing targeted 	skills/gemini_api_error_recovery.md
2026-03-22T10:17:31.710896+00:00	exp_202603221017_e374	0.782692	0.782692	+0.000000	keep	skill	Improving error handling for Gemini API empty responses by creating a specialized skill that combines preemptive checks 	skills/gemini_empty_response_recovery.md
2026-03-22T10:19:10.891275+00:00	exp_202603221019_59dd	0.782692	0.782692	+0.000000	keep	skill	Adding enhanced LLM response error handling to reduce ValueError and BadRequestError occurrences	skills/llm_response_error_handling.md
2026-03-22T10:19:54.408580+00:00	exp_202603221019_3ad0	0.782692	0.782692	+0.000000	keep	skill	A unified error handling skill combining preemptive checks, recovery strategies, and fallback mechanisms will reduce Gem	skills/comprehensive_gemini_error_handling.md
2026-03-22T10:20:17.229444+00:00	exp_202603221020_a7e0	0.782692	0.782692	+0.000000	keep	skill	Consolidating all LLM error handling into a single comprehensive skill will simplify the system while potentially improv	skills/comprehensive_llm_error_recovery.md
2026-03-22T10:21:11.686890+00:00	exp_202603221021_4daf	0.782692	0.782692	+0.000000	keep	skill	Implementing a multi-step recovery strategy for Gemini API errors will reduce None/empty response errors by combining pr	skills/gemini_api_multi_step_recovery.md
2026-03-22T10:22:10.960736+00:00	exp_202603221022_fffd	0.782692	0.782692	+0.000000	keep	skill	Consolidating Gemini API error handling into a comprehensive skill combining validation, parsing, retry strategies and f	skills/gemini_api_error_recovery.md
2026-03-22T10:29:39.086401+00:00	exp_202603221029_6262	0.782692	0.782692	+0.000000	keep	skill	Created specialized skill for robust empty/None LLM response handling to reduce ValueError occurrences	skills/advanced_llm_empty_response_handling.md
2026-03-22T10:30:17.710006+00:00	exp_202603221030_be85	0.782692	0.782692	+0.000000	keep	skill	Enhancing Gemini API error handling to reduce recurring ValueError and BadRequestError instances	skills/enhanced_gemini_api_error_recovery.md
2026-03-22T10:31:38.211478+00:00	exp_202603221031_20c9	0.782692	0.782692	+0.000000	keep	skill	Adding immediate LLM response validation skill to catch and handle None or empty responses early, reducing ValueError oc	skills/llm_response_validation_skill.md
2026-03-22T10:32:59.322429+00:00	exp_202603221032_45fd	0.782692	0.782692	+0.000000	keep	skill	Adding preemptive LLM response validation will reduce recurring ValueError and BadRequestError instances by catching iss	skills/preemptive_llm_response_validation.md
2026-03-22T10:35:37.522470+00:00	exp_202603221035_0df8	0.782692	0.782692	+0.000000	keep	skill	Implementing preemptive request validation and simplification before Gemini API calls will prevent recurring ValueError 	skills/preemptive_gemini_request_validation.md
2026-03-22T10:35:43.787298+00:00	exp_202603221035_3d24	0.782692	0.782692	+0.000000	keep	skill	Enhancing LLM response handling to reduce ValueError and BadRequestError by implementing preemptive validation and recov	skills/advanced_llm_response_handling.md
2026-03-22T10:36:06.868230+00:00	exp_202603221036_27a7	0.782692	0.782692	+0.000000	keep	skill	Consolidating multiple LLM error handling skills into one unified skill will simplify the system while maintaining error	skills/unified_llm_error_handling.md
2026-03-22T10:36:40.151359+00:00	exp_202603221036_fc87	0.782692	0.782692	+0.000000	keep	skill	Creating pre-LLM input validation will prevent recurring ValueError and BadRequestError patterns by catching issues befo	skills/pre_llm_input_validation.md
2026-03-22T10:37:20.058330+00:00	exp_202603221037_ae24	0.782692	0.782692	+0.000000	keep	skill	Improving prompt templates and response formatting will increase output quality and reduce response length without sacri	skills/concise_response_generation.md
2026-03-22T10:44:03.673844+00:00	exp_202603221044_7f26	0.782692	0.782692	+0.000000	keep	skill	Creating a comprehensive LLM response validation and error recovery skill will reduce recurring ValueError and BadReques	skills/comprehensive_llm_response_validation_error_recovery.md
2026-03-22T10:44:23.089050+00:00	exp_202603221044_052c	0.782692	0.782692	+0.000000	keep	skill	Improving memory retrieval optimization to reduce redundant API calls by implementing smarter caching and retrieval stra	skills/memory_retrieval_optimization.md
2026-03-22T10:45:05.370499+00:00	exp_202603221045_c2d4	0.782692	0.782692	+0.000000	keep	skill	Creating a skill to handle empty or invalid LLM responses with automatic retry logic will reduce the recurring ValueErro	skills/auto_retry_empty_llm_response.md
2026-03-22T10:45:25.157596+00:00	exp_202603221045_76d7	0.782692	0.782692	+0.000000	keep	skill	Creating a specialized skill for handling Gemini-specific API errors will reduce recurring BadRequestErrors from Openrou	skills/gemini_api_error_handling.md
2026-03-22T10:46:44.399595+00:00	exp_202603221046_c580	0.782692	0.782692	+0.000000	keep	skill	Creating a preemptive Gemini API validation skill will reduce ValueError and BadRequestError rates by handling Gemini-sp	skills/gemini_api_response_validation.md
2026-03-22T10:47:22.976856+00:00	exp_202603221047_2dc5	0.782692	0.782692	+0.000000	keep	skill	Preemptive validation of Gemini API requests will reduce ValueError and BadRequestError occurrences by catching common i	skills/gemini_request_prevalidator.md
2026-03-22T10:49:05.630335+00:00	exp_202603221049_1f99	0.782692	0.782692	+0.000000	keep	skill	Adding preemptive LLM input validation will prevent recurring ValueError errors from None/empty responses by validating 	skills/preemptive_llm_input_validation.md
2026-03-22T10:49:25.075244+00:00	exp_202603221049_686a	0.782692	0.782692	+0.000000	keep	skill	Creating a specialized skill for handling empty or invalid LLM responses from Gemini API will reduce recurring ValueErro	skills/gemini_empty_response_handling.md
2026-03-22T11:00:33.626699+00:00	exp_202603221100_d30c	0.782692	0.782692	+0.000000	keep	skill	Creating a specialized error recovery skill for Gemini API BadRequestError cases will reduce recurring errors and improv	skills/gemini_badrequest_error_recovery.md
2026-03-22T11:01:13.943767+00:00	exp_202603221101_1de7	0.782692	0.782692	+0.000000	keep	skill	Creating a specialized skill for handling empty or invalid LLM responses from Google/Gemini API will reduce recurring Va	skills/gemini_api_empty_response_handling.md
2026-03-22T11:01:52.598667+00:00	exp_202603221101_bb1a	0.782692	0.782692	+0.000000	keep	skill	Adding retry logic with fallback for empty LLM responses will reduce ValueError occurrences	skills/llm_empty_response_retry.md
2026-03-22T11:02:14.193744+00:00	exp_202603221102_ffb9	0.782692	0.782692	+0.000000	keep	skill	Creating a specialized skill for handling Gemini API BadRequestError with detailed error parsing will improve error reco	skills/gemini_badrequest_error_handling.md
2026-03-22T11:03:53.167471+00:00	exp_202603221103_7fe9	0.782692	0.782692	+0.000000	keep	skill	Creating a comprehensive LLM and Gemini error handling skill will reduce both error types while simplifying maintenance 	skills/llm_gemini_comprehensive_error_handling.md
2026-03-22T11:04:32.222031+00:00	exp_202603221104_e8d4	0.782692	0.782692	+0.000000	keep	skill	Creating a specialized skill for handling Gemini API errors more robustly will reduce BadRequestError occurrences and im	skills/advanced_gemini_error_recovery.md
2026-03-22T11:04:54.940404+00:00	exp_202603221104_2c4f	0.782692	0.782692	+0.000000	keep	skill	Consolidating LLM error handling skills into a single comprehensive skill that combines empty response detection, BadReq	skills/consolidated_llm_error_handling_v2.md
2026-03-22T11:05:31.990852+00:00	exp_202603221105_2637	0.782692	0.782692	+0.000000	keep	skill	Creating a more robust error recovery skill for LLM and Gemini API errors will reduce recurring errors.	skills/enhanced_llm_error_recovery.md
2026-03-22T11:05:55.493776+00:00	exp_202603221105_7895	0.782692	0.782692	+0.000000	keep	skill	Creating a more robust Gemini API error handling skill will reduce BadRequestError occurrences and improve error recover	skills/gemini_api_error_handling_v2.md
2026-03-22T11:12:47.195899+00:00	exp_202603221112_de64	0.782692	0.782692	+0.000000	keep	skill	Creating a specialized skill for handling empty or invalid LLM responses will reduce the recurring ValueError errors and	skills/llm_empty_response_recovery.md
2026-03-22T11:13:27.641776+00:00	exp_202603221113_455d	0.782692	0.782692	+0.000000	keep	skill	Creating a specialized skill for handling LLM call errors will reduce the recurring ValueErrors and BadRequestErrors, im	skills/advanced_llm_call_error_handling.md
2026-03-22T11:14:06.579036+00:00	exp_202603221114_d2f8	0.782692	0.782692	+0.000000	keep	skill	Consolidating multiple LLM/Gemini error handling skills into a single comprehensive handler will reduce code duplication	skills/universal_llm_gemini_error_handler.md
2026-03-22T11:15:07.575314+00:00	exp_202603221115_124c	0.782692	0.782692	+0.000000	keep	skill	Creating a specialized skill for handling empty or invalid LLM responses with more robust fallback mechanisms will reduc	skills/robust_llm_empty_response_handling.md
2026-03-22T11:16:06.548168+00:00	exp_202603221116_b719	0.782692	0.782692	+0.000000	keep	skill	Improving LLM response validation to handle empty or invalid responses more gracefully will reduce the ValueError and Ba	skills/enhanced_llm_response_validation.md
2026-03-22T11:16:46.954907+00:00	exp_202603221116_5929	0.782692	0.782692	+0.000000	keep	skill	Consolidating empty/None response handling into a single robust skill with retry logic and fallback strategies will redu	skills/robust_empty_response_handler.md
2026-03-22T11:17:27.532513+00:00	exp_202603221117_ee3d	0.782692	0.782692	+0.000000	keep	skill	Created a smarter LLM error recovery skill that specifically targets the recurring ValueError and BadRequestError patter	skills/smarter_llm_error_recovery.md
2026-03-22T11:18:06.576267+00:00	exp_202603221118_ed40	0.782692	0.782692	+0.000000	keep	skill	Consolidating multiple LLM response validation checks into a single unified skill reduces complexity while maintaining e	skills/unified_llm_response_validation.md
2026-03-22T11:18:27.320444+00:00	exp_202603221118_9a4f	0.782692	0.782692	+0.000000	keep	skill	Create a specialized skill for handling Gemini API rate limit errors specifically through Openrouter, since this appears	skills/gemini_openrouter_rate_limit_handling.md
2026-03-22T11:24:20.692166+00:00	exp_202603221124_ff32	0.782692	0.782692	+0.000000	keep	skill	Consolidating all LLM/Gemini error handling into a single universal handler will reduce recurring ValueError and BadRequ	skills/universal_llm_error_handler.md
2026-03-22T11:25:22.011819+00:00	exp_202603221125_227b	0.782692	0.782692	+0.000000	keep	skill	Consolidating all LLM error handling into a single comprehensive skill will reduce complexity while maintaining robust e	skills/unified_llm_error_handling.md
2026-03-22T11:25:59.148990+00:00	exp_202603221125_7040	0.782692	0.782692	+0.000000	keep	skill	Creating a universal LLM error recovery skill that combines empty response handling, rate limit detection, and Gemini-sp	skills/universal_llm_error_recovery.md
2026-03-22T11:26:41.407196+00:00	exp_202603221126_7922	0.782692	0.782692	+0.000000	keep	skill	Creating a specialized skill for empty/null LLM responses will reduce recurring ValueError errors without adding complex	skills/specialized_empty_response_handling.md
2026-03-22T11:27:20.206826+00:00	exp_202603221127_4b4a	0.782692	0.782692	+0.000000	keep	skill	Creating a comprehensive LLM error recovery skill with retry strategies and API fallback will reduce error rates and imp	skills/advanced_llm_error_recovery_with_retries.md
2026-03-22T11:28:39.121541+00:00	exp_202603221128_30e6	0.782692	0.782692	+0.000000	keep	skill	Consolidating all LLM error handling into a single universal recovery skill will reduce error rates and improve robustne	skills/universal_llm_error_recovery.md
2026-03-22T11:29:00.138971+00:00	exp_202603221129_5aa1	0.782692	0.782692	+0.000000	keep	skill	Creating a specialized skill for handling Gemini API empty/null responses will reduce the recurring ValueError errors an	skills/gemini_empty_response_handler.md
