ts	experiment_id	metric_before	metric_after	delta	status	change_type	hypothesis	files_changed
2026-03-21T04:45:55.465709+00:00	exp_202603210445_87d1	0.750192	0.750192	+0.000000	keep	skill	Simplifying LLM error handling by combining multiple similar skills into one comprehensive solution should reduce comple	skills/comprehensive_llm_error_handling_v4.md
2026-03-21T04:46:56.767561+00:00	exp_202603210446_91a2	0.750192	0.750192	+0.000000	keep	skill	Consolidating all LLM response validation into a single robust skill with pre-call validation, comprehensive response ch	skills/universal_llm_response_validation.md
2026-03-21T04:47:56.270306+00:00	exp_202603210447_11c4	0.750192	0.750192	+0.000000	keep	skill	Creating a skill to handle Gemini-specific BadRequestError responses will reduce the error rate by providing targeted re	skills/targeted_gemini_badrequest_error_handling.md
2026-03-21T04:48:15.255165+00:00	exp_202603210448_92e0	0.750192	0.750192	+0.000000	keep	skill	Improve LLM response handling by adding a specialized skill for Gemini-specific errors and empty response validation, co	skills/optimized_gemini_error_handling_v1.md
2026-03-21T04:48:55.090169+00:00	exp_202603210448_4730	0.750192	0.750192	+0.000000	keep	skill	Consolidating multiple LLM error handling skills into one universal handler will reduce complexity while maintaining or 	skills/universal_llm_error_handler.md
2026-03-21T04:49:35.545022+00:00	exp_202603210449_6ef5	0.750192	0.750192	+0.000000	keep	skill	Implementing a more robust error handling mechanism for Gemini-specific errors will reduce the frequency of BadRequestEr	skills/gemini_error_handler_v4.md
2026-03-21T04:50:15.144176+00:00	exp_202603210450_0ca8	0.750192	0.750192	+0.000000	keep	skill	Targeted handling of Gemini API errors through OpenRouter will reduce error rate and improve task success	skills/gemini_openrouter_error_recovery.md
2026-03-21T04:55:09.464751+00:00	exp_202603210455_b91e	0.750192	0.750192	+0.000000	keep	skill	Consolidating multiple LLM error handling skills into one unified implementation will reduce complexity while maintainin	skills/unified_llm_error_handling.md
2026-03-21T04:55:49.954107+00:00	exp_202603210455_10da	0.750192	0.750192	+0.000000	keep	skill	Consolidating all LLM response handling into a single universal handler will reduce error rates and simplify the system 	skills/universal_llm_response_handler.md
2026-03-21T04:56:28.556369+00:00	exp_202603210456_2e45	0.750192	0.750192	+0.000000	keep	skill	Consolidating Gemini API error handling into a single robust skill will reduce both BadRequestError and empty response o	skills/consolidated_gemini_empty_response_handling_v3.md
2026-03-21T04:56:59.500319+00:00	exp_202603210456_4275	0.750192	0.750192	+0.000000	keep	skill	Create a consolidated error handling skill for both ValueError and BadRequestError cases from LLM calls, since these are	skills/consolidated_llm_error_handling_v6.md
2026-03-21T04:57:30.497970+00:00	exp_202603210457_69ee	0.750192	0.750192	+0.000000	keep	skill	Implementing a retry mechanism with exponential backoff and model fallback will reduce persistent LLM API errors	skills/advanced_llm_error_recovery_with_fallback.md
2026-03-21T04:58:32.059922+00:00	exp_202603210458_ac46	0.750192	0.750192	+0.000000	keep	skill	Introduce a consolidated error handling skill that specifically addresses the recurring ValueError and BadRequestError p	skills/consolidated_error_handling_v4.md
2026-03-21T04:59:16.409534+00:00	exp_202603210459_ec54	0.750192	0.750192	+0.000000	keep	skill	Improve comprehensive_llm_response_validation_v5 to better handle empty responses and BadRequestErrors by adding specifi	skills/comprehensive_llm_response_validation_v6.md
2026-03-21T04:59:31.359977+00:00	exp_202603210459_234a	0.750192	0.750192	+0.000000	keep	skill	Improving LLM response validation before processing will reduce ValueErrors and BadRequestErrors	skills/comprehensive_llm_response_validation_v6.md
2026-03-21T04:59:50.799754+00:00	exp_202603210459_cc39	0.750192	0.750192	+0.000000	keep	skill	Creating a consolidated error handling skill for both ValueError and BadRequestError from LLM calls will reduce error ra	skills/consolidated_llm_error_handling_v4.md
2026-03-21T05:00:30.915554+00:00	exp_202603210500_211d	0.750192	0.750192	+0.000000	keep	skill	Creating a universal LLM error recovery skill will reduce recurring ValueErrors and BadRequestErrors by consolidating al	skills/universal_llm_error_recovery_v3.md
2026-03-21T05:07:57.381103+00:00	exp_202603210507_9f0d	0.750192	0.750192	+0.000000	keep	skill	Consolidating all Gemini error handling into a single universal skill will reduce redundant code, handle edge cases more	skills/universal_gemini_error_handling_v4.md
2026-03-21T05:08:16.971559+00:00	exp_202603210508_d440	0.750192	0.750192	+0.000000	keep	skill	Improving consolidated_empty_response_handling_v2 to better handle None or empty responses from LLM calls will reduce Va	skills/consolidated_empty_response_handling_v3.md
2026-03-21T05:09:17.074327+00:00	exp_202603210509_6468	0.750192	0.750192	+0.000000	keep	skill	Creating a consolidated error handling skill specifically for Gemini API empty responses will reduce the recurring Value	skills/consolidated_gemini_empty_response_handling_v4.md
2026-03-21T05:10:17.524560+00:00	exp_202603210510_74c3	0.750192	0.750192	+0.000000	keep	skill	Creating an enhanced Gemini response recovery skill will reduce ValueError and BadRequestError occurrences by improving 	skills/gemini_response_recovery_v4.md
2026-03-21T05:11:57.517631+00:00	exp_202603210511_0782	0.750192	0.750192	+0.000000	keep	skill	Adding stricter validation throughout the response processing chain will reduce ValueError and BadRequestError rates	skills/comprehensive_llm_response_validation_v6.md
2026-03-21T05:12:36.659100+00:00	exp_202603210512_2669	0.750192	0.750192	+0.000000	keep	skill	Creating a more robust Gemini error handling skill will reduce task failures related to Gemini LLM responses	skills/enhanced_gemini_response_handling_v3.md
2026-03-21T05:13:18.152311+00:00	exp_202603210513_b04c	0.750192	0.750192	+0.000000	keep	skill	Adding strict empty/None response validation before processing will reduce ValueError errors from invalid LLM responses	skills/empty_response_validation_v3.md
2026-03-21T05:13:57.699576+00:00	exp_202603210513_d9cc	0.750192	0.750192	+0.000000	keep	skill	Creating an improved LLM response handling skill will reduce recurring ValueError and BadRequestError related to empty o	skills/improved_llm_response_handling.md
2026-03-21T05:14:39.315972+00:00	exp_202603210514_fa3f	0.750192	0.750192	+0.000000	keep	skill	Adding specific handling for OpenrouterException patterns in Gemini errors will reduce BadRequestError occurrences by pr	skills/gemini_openrouter_exception_handling.md
2026-03-21T05:19:44.746114+00:00	exp_202603210519_dbc8	0.750192	0.750192	+0.000000	keep	skill	Creating a more comprehensive LLM response validation and recovery skill will reduce the recurring ValueError and BadReq	skills/enhanced_llm_response_validation_recovery_v6.md
2026-03-21T05:20:25.212306+00:00	exp_202603210520_643c	0.750192	0.750192	+0.000000	keep	skill	Consolidate all LLM error handling into a single unified skill by merging the best parts of comprehensive_gemini_error_h	skills/unified_llm_error_handler.md
2026-03-21T05:20:44.719280+00:00	exp_202603210520_dc62	0.750192	0.750192	+0.000000	keep	skill	Creating a dedicated skill for handling Gemini API rate limit errors will reduce the recurring BadRequestError occurrenc	skills/gemini_rate_limit_handling.md
2026-03-21T05:21:25.872174+00:00	exp_202603210521_bb07	0.750192	0.750192	+0.000000	keep	skill	Creating a more targeted skill for LLM response validation will reduce ValueError and BadRequestError rates by providing	skills/llm_response_validation_v6.md
2026-03-21T05:22:04.244929+00:00	exp_202603210522_2805	0.750192	0.750192	+0.000000	keep	skill	Consolidating all LLM response validation and error recovery into a single skill reduces complexity while maintaining or	skills/consolidated_llm_response_handling_v6.md
2026-03-21T05:23:24.360611+00:00	exp_202603210523_07c4	0.750192	0.750192	+0.000000	keep	skill	Consolidating fragmented LLM error handling skills into a single unified version will reduce complexity and improve erro	skills/unified_llm_error_handling.md
2026-03-21T05:24:04.164577+00:00	exp_202603210524_ba6d	0.750192	0.750192	+0.000000	keep	skill	Consolidating LLM error handling into a single skill reduces recurring ValueError and BadRequestError issues without add	skills/unified_llm_error_handling_v4.md
2026-03-21T05:24:45.192332+00:00	exp_202603210524_802b	0.750192	0.750192	+0.000000	keep	skill	Creating specialized handling for Gemini API edge cases will reduce both ValueError and BadRequestError occurrences by v	skills/edge_case_gemini_response_validation.md
2026-03-21T05:25:24.432326+00:00	exp_202603210525_c006	0.750192	0.750192	+0.000000	keep	skill	Consolidating and improving LLM response validation will reduce the recurring ValueError and BadRequestError errors by p	skills/comprehensive_llm_response_validation_v6.md
2026-03-21T05:26:03.829896+00:00	exp_202603210526_1521	0.750192	0.750192	+0.000000	keep	skill	Replacing multiple fragmented LLM response validation skills with a single upstream handler will simplify error handling	skills/streamlined_llm_response_handler.md
2026-03-21T05:28:30.614174+00:00	exp_202603210528_f5f1	0.750192	0.750192	+0.000000	keep	skill	Creating comprehensive LLM response validation will reduce ValueError and BadRequestError rates	skills/comprehensive_llm_response_validation_v6.md
2026-03-21T05:29:33.126548+00:00	exp_202603210529_0674	0.750192	0.750192	+0.000000	keep	skill	Creating a more advanced empty response handling skill will reduce the recurring ValueError and BadRequestError errors b	skills/advanced_empty_response_handling_v4.md
2026-03-21T05:30:31.146415+00:00	exp_202603210530_4a6a	0.750192	0.750192	+0.000000	keep	skill	Creating a consolidated skill for Gemini API and LLM response error handling will reduce recurring errors and improve ta	skills/gemini_edge_case_error_handling.md
2026-03-21T05:31:31.399315+00:00	exp_202603210531_89b4	0.750192	0.750192	+0.000000	keep	skill	Creating a unified LLM error handling skill combining validation and recovery for empty responses and Gemini API errors 	skills/unified_llm_error_handling_v1.md
2026-03-21T05:32:50.518545+00:00	exp_202603210532_ed84	0.750192	0.750192	+0.000000	keep	skill	Consolidating handling for empty responses and BadRequestErrors from LLM calls will reduce error rates and simplify erro	skills/combined_llm_error_handling_v5.md
2026-03-21T05:34:14.825831+00:00	exp_202603210534_e8ee	0.750192	0.750192	+0.000000	keep	skill	Removing v5 skill file since v6 contains all its functionality plus additional improvements, reducing redundancy without	skills/comprehensive_llm_response_validation_v5.md
2026-03-21T05:35:11.665274+00:00	exp_202603210535_1311	0.750192	0.750192	+0.000000	keep	skill	Creating a more comprehensive LLM response validation skill will reduce recurring ValueError and BadRequestError issues 	skills/comprehensive_llm_response_validation_v7.md
2026-03-21T05:35:50.948306+00:00	exp_202603210535_1b7d	0.750192	0.750192	+0.000000	keep	skill	Removing complex validation and replacing with simpler empty response handling will reduce errors while maintaining simp	skills/simplified_llm_response_validation_v8.md
2026-03-21T05:42:08.973468+00:00	exp_202603210542_9a0d	0.750192	0.750192	+0.000000	keep	skill	Creating a more advanced Gemini-specific error handling skill will reduce ValueError and BadRequestError occurrences by 	skills/advanced_gemini_error_recovery_v3.md
2026-03-21T05:42:28.768637+00:00	exp_202603210542_c05a	0.750192	0.750192	+0.000000	keep	skill	Creating a more robust Gemini error handling skill that specifically addresses the 'BadRequestError' patterns seen in re	skills/comprehensive_gemini_error_handling_v4.md
2026-03-21T05:43:08.650020+00:00	exp_202603210543_fe4d	0.750192	0.750192	+0.000000	keep	skill	Consolidating LLM error handling into a single unified skill will reduce code complexity while maintaining error handlin	skills/unified_llm_error_handling_v8.md
2026-03-21T05:43:47.872552+00:00	exp_202603210543_13da	0.750192	0.750192	+0.000000	keep	skill	Consolidating multiple LLM error handling skills into a single streamlined version will reduce complexity while maintain	skills/unified_llm_error_handling_v8.md
2026-03-21T05:45:10.371331+00:00	exp_202603210545_d426	0.750192	0.750192	+0.000000	keep	skill	Simplifying the LLM response validation to focus on core checks will reduce complexity while maintaining error reduction	skills/essential_llm_response_validation_v8.md
2026-03-21T05:45:47.849942+00:00	exp_202603210545_2f37	0.750192	0.750192	+0.000000	keep	skill	Combining empty response validation with explicit Gemini error patterns will reduce ValueError/BadRequestError rates	skills/comprehensive_gemini_empty_response_handling_v4.md
2026-03-21T05:46:48.365813+00:00	exp_202603210546_3cc8	0.750192	0.750192	+0.000000	keep	skill	Consolidating all LLM response validation into a single universal implementation reduces complexity while addressing bot	skills/universal_llm_response_validation_v8.md
2026-03-21T05:57:32.845922+00:00	exp_202603210557_20c9	0.750192	0.750192	+0.000000	keep	skill	Improving LLM response validation to handle empty or invalid responses more effectively will reduce the error rate.	skills/comprehensive_llm_response_validation_v8.md
2026-03-21T05:58:35.733015+00:00	exp_202603210558_1f8a	0.750192	0.750192	+0.000000	keep	skill	Create a unified LLM error handling skill that combines Gemini-specific error recovery with general empty response valid	skills/unified_llm_error_handling_v8.md
2026-03-21T05:59:53.829013+00:00	exp_202603210559_f147	0.750192	0.750192	+0.000000	keep	skill	Create a unified LLM error handling skill that combines all existing error handling patterns into one comprehensive solu	skills/unified_llm_error_handling_v8.md
2026-03-21T06:00:54.250832+00:00	exp_202603210600_6fa4	0.750192	0.750192	+0.000000	keep	skill	Adding a Gemini-specific fallback with retry strategy will reduce LLM-related errors (BadRequestError & ValueError) by i	skills/gemini_fallback_with_retry.md
2026-03-21T06:01:53.285827+00:00	exp_202603210601_8a2b	0.750192	0.750192	+0.000000	keep	skill	Combining all LLM error handling into a single unified skill with simplified logic will reduce recurring ValueError and 	skills/unified_llm_error_handler_v8.md
2026-03-21T06:02:13.567102+00:00	exp_202603210602_c50c	0.750192	0.750192	+0.000000	keep	skill	Created a more robust unified LLM error handling skill by combining the best elements of previous versions with simplifi	skills/unified_llm_error_handling_v8.md
2026-03-21T06:03:33.533163+00:00	exp_202603210603_2f8c	0.750192	0.750192	+0.000000	keep	skill	Created a more robust unified LLM error handler that specifically addresses the recurring ValueError and BadRequestError	skills/unified_llm_error_handling_v6.md
2026-03-21T06:03:54.073934+00:00	exp_202603210603_d0df	0.750192	0.750192	+0.000000	keep	skill	Created a more advanced LLM error recovery skill that specifically addresses ValueError and BadRequestError related to L	skills/advanced_llm_error_recovery_v3.md
2026-03-21T06:04:17.889349+00:00	exp_202603210604_d926	0.750192	0.750192	+0.000000	keep	skill	Consolidate all LLM error handling into a single comprehensive skill to simplify and improve error recovery, focusing on	skills/unified_llm_error_handling_v7.md
2026-03-21T06:04:34.421039+00:00	exp_202603210604_e307	0.750192	0.750192	+0.000000	keep	skill	Create a comprehensive error handling skill that specifically targets and resolves the recurring 'Invalid response from 	skills/comprehensive_llm_error_recovery_v7.md
2026-03-21T06:14:18.300224+00:00	exp_202603210614_d192	0.750192	0.750192	+0.000000	keep	skill	Create a comprehensive error handling skill that specifically addresses the recurring 'Invalid response from LLM call - 	skills/unified_llm_error_handling_v7.md
2026-03-21T06:14:56.794849+00:00	exp_202603210614_645b	0.750192	0.750192	+0.000000	keep	skill	Creating a specialized Gemini error handling skill will reduce LLM-related errors and improve task success rate by focus	skills/gemini_error_handling_v5.md
2026-03-21T06:15:17.323209+00:00	exp_202603210615_1164	0.750192	0.750192	+0.000000	keep	skill	Create a specialized error handling skill that specifically addresses the recurring 'Invalid response from LLM call - No	skills/advanced_empty_response_handling_v5.md
2026-03-21T06:15:44.350582+00:00	exp_202603210615_a2ff	0.750192	0.750192	+0.000000	keep	skill	Creating a specialized error handling skill that combines Gemini and general LLM error recovery patterns will reduce the	skills/unified_gemini_llm_error_handling_v5.md
2026-03-21T06:16:16.382647+00:00	exp_202603210616_c1fd	0.750192	0.750192	+0.000000	keep	skill	Simplifying LLM error handling by merging redundant skills into a single robust strategy will reduce recurring errors wi	skills/consolidated_llm_error_recovery.md
2026-03-21T06:18:56.278001+00:00	exp_202603210618_defa	0.750192	0.750192	+0.000000	keep	skill	Improving Gemini error handling by adding specific pattern matching and fallback mechanisms will reduce the error rate f	skills/comprehensive_gemini_error_handling_v4.md
2026-03-21T06:19:18.302521+00:00	exp_202603210619_632a	0.750192	0.750192	+0.000000	keep	skill	Creating a specialized error handling skill that specifically targets 'Invalid response from LLM call - None or empty' e	skills/empty_response_handler_v5.md
2026-03-21T06:27:20.630146+00:00	exp_202603210627_81dc	0.750192	0.750192	+0.000000	keep	skill	Creating a consolidated LLM error recovery skill will reduce ValueError and BadRequestError rates by implementing improv	skills/comprehensive_llm_error_recovery_v7.md
2026-03-21T06:28:07.274777+00:00	exp_202603210628_9810	0.750192	0.750192	+0.000000	keep	skill	Creating a specialized empty response handler will reduce ValueError occurrences by intercepting None/empty responses be	skills/comprehensive_empty_response_handling_v5.md
2026-03-21T06:28:41.616872+00:00	exp_202603210628_8a82	0.750192	0.750192	+0.000000	keep	skill	Consolidating Gemini and LLM error handling into a single comprehensive skill will reduce error rates by providing consi	skills/comprehensive_gemini_error_handling_v4.md
2026-03-21T06:29:02.250928+00:00	exp_202603210629_e2e6	0.750192	0.750192	+0.000000	keep	skill	Creating a specialized error handling skill for Gemini empty responses will reduce the recurring 'Invalid response from 	skills/specialized_gemini_empty_response_handler_v5.md
2026-03-21T06:30:01.700385+00:00	exp_202603210630_303f	0.750192	0.750192	+0.000000	keep	skill	Consolidating redundant LLM error handling skills will reduce complexity while maintaining error recovery capabilities	skills/consolidated_llm_error_handling_v6.md
2026-03-21T06:31:41.791935+00:00	exp_202603210631_4a85	0.750192	0.750192	+0.000000	keep	skill	Consolidating LLM call error handling into a single skill will reduce ValueError and BadRequestError rates by providing 	skills/advanced_llm_call_error_handling_v6.md
2026-03-21T06:32:21.938062+00:00	exp_202603210632_d8f6	0.750192	0.750192	+0.000000	keep	skill	Creating a comprehensive error recovery skill that handles both Gemini and LLM call errors will reduce the occurrence of	skills/comprehensive_gemini_llm_error_recovery_v5.md
2026-03-21T06:33:41.592364+00:00	exp_202603210633_5e6a	0.750192	0.750192	+0.000000	keep	skill	Creating a specialized error handling skill for LLM response validation and Gemini-specific errors will reduce ValueErro	skills/llm_gemini_response_validation_v2.md
2026-03-21T06:34:04.248394+00:00	exp_202603210634_e7a7	0.750192	0.750192	+0.000000	keep	skill	Consolidating LLM error handling into a single comprehensive skill will reduce complexity while maintaining error recove	skills/universal_llm_error_handler_v1.md
2026-03-21T06:34:25.356045+00:00	exp_202603210634_7b08	0.750192	0.750192	+0.000000	keep	skill	Consolidating multiple LLM and Gemini error handling skills into a single comprehensive skill will reduce complexity whi	skills/comprehensive_llm_gemini_error_handling_v6.md
2026-03-21T06:41:42.753491+00:00	exp_202603210641_3f92	0.750192	0.750192	+0.000000	keep	skill	Consolidating and enhancing error handling for ValueError and BadRequestError during LLM calls will reduce error rates a	skills/comprehensive_llm_error_handling_v4.md
2026-03-21T06:42:22.623947+00:00	exp_202603210642_35be	0.750192	0.750192	+0.000000	keep	skill	Creating a more robust LLM empty response handling skill will reduce ValueError occurrences and improve task success rat	skills/advanced_llm_empty_response_handling_v7.md
2026-03-21T06:43:03.990247+00:00	exp_202603210643_e424	0.750192	0.750192	+0.000000	keep	skill	Creating a more robust, consolidated error recovery skill to handle both empty responses and BadRequestErrors efficientl	skills/comprehensive_llm_error_recovery_v8.md
2026-03-21T06:43:42.448564+00:00	exp_202603210643_1aa6	0.750192	0.750192	+0.000000	keep	skill	Consolidating all LLM error handling into a single robust skill will reduce recurring errors without adding complexity	skills/comprehensive_llm_error_handling_v4.md
2026-03-21T06:44:17.558929+00:00	exp_202603210644_1a3e	0.750192	0.750192	+0.000000	keep	skill	Adding pre-execution validation for LLM calls will reduce BadRequestError and ValueError errors by catching invalid para	skills/llm_precall_validation_v1.md
2026-03-21T06:45:06.214588+00:00	exp_202603210645_88dd	0.750192	0.750192	+0.000000	keep	skill	Create a consolidated error handling skill for Gemini-specific errors to reduce the recurring BadRequestError and ValueE	skills/gemini_error_handling_consolidated_v5.md
