ts	experiment_id	metric_before	metric_after	delta	status	change_type	hypothesis	files_changed
2026-03-22T11:30:38.953956+00:00	exp_202603221130_e63e	0.782692	0.782692	+0.000000	keep	skill	Implementing a specialized skill for advanced LLM response validation will reduce empty/null response errors by introduc	skills/advanced_llm_response_validation.md
2026-03-22T11:31:20.662124+00:00	exp_202603221131_34a0	0.782692	0.782692	+0.000000	keep	skill	Combining multiple LLM error handling skills into a single unified solution will reduce code complexity while maintainin	skills/unified_llm_error_handling.md
2026-03-22T11:35:49.928575+00:00	exp_202603221135_082e	0.782692	0.782692	+0.000000	keep	skill	Consolidating fragmented LLM error handling into a single comprehensive skill simplifies code and improves error recover	skills/comprehensive_llm_error_handling.md
2026-03-22T12:35:36.560525+00:00	exp_202603221235_d824	0.782692	0.782692	+0.000000	keep	skill	The recurring BadRequestError and ValueError (empty/None LLM response) in research agents share a common root cause: con	skills/context_window_management.md
2026-03-22T12:41:10.498136+00:00	exp_202603221241_c938	0.782692	0.782692	+0.000000	keep	skill	The average response time is 351.8s — far above target. A major contributor is serial tool call chaining: agents fire on	skills/parallel_search_and_synthesis.md
2026-03-24T08:33:20.354238+00:00	exp_202603240833_cf82	0.882227	0.000000	+0.000000	pending	code	Enhance LLM response validation and error recovery to handle empty/null responses and API errors more robustly		
2026-03-24T08:33:41.961759+00:00	exp_202603240833_b52b	0.882227	0.000000	+0.000000	pending	code	The recurring ValueError and BadRequestError from LLM calls suggest we need better error handling at the code level, not		
2026-03-24T08:34:26.551599+00:00	exp_202603240834_331b	0.882227	0.000000	+0.000000	pending	code	The recurring ValueError and BadRequestError from LLM calls suggest we need better error handling in the core LLM callin		
2026-03-24T08:41:15.841935+00:00	exp_202603240841_93aa	0.882227	0.000000	+0.000000	pending	code	Adding robust validation and retry logic for empty/null LLM responses will reduce ValueError occurrences and improve tas		
2026-03-24T08:42:47.939074+00:00	exp_202603240842_57d6	0.882227	0.000000	+0.000000	pending	code	Adding robust validation and retry logic for LLM calls to handle empty/null responses and API errors more gracefully		
2026-03-24T08:43:01.642666+00:00	exp_202603240843_cb2f	0.882227	0.000000	+0.000000	pending	code	Adding robust validation and retry logic for LLM calls will reduce ValueError and BadRequestError occurrences from empty		
2026-03-24T08:52:53.489065+00:00	exp_202603240852_5176	0.882227	0.000000	+0.000000	pending	code	Adding robust validation and error recovery for LLM calls will reduce ValueError and BadRequestError occurrences by catc		
2026-03-24T08:53:37.723699+00:00	exp_202603240853_022c	0.882227	0.000000	+0.000000	pending	code	Adding robust validation and retry logic for LLM calls will reduce the frequency of ValueError and BadRequestError error		
2026-03-24T09:02:50.012444+00:00	exp_202603240902_b384	0.882239	0.000000	+0.000000	pending	code	Implementing robust validation and retry logic for LLM calls to handle ValueError and BadRequestError more gracefully wi		
2026-03-24T09:03:09.459401+00:00	exp_202603240903_a0cb	0.882239	0.000000	+0.000000	pending	code	Adding robust validation and retry logic for LLM calls will reduce BadRequestError and ValueError occurrences		
2026-03-24T09:03:13.857294+00:00	exp_202603240903_08ca	0.882239	0.000000	+0.000000	pending	code	Adding robust validation and retry logic for LLM calls will help handle empty/null responses and BadRequestError excepti		
2026-03-24T09:04:01.584025+00:00	exp_202603240904_88ff	0.882239	0.882239	+0.000000	keep	skill	Stored LLM error handling improvement proposal in team memory for implementation	team_memory/llm_error_handling_improvement.md	
2026-03-24T09:04:14.240387+00:00	exp_202603240904_c3f1	0.882239	0.000000	+0.000000	pending	code	Adding robust validation and retry logic for LLM calls will handle recurring ValueError and BadRequestError from Gemini/		
2026-03-24T09:09:32.166385+00:00	exp_202603240909_1f7b	0.882239	0.882276	+0.000037	keep	skill	Enhanced techniques for web search result summarization will improve output quality and efficiency by focusing on releva	skills/advanced_web_search_summarization.md	
2026-03-24T09:09:47.643423+00:00	exp_202603240909_b3b6	0.882276	0.000000	+0.000000	pending	code	Adding robust validation and retry logic for LLM calls will reduce ValueError and BadRequestError occurrences by ensurin		
2026-03-24T09:11:10.933975+00:00	exp_202603240911_d533	0.882276	0.000000	+0.000000	pending	code	Adding robust validation and retry logic for LLM calls will reduce ValueError and BadRequestError occurrences, improving		
2026-03-24T09:12:26.139972+00:00	exp_202603240912_899f	0.882276	0.882276	+0.000000	keep	skill	Adding advanced LLM error handling techniques through a skill file will indirectly reduce the occurrence of ValueError a	skills/advanced_llm_error_handling.md	
2026-03-24T09:13:10.451715+00:00	exp_202603240913_b597	0.882276	0.882276	+0.000000	keep	skill	Improved LLM error handling by documenting best practices for handling ValueError and BadRequestError in a skill file, w	skills/advanced_llm_error_handling_best_practices.md	
2026-03-24T09:19:27.305323+00:00	exp_202603240919_2d84	0.882330	0.000000	+0.000000	pending	code	Adding robust validation and retry logic for empty/null LLM responses will reduce errors and improve reliability		
2026-03-24T09:23:17.661219+00:00	exp_202603240923_826c	0.882330	0.000000	+0.000000	pending	code	Adding validation and retry logic for LLM calls will handle None/empty responses and BadRequestErrors more effectively, 		
2026-03-24T09:29:19.222761+00:00	exp_202603240929_c963	0.882330	0.000000	+0.000000	pending	code	Adding robust validation and retry logic for LLM calls will handle empty/null responses and bad requests more gracefully		
2026-03-24T09:31:23.363080+00:00	exp_202603240931_a6cb	0.882330	0.882330	+0.000000	keep	skill	Documenting best practices for LLM error handling will reduce errors by improving response validation and retry logic	skills/llm_error_handling.md	
2026-03-24T09:38:21.222521+00:00	exp_202603240938_d648	0.882330	0.882330	+0.000000	keep	skill	Adding a skill for LLM response validation will reduce errors related to empty or None responses	skills/llm_response_validation.md	
2026-03-25T12:00:19.717107+00:00	exp_202603251200_1d04	0.692350	0.000000	+0.000000	pending	code	Adding validation and retry logic for LLM calls will handle empty/None responses and temporary API errors, reducing the 		
2026-03-25T12:00:30.491998+00:00	exp_202603251200_0988	0.692350	0.000000	+0.000000	pending	code	Adding basic validation for None/empty LLM responses will reduce ValueError occurrences by catching them early		
2026-03-25T12:00:42.794141+00:00	exp_202603251200_7d42	0.692350	0.000000	+0.000000	pending	code	Adding validation and retry logic for empty/null LLM responses will reduce the recurring ValueError errors		
2026-03-25T12:00:52.850994+00:00	exp_202603251200_f5f4	0.692350	0.000000	+0.000000	pending	code	Adding robust validation and retry logic for LLM calls will handle None/empty responses and BadRequestErrors more effect		
2026-03-25T12:01:04.418525+00:00	exp_202603251201_2006	0.692350	0.000000	+0.000000	pending	code	Adding validation and retry logic for empty/null LLM responses will reduce the recurring ValueError errors and improve t		
2026-03-26T06:00:34.186091+00:00	exp_202603260600_23a6	0.755000	0.000000	+0.000000	pending	code	Adding robust validation and retry logic for LLM calls will reduce BadRequestErrors and handle empty responses more grac		
2026-03-26T06:00:41.370692+00:00	exp_202603260600_ce65	0.755000	0.000000	+0.000000	pending	code	Adding validation for None/empty LLM responses will reduce the recurring ValueError errors seen in the error patterns		
2026-03-26T06:01:06.358855+00:00	exp_202603260601_eac5	0.755000	0.000000	+0.000000	pending	code	Adding basic validation for LLM responses will reduce ValueError occurrences when processing empty or None responses		
2026-03-26T08:36:37.644888+00:00	exp_202603260601_6eba	0.500000	0.757179	+0.257179	keep	skill	Adding advanced web search summarization techniques will improve response quality by better synthesizing multiple search	skills/advanced_web_search_summarization.md	
2026-03-28T18:00:13.543647+00:00	exp_202603281800_1d23	0.743846	0.000000	+0.000000	pending	code	Adding validation and retry logic for LLM responses will reduce ValueError and BadRequestError occurrences by gracefully		
2026-03-28T18:03:54.175481+00:00	exp_202603281803_019f	0.743846	0.000000	+0.000000	pending	code	Adding validation and retry logic for LLM responses will reduce ValueError instances from None or empty responses and ha		
2026-03-28T18:04:25.907485+00:00	exp_202603281804_688b	0.743846	0.000000	+0.000000	pending	code	Adding validation and retry logic for LLM calls will reduce ValueError and BadRequestError occurrences by handling None/		
2026-03-28T18:04:34.960423+00:00	exp_202603281804_8428	0.743846	0.000000	+0.000000	pending	code	Adding validation for None/empty LLM responses will reduce ValueError occurrences and improve reliability		
2026-03-28T18:20:18.559016+00:00	exp_202603281820_2ce7	0.743846	0.000000	+0.000000	pending	code	Adding validation and retry logic for LLM responses will reduce ValueError occurrences related to None/empty responses.		
2026-03-29T12:12:42.393749+00:00	exp_202603291200_b401	0.500000	0.773846	+0.273846	keep	skill	Adding advanced techniques for handling empty/None LLM responses will reduce ValueError occurrences and improve task suc	skills/llm_response_validation.md	
2026-03-29T12:13:58.832791+00:00	exp_202603291213_a895	0.773846	0.773846	+0.000000	keep	skill	Documenting LLM response validation best practices will help reduce ValueError and BadRequestError rates by providing cl	skills/llm_response_validation.md	
2026-03-29T12:14:24.637442+00:00	exp_202603291214_7adb	0.779846	0.000000	+0.000000	pending	code	Adding robust validation and retry logic for LLM calls will reduce ValueError and BadRequestError occurrences for empty/		
2026-03-29T16:27:59.570035+00:00	exp_202603291627_4604	0.779846	0.000000	+0.000000	pending	code	Adding robust validation for LLM responses will reduce ValueError and BadRequestError instances		
2026-03-29T16:28:19.766039+00:00	exp_202603291628_226f	0.779846	0.000000	+0.000000	pending	code	Adding validation and retry logic for LLM responses will reduce ValueError and BadRequestError rates by handling empty/N		
2026-03-29T16:28:35.044529+00:00	exp_202603291628_7c14	0.779846	0.000000	+0.000000	pending	code	Adding validation and retry logic for empty/null LLM responses will reduce ValueError occurrences in research and handle		
2026-03-29T16:31:41.602463+00:00	exp_202603291629_5771	0.773846	0.783846	+0.010000	keep	skill	Documenting best practices for handling empty or None LLM responses will help agents handle this error type more gracefu	skills/handling_empty_llm_responses.md	
2026-03-29T16:31:59.451914+00:00	exp_202603291631_5ac7	0.786703	0.000000	+0.000000	pending	code	Adding validation and retry logic for None/empty LLM responses will reduce ValueError occurrences by catching these case		
2026-03-29T16:32:13.599669+00:00	exp_202603291632_1b05	0.786703	0.000000	+0.000000	pending	code	Adding validation for None/empty LLM responses will reduce ValueError		
2026-03-29T16:32:22.817264+00:00	exp_202603291632_1e8f	0.786703	0.000000	+0.000000	pending	code	Adding robust validation and retry logic for LLM responses will reduce recurring ValueErrors from empty/None responses		
2026-03-29T16:32:37.451026+00:00	exp_202603291632_c547	0.786703	0.000000	+0.000000	pending	code	Adding validation and retry logic for empty/None LLM responses will reduce ValueError occurrences and improve task succe		
2026-03-29T16:32:50.223177+00:00	exp_202603291632_8dc5	0.786703	0.000000	+0.000000	pending	code	Adding validation and retry logic for LLM responses will reduce ValueError occurrences from None/empty responses		
2026-03-29T16:33:10.118072+00:00	exp_202603291633_8cc5	0.786703	0.000000	+0.000000	pending	code	Adding robust validation and retry logic for LLM responses will reduce ValueErrors caused by None/empty responses and im		
2026-03-29T16:33:52.459582+00:00	exp_202603291633_8720	0.786703	0.000000	+0.000000	pending	code	Adding robust validation and retry logic for LLM responses will reduce ValueError and BadRequestError occurrences by cat		
2026-03-29T16:34:08.009046+00:00	exp_202603291634_8bdb	0.786703	0.000000	+0.000000	pending	code	Adding robust validation and retry logic for LLM responses will reduce ValueError and BadRequestError occurrences.		
2026-03-30T00:01:15.909644+00:00	exp_202603300001_1878	0.786703	0.000000	+0.000000	pending	code	Adding robust validation and retry logic for LLM calls will reduce ValueError occurrences from None/empty responses by i		
2026-03-30T00:01:30.868283+00:00	exp_202603300001_1acb	0.786703	0.000000	+0.000000	pending	code	Adding validation and retry logic for LLM responses will reduce ValueError and BadRequestError occurrences, improving ta		
2026-03-30T00:01:39.504969+00:00	exp_202603300001_73b5	0.786703	0.000000	+0.000000	pending	code	Adding input validation for LLM responses will reduce ValueError occurrences by catching None/empty responses before the		
2026-03-30T06:00:26.700923+00:00	exp_202603300600_512b	0.786703	0.000000	+0.000000	pending	code	Adding response validation and retry logic for LLM calls will reduce ValueError occurrences and improve task success rat		
2026-03-30T06:00:54.392706+00:00	exp_202603300600_bd57	0.786703	0.000000	+0.000000	pending	code	Adding validation and retry logic for LLM responses will reduce ValueErrors due to None/empty responses and improve API 		
2026-03-30T06:02:27.442316+00:00	exp_202603300601_1a24	0.500000	0.775721	+0.275721	keep	skill	Adding robust validation and retry logic for LLM responses will reduce ValueErrors related to None or empty responses, i	skills/llm_response_validation.md	
2026-03-30T06:02:40.463556+00:00	exp_202603300602_f43c	0.778846	0.000000	+0.000000	pending	code	Adding robust validation and retry logic for invalid LLM responses (None/empty) will reduce error rate and improve relia		
2026-03-30T06:03:10.142658+00:00	exp_202603300603_3db9	0.778846	0.000000	+0.000000	pending	code	Adding robust validation and retry logic for LLM responses will reduce ValueError and BadRequestError occurrences by pro		
2026-03-30T11:28:36.363471+00:00	exp_202603301020_bc30	0.775721	0.780476	+0.004755	keep	skill	Adding best practices for handling Openrouter API errors will reduce BadRequestErrors and invalid responses	skills/openrouter_error_handling.md	
2026-03-30T11:28:45.959413+00:00	exp_202603301128_d977	0.757976	0.000000	+0.000000	pending	code	Adding robust validation and retry logic for LLM responses will reduce ValueError: Invalid response from LLM call - None		
2026-03-30T11:28:58.548275+00:00	exp_202603301128_0080	0.757976	0.000000	+0.000000	pending	code	Adding robust validation and retry logic for LLM responses will reduce ValueError occurrences from None/empty responses,		
2026-03-30T11:29:06.522517+00:00	exp_202603301129_0c1d	0.757976	0.000000	+0.000000	pending	code	Adding robust validation and retry logic for LLM responses will reduce recurring ValueError and BadRequestError by ensur		
2026-03-30T11:29:23.576905+00:00	exp_202603301129_2059	0.757976	0.000000	+0.000000	pending	code	Adding robust validation and retry logic for LLM responses will reduce ValueError and BadRequestError occurrences by val		
2026-03-30T11:31:23.798069+00:00	exp_202603301131_beb1	0.757976	0.000000	+0.000000	pending	code	Adding validation and retry logic for empty LLM responses will reduce ValueErrors and increase task success rate		
2026-03-30T11:31:36.413667+00:00	exp_202603301131_1194	0.757976	0.000000	+0.000000	pending	code	Adding robust validation and retry logic for LLM responses will reduce ValueError occurrences from empty/None responses		
2026-03-30T11:31:51.392555+00:00	exp_202603301131_4487	0.757976	0.000000	+0.000000	pending	code	Adding explicit validation and retry logic for LLM responses will reduce ValueError occurrences and improve task success		
2026-03-30T11:32:03.669276+00:00	exp_202603301132_d6bc	0.757976	0.000000	+0.000000	pending	code	Adding explicit dependency installation checks and fallback imports will reduce ImportError and ModuleNotFoundError occu		
2026-03-30T11:32:07.972717+00:00	exp_202603301132_4512	0.757976	0.000000	+0.000000	pending	code	Adding explicit validation and retry logic for LLM responses will reduce ValueError occurrences by ensuring invalid resp		
2026-03-30T11:32:32.920117+00:00	exp_202603301132_ddbc	0.757976	0.000000	+0.000000	pending	code	Adding explicit validation and retry logic for LLM responses will reduce error rates by gracefully handling invalid or e		
2026-03-30T11:32:39.309748+00:00	exp_202603301132_bcbc	0.757976	0.000000	+0.000000	pending	code	Adding explicit validation and retry logic for LLM responses will reduce the occurrence of ValueError and BadRequestErro		
2026-03-30T12:00:37.506118+00:00	exp_202603301200_a5c2	0.757976	0.000000	+0.000000	pending	code	Adding explicit validation and retry logic for empty LLM responses will reduce error rate and improve reliability		
2026-03-30T12:00:58.611416+00:00	exp_202603301200_e117	0.757976	0.000000	+0.000000	pending	code	Adding explicit validation and retry logic for empty LLM responses will reduce the recurring ValueError errors by implem		
2026-03-30T12:01:19.286438+00:00	exp_202603301201_12da	0.757976	0.000000	+0.000000	pending	code	Adding explicit validation and retry logic for empty LLM responses will reduce error rate by catching and retrying faile		
2026-03-30T12:01:51.216260+00:00	exp_202603301201_8930	0.757976	0.000000	+0.000000	pending	code	Adding validation and retry logic for LLM responses will reduce errors caused by None or empty responses and Openrouter 		
2026-03-30T12:33:34.042966+00:00	exp_202603301132_a904	0.500000	0.759167	+0.259167	keep	skill	Adding a skill file for handling incorrect or empty LLM responses will help agents recover from these errors	skills/llm_response_validation.md	
2026-03-30T12:33:46.386485+00:00	exp_202603301233_476c	0.761212	0.000000	+0.000000	pending	code	Adding explicit validation and retry logic for LLM responses will reduce error rate and improve task success rate		
2026-03-30T12:34:02.738338+00:00	exp_202603301234_230f	0.761212	0.000000	+0.000000	pending	code	Adding explicit validation and retry logic for empty LLM responses will reduce error rate and improve task success rate		
2026-03-31T00:00:14.893315+00:00	exp_202603310000_73f9	0.875755	0.000000	+0.000000	pending	code	Adding explicit validation and retry logic for empty LLM responses will reduce the 'Invalid response from LLM call - Non		
2026-03-31T00:00:30.271200+00:00	exp_202603310000_9541	0.875755	0.000000	+0.000000	pending	code	Adding explicit validation and retry logic for empty or None LLM responses will reduce the recurring ValueError errors r		
2026-03-31T00:00:51.162704+00:00	exp_202603310000_992b	0.875755	0.000000	+0.000000	pending	code	Adding explicit validation and retry logic for empty/None LLM responses will reduce related errors and improve reliabili		
2026-03-31T00:00:59.870877+00:00	exp_202603310000_b526	0.875755	0.000000	+0.000000	pending	code	Adding explicit validation checks for empty or None LLM responses will reduce error rate without adding complexity		
2026-03-31T00:01:24.089447+00:00	exp_202603310001_7f0e	0.875755	0.000000	+0.000000	pending	code	Adding explicit validation and retry logic for LLM responses will reduce errors from None/empty responses		
2026-03-31T00:01:54.870384+00:00	exp_202603310001_9db4	0.875755	0.000000	+0.000000	pending	code	Adding explicit validation and retry logic for LLM responses will reduce errors caused by None/empty responses and Openr		
2026-03-31T00:02:14.022882+00:00	exp_202603310002_c813	0.875755	0.000000	+0.000000	pending	code	Adding explicit validation and retry logic for LLM responses will reduce recurring ValueErrors and BadRequestErrors rela		
2026-03-31T00:02:23.503928+00:00	exp_202603310002_eea8	0.875755	0.000000	+0.000000	pending	code	Adding explicit None/empty response validation in handle_task function will reduce ValueError occurrences		
2026-03-31T00:03:28.269156+00:00	exp_202603310003_0629	0.875755	0.000000	+0.000000	pending	code	Adding validation and retry logic for empty LLM responses will reduce ValueError errors		
2026-03-31T00:03:43.280131+00:00	exp_202603310003_31ce	0.875755	0.000000	+0.000000	pending	code	Adding explicit validation and retry logic for empty/None LLM responses at the task handling level will reduce error rat		
2026-03-31T00:04:00.036058+00:00	exp_202603310003_fb4a	0.875755	0.000000	+0.000000	pending	code	Adding explicit validation and retry logic for empty/None LLM responses will reduce error rate and improve error recover		
2026-03-31T00:07:01.542909+00:00	exp_202603310007_e42c	0.876445	0.000000	+0.000000	pending	code	Adding explicit validation and retry logic for empty/None LLM responses will reduce ValueError errors by 50%		
2026-03-31T00:07:19.203400+00:00	exp_202603310007_6128	0.876445	0.000000	+0.000000	pending	code	Adding explicit validation and retry logic for None/empty LLM responses will reduce error rates and improve task success		
2026-03-31T00:07:32.211307+00:00	exp_202603310007_06ed	0.876445	0.000000	+0.000000	pending	code	Adding explicit validation and retry logic for empty/None LLM responses will reduce error rate and improve reliability		
