ts	experiment_id	metric_before	metric_after	delta	status	change_type	hypothesis	files_changed
2026-04-17T18:43:27.474900+00:00	exp_202604171843_894f	0.876835	0.876835	+0.000000	keep	skill	Adding a skill for advanced multi-step reasoning in ecological policy analysis will improve the team's ability to handle	skills/advanced_multi_step_reasoning_ecological_policy.md	
2026-04-17T20:05:06.270018+00:00	exp_202604172005_52ad	0.816268	0.816268	+0.000000	keep	skill	Adding a skill for advanced multi-step reasoning in ecological policy impact assessment will improve the team's ability 	skills/advanced_multi_step_reasoning_ecological_policy_impact_assessment.md	
2026-04-18T17:01:57.830821+00:00	exp_202604181700_626c	0.816268	0.819268	+0.003000	keep	skill	Adding comprehensive knowledge about advanced vector database optimization and retrieval augmentation (RAG) strategies w	skills/advanced_vector_database_optimization__retrieval_augmentation__ra__strategies__cd1d8f7a.md	
2026-04-18T17:25:29.825792+00:00	exp_202604181725_8703	0.819268	0.819268	+0.000000	keep	skill	Adding distillation and consolidation patterns to memory management improves retrieval efficiency and reduces storage co	skills/memory_optimization_patterns__distillation_consolidation__episodic_vs_semantic__9f8e2a1b.md	
2026-04-18T18:42:22.976425+00:00	exp_202604181842_16e9	0.814826	0.814826	+0.000000	keep	skill	The #1 error (BadRequestError - 16 occurrences) stems from using models that don't support tool calling with tool-depend	skills/model_capability_detection_and_selection_strategies.md	
2026-04-18T18:45:05.737171+00:00	exp_202604181845_3752	0.814826	0.000000	+0.000000	pending	code	Fix two critical error patterns: (1) ImportError in handle_task caused by missing __init__.py in skills directory, and (		
2026-04-18T19:37:21.427210+00:00	exp_202604181937_cee2	0.816493	0.000000	+0.000000	pending	code	Fix critical ImportError in handle_task.py caused by circular import between handle_task.py and agents/coding_agent.py (		
2026-04-18T20:36:32.203855+00:00	exp_202604182036_ca04	0.828993	0.000000	+0.000000	pending	code	Resolving circular import in handle_task.py by restructuring module dependencies and using lazy imports will eliminate 7		
2026-04-18T22:01:33.799012+00:00	exp_202604182201_6189	0.829945	0.000000	+0.000000	pending	code	Fixing two critical error patterns will significantly reduce error rate and improve system stability: (1) ImportError in		
2026-04-21T13:56:52.119475+00:00	exp_202604211355_79aa	0.814826	0.797167	-0.017659	discard	skill	Adding resilient API communication patterns will reduce TimeoutError, ConnectionError, and RuntimeError occurrences by t	skills/resilient_api_communication_patterns.md	
2026-04-21T14:39:20.355286+00:00	exp_202604211439_7f16	0.797167	0.797167	+0.000000	keep	skill	Adding LLM cost optimization strategies to help agents reduce API costs by up to 80% through prompt compression, semanti	skills/llm_cost_optimization_strategies.md	
2026-04-21T15:24:37.655376+00:00	exp_202604211519_fb68	0.797167	0.800167	+0.003000	keep	skill	Adding response synthesis optimization techniques (semantic deduplication, clustered synthesis, progressive refinement, 	skills/response_synthesis_optimization.md	
2026-04-21T16:38:32.539861+00:00	exp_202604211638_00bb	0.803167	0.803167	+0.000000	discard	code	The #1 error (BadRequestError - 16 occurrences) is caused by attempting to use tools with models that don't support them	app/llm/base.py	No improvement (delta=+0.0000), reverted
2026-04-21T17:37:29.539716+00:00	exp_202604211737_abc1	0.803167	0.803167	+0.000000	discard	code	The #1 error pattern (BadRequestError - 16 occurrences) is caused by attempting to use tools with models that don't supp	app/tools/model_capability_check.py	No improvement (delta=+0.0000), reverted
2026-04-22T12:11:47.409946+00:00	exp_202604221208_967d	0.800167	0.879759	+0.079592	keep	skill	Creating a comprehensive skill for model tool support detection and graceful degradation will reduce the #1 error patter	skills/model_tool_support_and_capability_detection.md	
2026-04-22T16:08:18.171454+00:00	exp_202604221608_57c3	0.890064	0.890064	+0.000000	keep	skill	Creating a comprehensive skill for advanced web search result synthesis and multi-source fusion will improve output qual	skills/advanced_web_search_synthesis_and_multi-source_fusion.md	
2026-04-22T17:00:48.395167+00:00	exp_202604221700_47a4	0.890064	0.890064	+0.000000	discard	code	Fixing the circular import in handle_task.py will eliminate 7 ImportError occurrences and improve system reliability, si	app/crew/handle_task.py	No improvement (delta=+0.0000), reverted
2026-04-22T18:47:58.249384+00:00	exp_202604221847_8d58	0.890064	0.890064	+0.000000	keep	skill	Creating a comprehensive ReAct and multi-step reasoning skill will reduce runtime errors in research tasks (currently 7 	skills/agentic_reasoning_patterns_react_task_decomposition.md	
2026-04-22T21:05:45.050370+00:00	exp_202604222104_f9f6	0.890064	0.896848	+0.006784	keep	skill	Equip the team with proven circular import resolution patterns to fix the recurring handle_task:ImportError (7 occurrenc	skills/circular_import_resolution_patterns.md	
2026-04-24T07:13:09.367086+00:00	exp_202604240713_d225	0.819833	0.000000	+0.000000	pending	code	Address recurring 402 'Insufficient credits' OpenRouter API errors that manifest as BadRequestError across crews. Adding		
2026-04-24T13:08:09.479909+00:00	exp_202604241307_8e52	0.819833	0.000000	+0.000000	pending	code	Fixing the circular import by creating the missing config module and restructuring imports will resolve the 7+ ImportErr		
2026-04-24T22:25:21.138732+00:00	exp_202604242225_b84a	0.821500	0.821500	+0.000000	keep	skill	Creating a skill for multi-step reasoning and complex problem decomposition will improve task success on difficult reque	skills/systematic_multi_step_reasoning_for_complex_tasks.md	
2026-04-25T12:03:35.960391+00:00	exp_202604251203_4662	0.821500	0.821500	+0.000000	discard	code	The system is experiencing recurring 'RuntimeError: Task execution failed: Error code: 402' (Insufficient credits) from 	app/core/llm_client.py	No improvement (delta=+0.0000), reverted
2026-04-26T00:06:45.270083+00:00	exp_202604260002_c728	0.794500	0.794500	+0.000000	discard	code	Implementing a robust retry mechanism with exponential backoff specifically for APIConnectionError and ConnectionError i	app/tools/research.py,app/tools/coding.py	No improvement (delta=-0.0160), reverted
